,source_url,site_name,site_url,title,img_url,description
0,,,,,,
1,https://sofrep.com/specialoperations/getting-back-to-land-nav-basics-plotting-and-planning-your-routes/,SOFREP,https://sofrep.com/specialoperations/getting-back-to-land-nav-basics-plotting-and-planning-your-routes/,Getting Back to Land  Nav Basics - Plotting and Planning Your Routes,https://cms.sofrep.com/wp-content/uploads/2017/12/Land-Navigation-plotting-1024x681.jpg,Land Navigation is a critical skill that every Special Operator must possess and if you are an aspiring member of the Special Forces Regiment
2,https://www.theepochtimes.com/kudlow-human-rights-are-very-important-part-of-the-us-china-talks_3122864.html,www.theepochtimes.com,https://www.theepochtimes.com/kudlow-human-rights-are-very-important-part-of-the-us-china-talks_3122864.html,Kudlow: Human Rights Are 'Very Important Part' of US–China Talks,https://img.theepochtimes.com/assets/uploads/2019/10/21/510A9601-1200x800.jpg,"White House economic adviser Larry Kudlow said that China’s human rights violations, as well as pro-democracy protests in Hong Kong, are key parts of the ongoing trade negotiations with Beijing."
3,https://www.defenseone.com/ideas/2019/10/how-protect-america-after-syria-withdrawal/160733/,Defense One,https://www.defenseone.com/ideas/2019/10/how-protect-america-after-syria-withdrawal/160733/,How to Protect America After the Syria Withdrawal,https://cdn.defenseone.com/media/img/upload/2019/10/21/AP_19293431396793/open-graph.jpg,"Fighting ISIS just got harder—but it’s still possible, and it’s necessary."
4,https://swarajyamag.com/news-brief/foot-soldiers-of-radical-islam-how-islamist-machinery-indoctrinates-young-kids-to-promote-terror-radicalism,,https://swarajyamag.com/news-brief/foot-soldiers-of-radical-islam-how-islamist-machinery-indoctrinates-young-kids-to-promote-terror-radicalism,"Foot-Soldiers Of Radical Islam: How Islamist Machinery Indoctrinates Young Kids To Promote Terror, Radicalism",https://images.assettype.com/swarajya/2019-10/f17e39b9-0df2-42c9-9634-56a160d986dd/CHkX6KcWoAAcJi4.jpg?w=700,Recently a video went viral of a young kid threatening to kill those who speak against Islam
5,,Middle East Forum,,Rojava Sundown: A Retrospective,https://www.meforum.org/pics/6538.jpg, The news emerging from northern Syria remains confused. There are now fighters from five separate armies maneuvering in the area between the Euphrates River and the Syrian-Turkish and Syrian-Iraqi borders. These are the invading Turkish-Sunni Islamist
6,https://www.southernminn.com/faribault_daily_news/opinion/article_0058d75d-6632-5eba-9db9-4f056c019ef9.html,Southernminn.com,https://www.southernminn.com/faribault_daily_news/opinion/article_0058d75d-6632-5eba-9db9-4f056c019ef9.html,Will the Supreme Court sanction the use of a religious litmus test for foster parents?,https://bloximages.newyork1.vip.townnews.com/southernminn.com/content/tncms/assets/v3/editorial/e/b0/eb0c2e44-02ea-521b-bdf8-1f15ebc13879/5dadc91f60a86.image.jpg?resize=492%2C630,"There are currently 440,000 children in foster care across the country. And the Supreme Court has been asked to hear Fulton v. City of Philadelphia, a case that could profoundly"
7,https://townhall.com/tipsheet/bethbaumann/2019/10/20/bernie-when-im-president-i-wont-just-be-commander-in-chief-ill-also-be-organizer-in-chief-n2555061,Townhall ,https://townhall.com/tipsheet/bethbaumann/2019/10/20/bernie-when-im-president-i-wont-just-be-commander-in-chief-ill-also-be-organizer-in-chief-n2555061,"Bernie: When I'm President I Won't Just Be Commander In Chief, I'll Also Be Organizer In Chief",https://media.townhall.com/townhall/reu/s1280x720/2019/154/b11be828-c189-45bf-b167-4a6d74f1f06f.png,"Oh, okay."
8,https://www.inform.kz/en/article/3577353,,https://www.inform.kz/en/article/3577353,Belarus President to pay official visit to Kazakhstan,https://www.inform.kz/radmin/news/2019/10/21/191021114539739a3577353i.jpg,"MINSK. KAZINFORM - President of Belarus Aleksandr Lukashenko will pay an official visit to Kazakhstan on October 24-25, BelTA reported."
9,,,,,,
10,http://www.who.int/pmnch/media/news/2019/uhc-resolution-a-boost/en/,World Health Organization,http://www.who.int/pmnch/media/news/2019/uhc-resolution-a-boost/en/,"IPU resolution on universal health coverage a boost for women’s, children’s and adolescents’ health",http://www.who.int/about/Logo-WHO.jpg,
11,https://www.nydailynews.com/new-york/nyc-crime/ny-knapp-commission-lawyer-michael-armstrong-20191021-qqxkiozs4zgufokoxhdrxlvztq-story.html,nydailynews.com,https://www.nydailynews.com/new-york/nyc-crime/ny-knapp-commission-lawyer-michael-armstrong-20191021-qqxkiozs4zgufokoxhdrxlvztq-story.html,"Michael Armstrong, chief counsel for the Knapp Commission, which exposed NYPD corruption in the 1970s, dies at 86",https://www.nydailynews.com/resizer/qB4n-1wwXXqDuci26ZhnYIWbg0U=/1200x0/top/arc-anglerfish-arc2-prod-tronc.s3.amazonaws.com/public/TBW6AFRYQNHAJDWBV7UUGSSQLA.JPG,"Michael Armstrong, the storied Manhattan attorney who helped expose a culture of NYPD as the chief counsel for the Knapp Commission in the 1970s, died Thursday at 86 years old."
12,https://www.thenational.ae/world/mena/as-us-forces-withdraw-from-syria-kurds-await-putin-erdogan-meeting-1.926515,The National,https://www.thenational.ae/world/mena/as-us-forces-withdraw-from-syria-kurds-await-putin-erdogan-meeting-1.926515,"As US forces withdraw from Syria, Kurds await Putin-Erdogan meeting",https://www.thenational.ae/image/policy:1.911136:1571660239/image.jpg?f=16x9&q=0.6&w=1200&$p$f$q$w=70c86c9,Dozens of American trailers and military vehicles loaded with equipment crossed into Iraq on Monday
13,https://www.standardmedia.co.ke/article/2001346311/criminals-now-turn-to-security-guards-to-withdraw-stolen-cash,The Standard,https://www.standardmedia.co.ke/article/2001346311/criminals-now-turn-to-security-guards-to-withdraw-stolen-cash,Criminals now turn to security guards to withdraw stolen cash : The Standard,http://www.standardmedia.co.ke/images/monday/thumb_criminals_now_turn_t5daddd93d04a9.png,Criminals have resorted to using security guards to withdraw cash from Automated Teller Machines (ATMs) to avoid being captured by CCTV cameras.
14,https://www.enidnews.com/news/multimillion-dollar-settlement-reached-in-jail-death-suit/article_4161548c-f451-11e9-a3df-734f15bb0e6c.html,Enidnews.com,https://www.enidnews.com/news/multimillion-dollar-settlement-reached-in-jail-death-suit/article_4161548c-f451-11e9-a3df-734f15bb0e6c.html,Multimillion-dollar settlement reached in jail death suit,https://bloximages.chicago2.vip.townnews.com/enidnews.com/content/tncms/assets/v3/editorial/5/9b/59bcf0c3-3aef-551a-88fa-b4d1d178d019/593b225feb0a3.image.jpg?crop=450%2C254%2C0%2C230&resize=450%2C254&order=crop%2Cresize,"Jennifer Niles, Shawn Caleb Galusha and John Robert Markus were charged with manslaughter, entered guilty pleas and were ordered to serve 55 hours in jail, pay fines and court costs."
15,https://www.christianpost.com/news/kanye-west-to-release-jesus-is-king-imax-only-film-on-friday.html,,https://www.christianpost.com/news/kanye-west-to-release-jesus-is-king-imax-only-film-on-friday.html,Kanye West to release ‘Jesus is King’ IMAX-only film on Friday,https://cdn.christianpost.com/files/original/thumbnail/23/35/233525.jpg,"Kanye West will release an IMAX-only Gospel-themed film titled “Jesus is King,” based off of the Sunday services that the famed rapper has been overseeing this year."
16,https://www.thenews.com.pk/print/544031-spanish-pm-under-pressure-over-catalan-violent-protests,,https://www.thenews.com.pk/print/544031-spanish-pm-under-pressure-over-catalan-violent-protests,Spanish PM under pressure over Catalan violent protests,https://www.thenews.com.pk/assets/front/img/no-img-fb.jpg,"BARCELONA: Ahead of next month´s general election, Spain´s Socialist Prime Minister Pedro Sanchez faced sharp criticism Sunday for his handling of violent Catalan separatist protests..."
17,,,,,,
18,https://www.greensboro.com/news/national/sudanese-rebel-groups-seek-peace-after-years-of-fighting/article_83baffd0-5396-5fbd-ae4f-affb5b3133b2.html,Greensboro News and Record,https://www.greensboro.com/news/national/sudanese-rebel-groups-seek-peace-after-years-of-fighting/article_83baffd0-5396-5fbd-ae4f-affb5b3133b2.html,404 Error,https://bloximages.newyork1.vip.townnews.com/greensboro.com/content/tncms/custom/image/be6ce48e-f2f4-11e6-9c60-8f5f074fddfd.jpg,This page no longer exists or has been removed
19,,Carnegie Moscow Center,,"No, Putin Doesn’t Like Impeachment",https://carnegieendowment.org/images/article_images/putin_trump.jpg,There’s one thing the Kremlin wants even more than sowing chaos in the United States: Keeping Trump in the White House.
20,https://www.fredericknewspost.com/public/manslaughter-charge-added-against-teen-arrested-in-deadly-great-frederick/article_2e0e6f03-eb35-559d-9430-b6307e891f32.html,The Frederick News-Post ,https://www.fredericknewspost.com/public/manslaughter-charge-added-against-teen-arrested-in-deadly-great-frederick/article_2e0e6f03-eb35-559d-9430-b6307e891f32.html,Manslaughter charge added against teen arrested in deadly Great Frederick Fair assault,https://bloximages.newyork1.vip.townnews.com/fredericknewspost.com/content/tncms/assets/v3/editorial/d/d3/dd314c1f-0df1-50e1-8b86-9e2f00d2b65d/5dadc168a4e55.image.jpg?resize=887%2C630,Prosecutors have added a manslaughter charge against the 15-year-old Frederick resident arrested last month after a fatal assault at The Great Frederick Fair.
21,,,,,,
22,https://colombiareports.com/us-refusing-to-cooperate-with-colombia-in-uribe-investigation-report/,Colombia News | Colombia Reports,https://colombiareports.com/us-refusing-to-cooperate-with-colombia-in-uribe-investigation-report/,US refusing to cooperate with Colombia in Uribe investigation: report,https://colombiareports.com/wp-content/uploads/2019/07/noturibe.jpg,"The US government is refusing to cooperate with Colombia’s Supreme Court that is investigating former President Alvaro Uribe on fraud and bribery charges, according to weekly Semana. Supreme Court magistrate…"
23,,TOLOnews,,Khalilzad On Diplomatic Trail Again For Afghan Peace Effort | TOLOnews,https://tolonews.com/sites/default/files/zal_0.jpg,"Khalilzad is traveling to Belgium, France, and Russia to discuss peace in Afghanistan.                                

"
24,,,,,,
25,https://pragativadi.com/woman-peos-death-12-hour-bandh-in-jajpur/,Pragativadi: Leading Odia Dailly,https://pragativadi.com/woman-peos-death-12-hour-bandh-in-jajpur/,Woman PEO’s death: 12-hour bandh in Jajpur - Pragativadi: Leading Odia Dailly,https://pragativadi.com/wp-content/uploads/2019/01/08TH-TYRE.jpg,"A 12-hour bandh is being observed in Jajpur over the demand of CBI probe into the death of Haridaspur VLW and in-charge PEO, Smitarani Biswal."
26,https://www.independentmail.com/story/news/2019/10/21/part-anderson-county-sc-home-states-second-lowest-household-income/3996276002/,Independent Mail,https://www.independentmail.com/story/news/2019/10/21/part-anderson-county-sc-home-states-second-lowest-household-income/3996276002/,Anderson's 'forgotten area': Homeland Park median household income sinks to state's second-lowest,"https://www.gannett-cdn.com/presto/2019/10/16/PAIM/d5497ecb-c055-4158-b718-4d367cd96d4a-1016_Anderson_29624_Homeland_Park_052.JPG?crop=2399,1349,x0,y151&width=1600&height=800&fit=bounds",The 29624 zip code in Anderson County has the second-lowest household income in the state. The bulk of that zip code resides in Homeland Park.
27,,,,,,
28,https://www.biznews.com/thought-leaders/2019/10/21/deception-incompetence-spy-trojan-horse,BizNews.com,https://www.biznews.com/thought-leaders/2019/10/21/deception-incompetence-spy-trojan-horse,From deception to incompetence; The Trojan horse of SA’s spy chiefs - BizNews.com,https://www.biznews.com/wp-content/uploads/2019/10/Ayandla-Dlodlo.jpg,"According to Muhammed Sayed, when you pick apart the droppings of this media Trojan Horse, there’s not very much substance to be found."
29,,,,,https://www.photonics.com/images/Web/Webinars/200/thumbnail.jpg,
30,https://www.nation.co.ke/news/world/Bangladesh-MP-hired-lookalikes-to-take-university-exams/1068-5319684-emvdp7z/index.html,Daily Nation,https://www.nation.co.ke/news/world/Bangladesh-MP-hired-lookalikes-to-take-university-exams/1068-5319684-emvdp7z/index.html,MP 'hired lookalikes' for university exams,https://www.nation.co.ke/image/view/-/5319700/medRes/2473311/-/11r2domz/-/pic.jpg,Lawmaker said to have hired as many as eight lookalikes to take exams in her place.
31,,,,,,
32,https://www.bbc.com/news/world-australia-50119559,BBC News,https://www.bbc.com/news/world-australia-50119559,Australian newspapers black out own front pages,https://ichef.bbci.co.uk/news/1024/branded_news/1748/production/_109306950_sdsdfsdf.jpg,The nation's biggest media rivals unite to protest against what they say is government secrecy.
33,https://www.hellomagazine.com/royalty/2019102179446/camilla-parker-bowles-japan-enthronement/,HELLO!,https://www.hellomagazine.com/royalty/2019102179446/camilla-parker-bowles-japan-enthronement/,Why the Duchess of Cornwall isn't going to Japan with Prince Charles,https://www.hellomagazine.com/imagenes/royalty/2019102179446/camilla-parker-bowles-japan-enthronement/0-383-746/camilla-t.jpg,The Prince of Wales will attend the ceremony of enthronement of Emperor Naruhito without his wife Camilla
34,https://www.lrt.lt/en/news-in-english/19/1108632/nauseda-consolidates-position-as-most-popular-politician-in-lithuania-survey,lrt.lt,https://www.lrt.lt/en/news-in-english/19/1108632/nauseda-consolidates-position-as-most-popular-politician-in-lithuania-survey,Nausėda consolidates position as most popular politician in Lithuania – survey,https://www.lrt.lt/img/2019/10/19/534018-233609-1287x836.jpg,"Lithuanian President Gitanas Nausėda further consolidated his position as the most popular politician in the country in October, according to the latest survey by the Vilmorus pollster for the Lietuvos Rytas daily."
35,https://www.12newsnow.com/article/news/local/vidor-high-gives-band-of-the-week-award-to-barbers-hill-to-honor-late-band-director/502-84b76be1-b917-4921-a091-535de866efc4,KBMT,https://www.12newsnow.com/article/news/local/vidor-high-gives-band-of-the-week-award-to-barbers-hill-to-honor-late-band-director/502-84b76be1-b917-4921-a091-535de866efc4,'Incredibly kind' | Vidor High gives Band of the Week award to Barbers Hill to honor late band director,https://media.12newsnow.com/assets/KJAC/images/3cc22b71-e2a5-47a2-8eff-a46aaf280b04/3cc22b71-e2a5-47a2-8eff-a46aaf280b04_1140x641.jpg,"Johnson taught at Vidor, Little Cypress-Mauriceville and Nederland before his time at Barbers Hill."
36,https://gazette.com/news/u-s-rep-doug-lamborn-signs-on-to-bill-to/article_6f3b6d75-8510-538b-8d14-263893379389.html,Colorado Springs Gazette,https://gazette.com/news/u-s-rep-doug-lamborn-signs-on-to-bill-to/article_6f3b6d75-8510-538b-8d14-263893379389.html,U.S. Rep. Doug Lamborn signs on to bill to sanction Turkey,https://bloximages.newyork1.vip.townnews.com/gazette.com/content/tncms/assets/v3/editorial/3/8b/38b6e069-1ab5-5ac8-9358-b6c39be70a58/5c7dca2c43e18.image.jpg?resize=1034%2C630,"U.S. Rep. Doug Lamborn from Colorado Springs has been one of President Trump's most reliable allies, but now he's taking steps to intervene in the conflict unleashed when his fellow"
37,https://www.forbes.com/sites/isabeltogoh/2019/10/21/jeffrey-epstein-had-13-different-contact-numbers-for-former-friend-prince-andrew/,Forbes,https://www.forbes.com/sites/isabeltogoh/2019/10/21/jeffrey-epstein-had-13-different-contact-numbers-for-former-friend-prince-andrew/,Jeffrey Epstein Had 13 Different Numbers For Former Friend Prince Andrew,https://thumbor.forbes.com/thumbor/600x315/https%3A%2F%2Fspecials-images.forbesimg.com%2Fimageserve%2F109823159%2F960x0.jpg,"A U.K. documentary detailing the 12-year friendship between the senior royal and the sex offender shows the extent of their encounters both in the U.S., the U.K. and on Epstein's private island."
38,https://www.standard.co.uk/news/politics/minister-admits-mps-being-asked-to-approve-brexit-without-knowing-full-economic-damage-a4266716.html,Evening Standard,https://www.standard.co.uk/news/politics/minister-admits-mps-being-asked-to-approve-brexit-without-knowing-full-economic-damage-a4266716.html,MPs 'asked to approve Brexit without knowing full economic damage',https://static.standard.co.uk/s3fs-public/thumbnails/image/2019/10/21/11/sunilrishi2110.jpg,"A Cabinet minister admitted today that MPs are being asked to approve the Government’s plan to split from the EU with no specific assessment of the long-term harm it could inflict on the economy. Rishi Sunak, Chief Secretary to the Treasury, faced a barrage of questions this morning about the economic impact of the free trade agreement which ministers want to strike with Brussels. "
39,http://www.globenewswire.com/news-release/2019/10/21/1932606/0/en/Miry-s-List-Honors-Chef-Roy-Choi-with-2019-Gratitude-Award.html,GlobeNewswire News Room,http://www.globenewswire.com/news-release/2019/10/21/1932606/0/en/Miry-s-List-Honors-Chef-Roy-Choi-with-2019-Gratitude-Award.html,Miry’s List Honors Chef Roy Choi with 2019 Gratitude Award,,Actor Jenna Fischer to Host Miry’s List Gratitude Gala on November 18th
40,https://www.kalb.com/content/news/Alexandria-man-to-receive-15-years-for-2018-fatal-Broadway-Avenue-crash-563553831.html ,,https://www.kalb.com/content/news/Alexandria-man-to-receive-15-years-for-2018-fatal-Broadway-Avenue-crash-563553831.html ,Alexandria man to receive 15 years for 2018 fatal Broadway Avenue crash,https://media.graytvinc.com/images/THIS+GUY00000000.jpg,"An Alexandria man charged in a March 2018 fatal crash on Broadway Avenue, that claimed the lives of a 27-year-old woman and her 6-year-old son, will receive 15 years in prison for the crime."
41,,"Oakridger - Oak Ridge, TN",,"Roane State building renamed for Ken Yager, lifelong public servant",https://www.oakridger.com/storyimage/TN/20191021/NEWS/191029993/AR/0/AR-191029993.jpg,"From members of his Sunday School class to lieutenant governors, from fellow Rockwood Civitan Club members to the chancellor of the Tennessee Board of"
42,https://www.accessnow.org/whyid/,Access Now,https://www.accessnow.org/whyid/,#WhyID - Join us!,https://www.accessnow.org/cms/assets/uploads/2019/11/WHy-ID-FB-thumbnail.jpg,"An open letter to the leaders of international development banks, the United Nations, international aid organisations, funding agencies, and national governments:"
43,https://tass.com/politics/1084423,TASS,https://tass.com/politics/1084423,Militants from Idlib de-escalation zone plan to unleash active hostilities,https://phototass3.cdnvideo.ru/width/1200_4ce85301/tass/m2/en/uploads/i/20191022/1234864.jpg,"According to earlier reports, Russian observers reported 15 ceasefire violations by militants in the provinces of Latakia, Aleppo, Idlib and Hama on October 20"
44,https://dentonrc.com/opinion/editorials/guest-view-atatiana-jefferson-had-a-right-to-a-gun/article_50bfbcdb-b0a6-53e2-bb90-e2985344865f.html,Denton Record-Chronicle,https://dentonrc.com/opinion/editorials/guest-view-atatiana-jefferson-had-a-right-to-a-gun/article_50bfbcdb-b0a6-53e2-bb90-e2985344865f.html,Guest view: Atatiana Jefferson had a right to a gun,https://bloximages.newyork1.vip.townnews.com/dentonrc.com/content/tncms/assets/v3/editorial/8/d5/8d5db981-19c5-55d5-bfce-62c3d085923f/5d3ad884444d6.image.jpg?resize=724%2C483,This editorial first appeared in The Dallas Morning News. Guest editorials don’t necessarily reflect the Denton Record-Chronicle’s opinions.
45,https://dailycaller.com/2019/10/21/ukraine-business-oleksandr-onyshchenko-burisma-natural-gas-hunter-biden/,,https://dailycaller.com/2019/10/21/ukraine-business-oleksandr-onyshchenko-burisma-natural-gas-hunter-biden/,Ukrainian Businessman Says Gas Company Hired Hunter Biden For Protection,https://cdn01.dailycaller.com/wp-content/uploads/2019/09/joe-biden-hunter-biden-e1569255442164.jpg,"A former member of the Ukrainian parliament says Burisma Holdings hired Hunter Biden for protection, according to a Reuters report."
46,https://www.pulse.com.gh/bi/politics/uhuru-now-backs-off-from-setting-up-an-oil-refinery-in-northern-kenya/r9thlgd,,https://www.pulse.com.gh/bi/politics/uhuru-now-backs-off-from-setting-up-an-oil-refinery-in-northern-kenya/r9thlgd,Kenya backs off from the idea of setting up its own oil refinery and turns its energy on utilising Lamu port to export crude oil,https://ocdn.eu/pulscms-transforms/1/jUQktkpTURBXy84NzVhZDA0OTdhODdlN2Q4MDVlYmUwZjg2YzZhN2VlNi5qcGeSlQMAHs0DwM0CHJMFzQSwzQJ2,
47,https://dailycaller.com/2019/10/21/ukraine-business-oleksandr-onyshchenko-burisma-natural-gas-hunter-biden/,,https://dailycaller.com/2019/10/21/ukraine-business-oleksandr-onyshchenko-burisma-natural-gas-hunter-biden/,Ukrainian Businessman Says Gas Company Hired Hunter Biden For Protection,https://cdn01.dailycaller.com/wp-content/uploads/2019/09/joe-biden-hunter-biden-e1569255442164.jpg,"A former member of the Ukrainian parliament says Burisma Holdings hired Hunter Biden for protection, according to a Reuters report."
48,https://www.dailytrust.com.ng/seizure-of-assets-court-misled-into-granting-temporary-forfeiture-order-saraki.html,Daily Trust,https://www.dailytrust.com.ng/seizure-of-assets-court-misled-into-granting-temporary-forfeiture-order-saraki.html,Seizure of Assets: Court misled into granting temporary forfeiture order — Saraki – Daily Trust,https://cdn.dailytrust.com.ng/wp-content/uploads/2019/02/Senate-president-Dr-Bukola-Saraki.jpg,"Former Senate President, Dr. Abubakar Bukola Saraki has faulted an order granted by a Federal High Court in Lagos for a temporary forfeiture of his property on 17A McDonald Road, Ikoyi, following an ex-parte application by the  Economic and Financial Crimes Commission (EFCC). The former Senate President in a statement by his Special Adviser (Media …"
49,https://www.nbcdfw.com/news/national-international/gop-split-over-impeachment-push-back-as-dems-plow-ahead/228442/,NBC 5 Dallas-Fort Worth,https://www.nbcdfw.com/news/national-international/gop-split-over-impeachment-push-back-as-dems-plow-ahead/228442/,McConnell: Senate Must Take Up Impeachment If House Approves,https://media.nbcdfw.com/2019/09/mcconnell12.jpg?resize=1200%2C675,"Republican Leader Mitch McConnell said Monday that Senate rules would require him to take up any articles of impeachment against President Donald Trump if approved by the House, swatting down talk that that the GOP-controlled chamber could dodge the matter entirely. “I would have no choice but to take it up,” McConnell said on CNBC. But he cautioned, “How long you’re on it is a whole different matter.” House Democrats are pushing for quick action on their probe into a phone transcript and whistleblower complaint that Trump pressured Ukraine’s president to investigate Democratic foe Joe Biden’s family."
50,,,,,,
51,,,,,,
52,https://channel933.iheart.com/content/man-invents-electric-car-battery-that-lasts-1500-miles-per-charge/,Channel 933,https://channel933.iheart.com/content/man-invents-electric-car-battery-that-lasts-1500-miles-per-charge/,"Man Invents Electric Car Battery that Lasts 1,500 Miles Per Charge | Channel 933",https://i.iheart.com/v3/re/new_assets/5dadf43ac528025f8ce61ade,"Trevor Jackson, 58 from Tavistock, Devon, England, invented a game-changing aluminum-air fuel cell battery that can power semi-trucks, buses, propeller planes, and yes, electric cars! "
53,,,,,,
54,https://bethesdamagazine.com/jobs/brewery-sales-representative-mid-atlantic/,Bethesda Magazine,https://bethesdamagazine.com/jobs/brewery-sales-representative-mid-atlantic/,Brewery Sales Representative - Mid-Atlantic | Bethesda Magazine,,"Brewery Sales Representative – Mid-Atlantic Washington, D.C. Date posted: Oct-Mon-2019 Date posted: Oct-Mon-2019 We are The Boston Beer Company and together we are heavy. We are eager to find competitive, motivated, hardworking people who love beer and who are willing to relocate. Think you have what it takes? We are currently looking for entry level …"
55,https://www.panorama.am/en/news/2019/10/21/Air-France-emergency-landing/2184362,,https://www.panorama.am/en/news/2019/10/21/Air-France-emergency-landing/2184362,Air France jet carrying imperial ceremony guest makes emergency landing at Tokyo's Haneda,https://panorama.am/news_images/729/2184362_3/f5dad72f56d5c7_5dad72f56d609.thumb.jpg,Air France jet carrying imperial ceremony guest makes emergency landing at Tokyo's Haneda
56,http://news.trust.org/item/20191021150953-uhldq/,news.trust.org,http://news.trust.org/item/20191021150953-uhldq/,Pentagon chief visits Saudi Arabia as tensions simmer with Iran,"https://d2sh4fq2xsdeg9.cloudfront.net/contentAsset/image/c6661155-a5d0-495c-ade7-d94f6fbd4a38/image/byInode/1/filter/Resize,Jpeg/jpeg_q/70/resize_w/1100","USA-SAUDI/ (UPDATE 1, PIX):UPDATE 1-Pentagon chief visits Saudi Arabia as tensions simmer with Iran"
57,https://www.upstreamonline.com/weekly/woodfibre-lng-to-split-project-workscope-in-two/2-1-609689,Upstream Online | Latest oil and gas news,https://www.upstreamonline.com/weekly/woodfibre-lng-to-split-project-workscope-in-two/2-1-609689,Woodfibre LNG to split project workscope in two | Upstream Online,https://images-global.nhst.tech/image/aHRtSi9mREJBSi8yRUNWMmhxU2hNeG5MZVFXdmhPREszcnd1eExJQWNTUT0=/nhst/binary/a3d2b3d6735df4c3d7c8456885d88cc8?image_version=720,Developer lines up separate contractors for construction work and engineering and procurement role for project on Canada's west coast
