,source_url,site_name,site_url,title,img_url,description
99,http://www.nintendolife.com/news/2019/10/cd_projekt_red_probably_wont_port_cyberpunk_2077_to_nintendo_switch,Nintendo Life,http://www.nintendolife.com/news/2019/10/cd_projekt_red_probably_wont_port_cyberpunk_2077_to_nintendo_switch,"CD Projekt Red ""Probably"" Won't Port Cyberpunk 2077 To Nintendo Switch",http://images.nintendolife.com/3725fda388d38/1280x720.jpg,But will look into it
100,https://q1065.fm/bangors-bloodiest-shoot-out-was-81-years-ago-today/,Q106.5,https://q1065.fm/bangors-bloodiest-shoot-out-was-81-years-ago-today/,Bangor's Bloodiest Shoot-Out Was 82 Years Ago Today,https://townsquare.media/site/494/files/2018/10/43709457_163724627895840_3079497688740265984_n.jpg?w=1200&h=0&zc=1&s=0&a=t&q=89,"When the FBI's most wanted man came to Bangor in search of guns, he had no idea he would never leave."
101,https://www.independent.ie/life/pareidolia-hits-the-shores-of-ireland-again-as-tralee-antique-shop-sells-cabinet-with-uncanny-resemblance-to-virgin-mary-38586892.html,Independent.ie,https://www.independent.ie/life/pareidolia-hits-the-shores-of-ireland-again-as-tralee-antique-shop-sells-cabinet-with-uncanny-resemblance-to-virgin-mary-38586892.html,'Pareidolia' hits the shores of Ireland again - as Tralee antique shop sells cabinet with 'uncanny resemblance to Virgin Mary' - Independent.ie,https://www.independent.ie/incoming/e7841/38586215.ece/ALTERNATES/h342/2toast.jpg,"Remarkable reports emerged this week of devotees kissing and rubbing the cabinet, and we can assure you that it has nothing to do with Leo Varadkar and his ministers."
102,https://www.motorcyclenews.com/news/ride5000miles/48-us-states-charity-ride/,Motorcycle News,https://www.motorcyclenews.com/news/ride5000miles/48-us-states-charity-ride/,R5Ker tackles 48 states in 48 days for air ambulance service,https://mcn-images.bauersecure.com/PageFiles/677112/gordon-wilson-3.jpg,Read about the #ride5000miles member who rode across 48 US states in 48 days for charity. Find out how to donate here.
103,https://www.dawn.com/news/1510403,DAWN.COM,https://www.dawn.com/news/1510403,Ethiopian PM wins Nobel Peace Prize for mending ties with Eritrea,https://i.dawn.com/large/2019/10/5da102ef37bb9.jpg,"OSLO: Hailed as a visionary and reformer, Ethiopian Prime Minister Abiy Ahmed won the Nobel Peace Prize on Friday ..."
104,https://dailystandard.com/archive/2019-10-12/stories/38917/group-not-shy-about-gun-safety-legislation,The Daily Standard,https://dailystandard.com/archive/2019-10-12/stories/38917/group-not-shy-about-gun-safety-legislation,Group not shy about gun safety legislation,https://dailystandard.com/picts/2019/10/12/2019-10-12_1_full.jpg,CELINA - Local political activist Cheryl Davis said almost everyone she has talked to at various events for the last several months has agreed to sign a petition that would close state loopholes in ba ...
105,https://q1065.fm/bangors-bloodiest-shoot-out-was-81-years-ago-today/,Q106.5,https://q1065.fm/bangors-bloodiest-shoot-out-was-81-years-ago-today/,Bangor's Bloodiest Shoot-Out Was 82 Years Ago Today,https://townsquare.media/site/494/files/2018/10/43709457_163724627895840_3079497688740265984_n.jpg?w=1200&h=0&zc=1&s=0&a=t&q=89,"When the FBI's most wanted man came to Bangor in search of guns, he had no idea he would never leave."
106,,Punch Newspapers,,"Late kidnapper’s wife, siblings arraigned over N798m crime proceeds",https://cdn.punchng.com/wp-content/uploads/2019/10/12040515/Collins-Ezenwa.jpg,
107,https://en.trend.az/world/turkey/3135984.html,Trend.Az,https://en.trend.az/world/turkey/3135984.html,"Turkey will crush PKK/YPG terrorists if they don't withdraw within 120 hours, Erdogan says",https://cdn.trend.az/media/pictures/2018/06/20/recep_tayyib_erdogan_main_200618__(2).jpg,Turkish President Recep Tayip Erdogan said that Turkey will crush the PKK terror group and its Syrian offshoot the People's Protection Units (YPG) terrorists if they don't withdraw within the agreed 120-hour timeframe from the safe zone area in northern Syria
108,https://uk.news.yahoo.com/mutual-distrust-between-india-china-104731066.html,,https://uk.news.yahoo.com/mutual-distrust-between-india-china-104731066.html,Mutual distrust between India and China remain despite summit,https://s.yimg.com/uu/api/res/1.2/ug.uVzn.dWBqLOKQzyv.nA--~B/aD01Nzg7dz0xMDI0O3NtPTE7YXBwaWQ9eXRhY2h5b24-/https://media.zenfs.com/en/rfi_english_75/1d2d3eda1cd911b937e6ab6507b5ac5e,"Chinese President Xi Jinping and his Indian host Prime Minister Narendra Modi have pledged to cooperate against ""radicalisation"", but the two sides did not manage to solve the problems which keep them deeply divided.The informal seaside meeting at Chennai in India on Friday was aimed at mending"
109,https://unwatch.org/mauritania-set-to-win-seat-on-uns-top-human-rights-body-despite-500000-slaves/,UN Watch,https://unwatch.org/mauritania-set-to-win-seat-on-uns-top-human-rights-body-despite-500000-slaves/,"Mauritania set to win seat on UN's top human rights body, despite 500,000 slaves - UN Watch",https://unwatch.org/wp-content/uploads/2019/10/ghazouani.jpg,"President Mohamed Ould Cheikh El Ghazouani Mauritania’s bid for a seat on the UN’s top human rights body should be rejected, as it fails to meet the basic membership criteria. The election of 14 new countries to the Human Rights Council will be held at the UN in New York tomorrow, October 17, 2019. See our full report on all candidates, and press release. Regrettably, because the African group only has four candidates running for the same amount of available seats, many ambassadors from the 193 UN member states who will vote on Thursday wrongly assume that they are obliged to endorse Mauritania. “Electing slave-holding Mauritania as a UN judge on human rights is like making an arsonist into the town fire chief,” warned Hillel Neuer, executive director of UN Watch, who has led a social media campaign opposing Mauritania. UN Watch documents Mauritania’s abuses below. Mauritania’s Human Rights Record Mauritania commits serious human rights violations, including: Torture Arbitrary and politically motivated arrests Harsh and life-threatening prison conditions Restrictions on freedom of assembly, association and religion Corruption Rape and domestic violence against women Ethnic discrimination by government actors Criminalization of same-sex conduct Slavery Human trafficking Child labor Discussion Mauritania is headed by Mohamed Ould Ghazouani who was elected in June 2019 amidst cries of election irregularities.[1] He follows former President Mohamed Ould Abdel Aziz who came to power in 2008 through a military coup and was re-elected in 2014 in elections boycotted by the main opposition party due to allegations the electoral process was flawed.[2] Government corruption is widespread at the …"
110,,,,,,
111,https://www.northwaleschronicle.co.uk/news/national/17965028.johnson-urges-turkish-leader-end-military-assault-northern-syria/,North Wales Chronicle,https://www.northwaleschronicle.co.uk/news/national/17965028.johnson-urges-turkish-leader-end-military-assault-northern-syria/,Johnson urges Turkish leader to end military assault on northern Syria,https://www.northwaleschronicle.co.uk/resources/images/10536822/,The PM told President Erdogan his forces’ action risks undermining the fight against so-called Islamic State and worsening the humanitarian crisis.
112,https://www.boston25news.com/news/investigation-into-nursing-home-underway-after-resident-found-dead/996420957/,WFXT,https://www.boston25news.com/news/investigation-into-nursing-home-underway-after-resident-found-dead/996420957/,Investigation into nursing home underway after resident death,https://d1hfln2sfez66z.cloudfront.net/11-02-2019/t_8ed0370b094f4bd4a6a7faf80a115098_name_5FCE21892F2344B0AFDB73E9CDCBAFC0.jpg,A state investigation is underway at a local nursing home after one resident's death.
113,https://www.malaymail.com/news/showbiz/2019/10/12/de-niro-talks-trump-and-acting-technique-at-london-film-fest/1799608,,https://www.malaymail.com/news/showbiz/2019/10/12/de-niro-talks-trump-and-acting-technique-at-london-film-fest/1799608,De Niro talks Trump and acting technique at London Film Fest | Malay Mail,https://media.malaymail.com/resize_cache/uploads/articles/2019/2019-10/20101012scorsese_deniro-seo.jpg,"LONDON, Oct 12 — Legendary Hollywood actor Robert De Niro renewed his criticism of Donald Trump yesterday, telling a London audience the US president was trying to “destroy” American institutions “to save himself”. &nbsp; In a wide-ranging question-and-answer event at the London Film..."
114,https://www.9news.com/article/news/crime/5-juveniles-accused-of-tagging-more-than-100-locations-in-edgewater-wheat-ridge/73-4e48a912-881a-4c49-915f-63505ca906ac,KUSA,https://www.9news.com/article/news/crime/5-juveniles-accused-of-tagging-more-than-100-locations-in-edgewater-wheat-ridge/73-4e48a912-881a-4c49-915f-63505ca906ac,"5 juveniles accused of tagging more than 100 locations in Edgewater, Wheat Ridge",https://media.9news.com/assets/KUSA/images/481450574/481450574_1140x641.jpg,The boys were charged with felony criminal mischief and criminal trespass.
115,https://www.journalgazette.net/news/world/20191012/turkeys-bombing-in-syria-nears-us-troops,,https://www.journalgazette.net/news/world/20191012/turkeys-bombing-in-syria-nears-us-troops,Turkey's bombing in Syria nears US troops | World | Journal Gazette,https://121-jgweb.newscyclecloud.com/storyimage/JG/20191012/ARTICLE/310129956/AR/0/AR-310129956.jpg,"AKCAKALE, Turkey – Turkish forces faced fierce resistance from U.S.-allied Syrian Kurdish fighters on the third day of Ankara's offensive in nor ..."
116,https://www.wibc.com/news/local-news/sen-mike-braun-discusses-gun-law-reform,93.1 WIBC,https://www.wibc.com/news/local-news/sen-mike-braun-discusses-gun-law-reform,Sen. Mike Braun Discusses Gun Law Reform,https://www.wibc.com/sites/g/files/exi441/f/styles/large_730/public/201910/gun_image.jpg?itok=mG1Ni_Fc,
117,,,,,,
118,https://www.daily-journal.com/news/local/five-interesting-facts-about-columbus-day/article_cc6fabde-eb62-11e9-a5a6-4f7848195d89.html,The Daily Journal,https://www.daily-journal.com/news/local/five-interesting-facts-about-columbus-day/article_cc6fabde-eb62-11e9-a5a6-4f7848195d89.html,Five interesting facts about Columbus Day,https://bloximages.newyork1.vip.townnews.com/daily-journal.com/content/tncms/custom/image/11f8bbd8-7b15-11e8-9633-d329c9e6b5e5.jpg,Another one upon us
119,,,,,,
120,https://www.today.ng/news/politics/kogi-west-appeal-court-sacked-senator-melaye-256717,TODAY,https://www.today.ng/news/politics/kogi-west-appeal-court-sacked-senator-melaye-256717,Kogi West: Why appeal court sacked Senator Melaye - TODAY,https://www.today.ng/wp-content/uploads/2019/10/03083056.jpg,"The Court of Appeal, Abuja Division on Friday, refused to invalidate the August 23, 2019, judgement of the Kogi State National/State Assembly Election Tribunal, which nullified the election of Dino Melaye as Senator representing Kogi West in the National Assembly."
121,,,,,,
122,https://www.kfvs12.com/2019/10/12/mo-capitol-dome-be-lit-pink-honor-breast-cancer-awareness-month/,https://www.kfvs12.com,https://www.kfvs12.com/2019/10/12/mo-capitol-dome-be-lit-pink-honor-breast-cancer-awareness-month/,Mo. Capitol Dome to be lit pink in honor of Breast Cancer Awareness Month,https://www.kfvs12.com/resizer/OoF8D5GcJQgKuUu10IUf87Y9_YA=/1200x0/arc-anglerfish-arc2-prod-raycom.s3.amazonaws.com/public/6CI6QPYYANCZZJAWGBWQTLRGSU.jpg,Missouri State Capitol Dome to be lit pink in honor of Breast Cancer Awareness Month
123,https://www.malaymail.com/news/showbiz/2019/10/12/de-niro-talks-trump-and-acting-technique-at-london-film-fest/1799608,,https://www.malaymail.com/news/showbiz/2019/10/12/de-niro-talks-trump-and-acting-technique-at-london-film-fest/1799608,De Niro talks Trump and acting technique at London Film Fest | Malay Mail,https://media.malaymail.com/resize_cache/uploads/articles/2019/2019-10/20101012scorsese_deniro-seo.jpg,"LONDON, Oct 12 — Legendary Hollywood actor Robert De Niro renewed his criticism of Donald Trump yesterday, telling a London audience the US president was trying to “destroy” American institutions “to save himself”. &nbsp; In a wide-ranging question-and-answer event at the London Film..."
124,,,,,,
125,https://www.rt.com/news/470803-guatemala-president-refused-venezuela/,RT International,https://www.rt.com/news/470803-guatemala-president-refused-venezuela/,"Guatemalan president-elect’s visit to Venezuelan opposition leader Guaido aborted, officials ‘escort’ him back to plane",https://cdni.rt.com/files/2019.10/article/5da2031d2030270d295ae2cc.JPG,Guatemalan President-elect Alejandro Giammattei was left fuming after officials at Venezuela’s Simon Bolivar International Airport denied him entry and sent him back to his plane ahead of a contentious visit.
126,https://www.stuff.co.nz/auckland/116538314/car-crashes-into-tree-on-aucklands-southern-motorway-serious-injuries,Stuff,https://www.stuff.co.nz/auckland/116538314/car-crashes-into-tree-on-aucklands-southern-motorway-serious-injuries,'Carnage': two seriously injured in crash on Auckland's Southern Motorway,https://resources.stuff.co.nz/content/dam/images/1/x/d/t/r/y/image.related.StuffLandscapeSixteenByNine.1420x800.1xdtje.png/1570914523477.jpg,"Auckland's Southern Motorway blocked after 'carnage' crash, seriously injuring two."
127,https://www.asiatimes.com/2019/10/article/bougainville-referendum-could-spark-regional-crisis/,Asia Times,https://www.asiatimes.com/2019/10/article/bougainville-referendum-could-spark-regional-crisis/,Asia Times | Bougainville referendum could spark regional crisis | Article,https://static.asiatimes.com/uploads/2019/10/Bougainville-Revolutionary-Army-900x540.jpg,"Australia, China, Indonesia and US all have a strategic stake in Papua New Guinea province’s upcoming independence vote
"
128,,University World News,,University wins court battle over language policy,https://www.universityworldnews.com/images/uwn-ball-320.png,The Constitutional Court of South Africa has dismissed the appeal by Afrikaans lobby group Gelyke Kanse against the 2016 language policy of Stellenbos...
129,https://www.indiatoday.in/crime/story/delhi-snatcher-target-pm-narendra-modi-niece-rob-her-cash-mobile-phones-1608592-2019-10-12,India Today,https://www.indiatoday.in/crime/story/delhi-snatcher-target-pm-narendra-modi-niece-rob-her-cash-mobile-phones-1608592-2019-10-12,"PM Modi's niece mugged in Delhi, robbed of cash, phones",https://akm-img-a-in.tosshub.com/indiatoday/images/story/201910/PM_Modi_niece-647x363.png?Zr6lfJOEuOLtxi4IuD3LrH9rDk5m6qRo,"According to reports, Damayanti Ben Modi, daughter of Prime Minister Narendra Modi's brother, said that she was carrying around Rs. 56,000 in cash, two mobile phones and important documents in her wallet."
130,/news/world/asia/rcep-meet-piyush-goyal-meets-australian-counterpart-holds-discussions-on-trade-issues20191012103349/,,/news/world/asia/rcep-meet-piyush-goyal-meets-australian-counterpart-holds-discussions-on-trade-issues20191012103349/,"RCEP meet: Piyush Goyal meets Australian counterpart, holds discussions on trade issues",https://aniportalimages.s3.amazonaws.com/media/details/EGpdd2kU0AAPxya_1.jpg,"Bangkok [Thailand], Oct 12 (ANI): Union Minister of Commerce and Industry Piyush Goyal met Australian Trade Minister Simon Birmingham and held discussions over various trade issues including ways to prevent market-distorting trade practices."
131,,,,,,
132,https://www.marketbeat.com/stocks/NYSE/TEN/,,https://www.marketbeat.com/stocks/NYSE/TEN/,"TEN Stock Price, Forecast & News (Tenneco)",https://www.marketbeat.com/logos/tenneco-inc-logo.gif,"Analyzing Tenneco (NYSE:TEN) stock? View TEN's stock price, price target, earnings, financials, forecast, insider trades, news, and SEC filings at MarketBeat."
133,https://unwatch.org/mauritania-set-to-win-seat-on-uns-top-human-rights-body-despite-500000-slaves/,UN Watch,https://unwatch.org/mauritania-set-to-win-seat-on-uns-top-human-rights-body-despite-500000-slaves/,"Mauritania set to win seat on UN's top human rights body, despite 500,000 slaves - UN Watch",https://unwatch.org/wp-content/uploads/2019/10/ghazouani.jpg,"President Mohamed Ould Cheikh El Ghazouani Mauritania’s bid for a seat on the UN’s top human rights body should be rejected, as it fails to meet the basic membership criteria. The election of 14 new countries to the Human Rights Council will be held at the UN in New York tomorrow, October 17, 2019. See our full report on all candidates, and press release. Regrettably, because the African group only has four candidates running for the same amount of available seats, many ambassadors from the 193 UN member states who will vote on Thursday wrongly assume that they are obliged to endorse Mauritania. “Electing slave-holding Mauritania as a UN judge on human rights is like making an arsonist into the town fire chief,” warned Hillel Neuer, executive director of UN Watch, who has led a social media campaign opposing Mauritania. UN Watch documents Mauritania’s abuses below. Mauritania’s Human Rights Record Mauritania commits serious human rights violations, including: Torture Arbitrary and politically motivated arrests Harsh and life-threatening prison conditions Restrictions on freedom of assembly, association and religion Corruption Rape and domestic violence against women Ethnic discrimination by government actors Criminalization of same-sex conduct Slavery Human trafficking Child labor Discussion Mauritania is headed by Mohamed Ould Ghazouani who was elected in June 2019 amidst cries of election irregularities.[1] He follows former President Mohamed Ould Abdel Aziz who came to power in 2008 through a military coup and was re-elected in 2014 in elections boycotted by the main opposition party due to allegations the electoral process was flawed.[2] Government corruption is widespread at the …"
134,https://www.thehindu.com/news/national/kerala/seminar-on-photochemistry-and-sustainable-energy/article29668599.ece,The Hindu,https://www.thehindu.com/news/national/kerala/seminar-on-photochemistry-and-sustainable-energy/article29668599.ece,Seminar on photochemistry and sustainable energy,https://www.thehindu.com/static/theme/default/base/img/og-image.jpg,"To be held at Camelot Convention Centre, Pathirappally"
135,,,,,,
136,https://www.timesofisrael.com/pm-tells-mother-of-israeli-jailed-in-russia-hes-doing-everything-to-free-her/,,https://www.timesofisrael.com/pm-tells-mother-of-israeli-jailed-in-russia-hes-doing-everything-to-free-her/,PM tells mother of Israeli jailed in Russia he’s ‘doing everything’ to free her,https://static.timesofisrael.com/www/uploads/2019/10/dsadascvsavasv-e1570892653198-1024x640.png,"Lawyer of Naama Issachar, sentenced to 7.5 years for marijuana found in bag on Moscow stopover, calls punishment unprecedented and possibly politically motivated"
137,http://igberetvnews.com/1062474/just-e-moneys-wife-siblings-arraigned-n798m-crime-proceeds/,Igbere TV News,http://igberetvnews.com/1062474/just-e-moneys-wife-siblings-arraigned-n798m-crime-proceeds/,"JUST IN!!! E-Money's Wife, Siblings Arraigned Over N798m Crime Proceeds | | Igbere TV",http://igberetvnews.com/wp-content/uploads/2019/10/Ezenwna.jpg,"The police have charged the wife of late billionaire kidnapper, Collins Ezenwa, aka E-money, and four of his brothers with money laundering charges at the Federal High Court in Owerri, Imo State. Eleven counts were preferred against the defendants – Gift Ezenwa Emmanuel Okoronkwo, Uche Okoronkwo, Ikechukwu Onyekere and Franklin Anugba – by the Inspector-General […]"
138,,,,,,
139,,Punch Newspapers,,"Late kidnapper’s wife, siblings arraigned over N798m crime proceeds",https://cdn.punchng.com/wp-content/uploads/2019/10/12040515/Collins-Ezenwa.jpg,
140,https://guardian.ng/news/nigeria-army-captures-10-boko-haram-commanders/,The Guardian Nigeria News - Nigeria and World News,https://guardian.ng/news/nigeria-army-captures-10-boko-haram-commanders/,Nigeria Army 'captures' 10 Boko Haram commanders | The Guardian Nigeria News - Nigeria and World News,https://guardian.ng/wp-content/uploads/2019/10/nigeria-army.jpg,"Nigeria Army said the troops of Operation Lafiya Dole have captured 10 senior commanders of the Boko Haram insurgency group. Army spokesman Aminu Iliyasu in a statement said the arrest of the insurgents was part of the Nigeria Army’s heightened level of fight against terrorism. “For instance, during a successful sting operation conducted on 9 …"
141,https://www.newindianexpress.com/states/kerala/2019/oct/12/jolly-multiple-murder-case-a-blow-by-blow-account-of-the-chilling-drama-at-koodathayi-2046173.html,The New Indian Express,https://www.newindianexpress.com/states/kerala/2019/oct/12/jolly-multiple-murder-case-a-blow-by-blow-account-of-the-chilling-drama-at-koodathayi-2046173.html,Jolly multiple murder case: A blow-by-blow account of the chilling drama at Koodathayi,https://images.newindianexpress.com/uploads/user/imagelibrary/2019/10/12/w600X390/Jollyamma_.jpeg,"Serial killings, illicit relationships, fake will...the Koodathayi killings have all the essential ingredients of a spicy masala thriller and there is still a lot to be unravelled."
142,https://www.belfasttelegraph.co.uk/life/features/mum-had-got-her-lifesaving-badges-just-two-months-before-the-tragedy-it-hurt-her-to-think-that-she-couldnt-save-her-own-dad-38585898.html,BelfastTelegraph.co.uk,https://www.belfasttelegraph.co.uk/life/features/mum-had-got-her-lifesaving-badges-just-two-months-before-the-tragedy-it-hurt-her-to-think-that-she-couldnt-save-her-own-dad-38585898.html,'Mum had got her lifesaving badges just two months before the tragedy... it hurt her to think that she couldn't save her own dad' - BelfastTelegraph.co.uk,https://www.belfasttelegraph.co.uk/life/features/74a96/38585897.ece/ALTERNATES/h342/2019-10-12_lif_54041545_I1.JPG,"Jean Mavitty remembered a boathook, but had no memory of who was holding it when she was pulled out of the water. She was beside herself - not just with the shock of being thrown into t"
143,,,,,,
144,https://www.kulr8.com/news/national/watch-texas-street-fight-ends-with-man-tossing-scooter-through/article_026a6152-4ba3-5aec-99d1-d769bbb34262.html,KULR-TV,https://www.kulr8.com/news/national/watch-texas-street-fight-ends-with-man-tossing-scooter-through/article_026a6152-4ba3-5aec-99d1-d769bbb34262.html,WATCH: Texas street fight ends with man tossing scooter through car window,https://bloximages.newyork1.vip.townnews.com/kulr8.com/content/tncms/assets/v3/editorial/a/38/a38a6452-a99e-5766-8653-f9dd18afbf90/5da0e5d0528b0.preview.png?crop=960%2C720%2C160%2C0&resize=840%2C630&order=crop%2Cresize,A street fight between a motorist and a homeless man in downtown Austin Wednesday morning escalated to the point where the homeless man threw a scooter through the rear windshield
145,https://www.wexfordpeople.ie/lifestyle/thankfully-ex-storm-lorenzo-ran-out-of-steam-38579768.html,WexfordPeople.ie,https://www.wexfordpeople.ie/lifestyle/thankfully-ex-storm-lorenzo-ran-out-of-steam-38579768.html,"Thankfully, ex-storm Lorenzo ran out of steam - WexfordPeople.ie",https://www.independent.ie/regionals/newrossstandard/lifestyle/80a2e/38571543.ece/ALTERNATES/h342/2019-10-08_wex_53943645_I1.JPG,"It was a relief to everyone that hurricane Lorenzo fizzled out without causing any significant damage albeit some serious flooding in south Donegal, other localised spot flooding around"
146,https://www.malaymail.com/news/showbiz/2019/10/12/de-niro-talks-trump-and-acting-technique-at-london-film-fest/1799608,,https://www.malaymail.com/news/showbiz/2019/10/12/de-niro-talks-trump-and-acting-technique-at-london-film-fest/1799608,De Niro talks Trump and acting technique at London Film Fest | Malay Mail,https://media.malaymail.com/resize_cache/uploads/articles/2019/2019-10/20101012scorsese_deniro-seo.jpg,"LONDON, Oct 12 — Legendary Hollywood actor Robert De Niro renewed his criticism of Donald Trump yesterday, telling a London audience the US president was trying to “destroy” American institutions “to save himself”. &nbsp; In a wide-ranging question-and-answer event at the London Film..."
147,https://www.phillytrib.com/news/elections/democratic-candidates-pledge-support-to-lgbtq-community/article_f171fe6a-2b56-5fed-9a6d-d77d9af2c0d0.html,The Philadelphia Tribune,https://www.phillytrib.com/news/elections/democratic-candidates-pledge-support-to-lgbtq-community/article_f171fe6a-2b56-5fed-9a6d-d77d9af2c0d0.html,2020 Democratic candidates pledge support to LGBTQ community,https://bloximages.chicago2.vip.townnews.com/phillytrib.com/content/tncms/assets/v3/editorial/e/33/e33b1f21-74ea-5a5f-883d-f92e9145e414/5da0746332013.image.jpg?resize=945%2C630,"LOS ANGELES — Addressing an LGBTQ community fearful that their gains in equality are slipping, Democratic presidential candidates on Thursday promised an aggressive agenda to end workplace discrimination, improve health"
148,https://www.nbcnews.com/storyline/brexit-referendum/hope-emerges-last-minute-brexit-deal-u-k-e-u-n1064921,euronews,https://www.nbcnews.com/storyline/brexit-referendum/hope-emerges-last-minute-brexit-deal-u-k-e-u-n1064921,U.K.-E.U. talks intensify on last-minute Brexit deal,https://static.euronews.com/articles/4225724/1000x563_nbc-191011_ps_brexit_barnier_barclay_1411_d5c8766fe946336e3e527cd1b450096a.jpg,Time is running out to agree a deal before the Oct. 31 deadline for Britain to leave the European Union.
