,source_url,site_name,site_url,title,img_url,description
0,https://www.thedailyreview.com/news/local/keller-talks-tungsten-trade-with-gtp/article_bae75446-a89f-507c-bb2f-0ca5f7360639.html,The Daily Review,https://www.thedailyreview.com/news/local/keller-talks-tungsten-trade-with-gtp/article_bae75446-a89f-507c-bb2f-0ca5f7360639.html,Keller talks tungsten trade with GTP,https://bloximages.chicago2.vip.townnews.com/thedailyreview.com/content/tncms/assets/v3/editorial/5/de/5dea8e45-2e92-50e9-ba3a-d599cfe324c2/5da106a723cf9.image.jpg?resize=945%2C630,"TOWANDA — U.S. Congressman Fred Keller (R-12) was back in Bradford County Friday, this time to meet with officials of the Global Tungsten and Powders Corporation before touring the Towanda"
1,https://www.standard.co.uk/news/crime/hyde-park-bomb-suspect-denied-bail-for-1972-double-murder-charges-a4260101.html,Evening Standard,https://www.standard.co.uk/news/crime/hyde-park-bomb-suspect-denied-bail-for-1972-double-murder-charges-a4260101.html,'Flight risk' Hyde Park bomb suspect denied bail for murder charges,https://static.standard.co.uk/s3fs-public/thumbnails/image/2019/10/12/16/pri89549240.jpg,"Hyde Park bomb suspect John Downey has been refused bail for charges relating to a separate alleged murder of two soldiers. John Downey, 67, is accused of the murders of two Ulster Defence Regiment soldiers in August 1972 and a further explosives charge. Downey was extradited to the UK after being arrested in the Republic of Ireland. The soldiers died in a car bomb attack in Co Fermanagh."
2,https://dailystandard.com/archive/2019-10-12/stories/38917/group-not-shy-about-gun-safety-legislation,The Daily Standard,https://dailystandard.com/archive/2019-10-12/stories/38917/group-not-shy-about-gun-safety-legislation,Group not shy about gun safety legislation,https://dailystandard.com/picts/2019/10/12/2019-10-12_1_full.jpg,CELINA - Local political activist Cheryl Davis said almost everyone she has talked to at various events for the last several months has agreed to sign a petition that would close state loopholes in ba ...
3,https://www.dailytrust.com.ng/the-road-to-2050-propositions-from-nesg.html,Daily Trust,https://www.dailytrust.com.ng/the-road-to-2050-propositions-from-nesg.html,The road to 2050: Propositions from NESG – Daily Trust,https://cdn.dailytrust.com.ng/wp-content/uploads/2019/10/NESG.jpg,"The Nigerian Economic Summit Group (NESG) meeting of October 7 and 8, 2019 was a massive gathering of key economic stakeholders from within and outside Nigeria. The event was attended by President Muhammadu Buhari, the Minister of Finance, Budget and National Planning, Mrs. Zainab Shamsuna Ahmed, the DG Budget, Mr. Ben Akabueze, the governors of …"
4,https://www.malaysiakini.com/news/495536,Malaysiakini,https://www.malaysiakini.com/news/495536,Facebook's Libra currency abandoned by major financial companies,https://i.ncdn.xyz/publisher-c1a3f893382d2b2f8a9aa22a654d9c97/2019/10/2438353e98acfd0110f7c028bfdac526.jpg,The remaining companies still supporting Libra are mostly venture capitalists and technology firms.
5,https://patriotla.iheart.com/content/2019-10-11-gov-newsom-signs-bill-banning-gun-shows-at-del-mar-fairgrounds/,KEIB-AM,https://patriotla.iheart.com/content/2019-10-11-gov-newsom-signs-bill-banning-gun-shows-at-del-mar-fairgrounds/,Gov. Newsom Signs Bill Banning Gun Shows at Del Mar Fairgrounds | KEIB-AM,https://i.iheart.com/v3/re/new_assets/5da101823a864dfa5647982e,Gov. Gavin Newsom signed a bill today co-authored by three San Diego lawmakers that will ban the sale of guns and ammunition at gun shows at the Del Mar Fairgrounds.
6,https://www.unionleader.com/news/crime/two-shot-at-pelham-church-wedding/article_47642470-9470-5405-9950-d93052742584.html,UnionLeader.com,https://www.unionleader.com/news/crime/two-shot-at-pelham-church-wedding/article_47642470-9470-5405-9950-d93052742584.html,Two shot at Pelham church wedding,https://bloximages.newyork1.vip.townnews.com/unionleader.com/content/tncms/assets/v3/editorial/5/4d/54d2533b-f131-5722-b3c2-e8d04b754e12/5da201a707765.image.jpg?resize=1200%2C565,"PELHAM — A church pastor and the bride were shot and wounded during a wedding at New England Pentecostal Ministries church Saturday morning, according to authorities."
7,https://www.rollingstone.com/politics/politics-news/shep-smith-fox-news-propaganda-898293/,Rolling Stone,https://www.rollingstone.com/politics/politics-news/shep-smith-fox-news-propaganda-898293/,"With Shep Smith Gone, Is Fox News' Transition to Propaganda Complete?",https://www.rollingstone.com/wp-content/uploads/2019/10/Screen-Shot-2019-10-12-at-1.29.13-PM-copy-1.jpg,"Unlike most of the voices heard on Fox News, the anchor brought truthful analysis and fact checking of the president to his daytime program"
8,,,,,,
9,,,,,,
10,https://en.radiofarda.com/a/soleimani-knows-his-assassination-is-not-impossible-says-mossad-chief/30213416.html,RFE/RL,https://en.radiofarda.com/a/soleimani-knows-his-assassination-is-not-impossible-says-mossad-chief/30213416.html,"Soleimani Knows His Assassination 'Is Not Impossible', Says Mossad Chief",https://gdb.rferl.org/415EABDB-E7DC-4C28-9984-112C39389CD3_w1200_r1_s.jpg,In one of his rare media appearances Iranian revolutionary guard IRGC's Qods Force Commander Qassem Soleimani claimed in a late September interview aired on Iranian state TV that Israel had planned to assassinate him.
11,https://www.malaymail.com/news/showbiz/2019/10/12/de-niro-talks-trump-and-acting-technique-at-london-film-fest/1799608,,https://www.malaymail.com/news/showbiz/2019/10/12/de-niro-talks-trump-and-acting-technique-at-london-film-fest/1799608,De Niro talks Trump and acting technique at London Film Fest | Malay Mail,https://media.malaymail.com/resize_cache/uploads/articles/2019/2019-10/20101012scorsese_deniro-seo.jpg,"LONDON, Oct 12 — Legendary Hollywood actor Robert De Niro renewed his criticism of Donald Trump yesterday, telling a London audience the US president was trying to “destroy” American institutions “to save himself”. &nbsp; In a wide-ranging question-and-answer event at the London Film..."
12,https://sputniknews.com/society/201910121077034445-russian-fund-to-present-the-best-of-russias-fine-art-in-riyadh-amid-president-putins-visit/,,https://sputniknews.com/society/201910121077034445-russian-fund-to-present-the-best-of-russias-fine-art-in-riyadh-amid-president-putins-visit/,Russian Fund to Present the Best of Russia's Fine Art in Riyadh Amid President Putin's Visit,https://cdn5.img.sputniknews.com/images/107223/66/1072236641.jpg,"The Russian Direct Investment Fund (RDIF), together with the Saudi Arabian Ministry of Culture, will present masterpieces of art as part of the ""Russian Culture in Riyadh"" programme."
13,,,,,,
14,https://www.joplinglobe.com/news/local_news/water-company-wades-into-property-acquisition-for-reservoir/article_14a2ef46-cb2f-5511-8977-500a902cae9b.html,Joplin Globe,https://www.joplinglobe.com/news/local_news/water-company-wades-into-property-acquisition-for-reservoir/article_14a2ef46-cb2f-5511-8977-500a902cae9b.html,Water company wades into property acquisition for reservoir,https://bloximages.chicago2.vip.townnews.com/joplinglobe.com/content/tncms/custom/image/da68c2f8-c3ab-11e5-94c7-b366ea8ae93c.jpg,"SPRINGFIELD, Mo. — Although Missouri American Water Co. isn't yet focused on acquiring land for its planned reservoir project in Newton County, the company has already purchased one property, with"
15,https://www.stuff.co.nz/dominion-post/news/116538160/blow-for-wellingtons-shelly-bay-with-most-new-councillors-opposed,Stuff,https://www.stuff.co.nz/dominion-post/news/116538160/blow-for-wellingtons-shelly-bay-with-most-new-councillors-opposed,Blow for Wellington's Shelly Bay with most new councillors opposed,https://resources.stuff.co.nz/content/dam/images/1/x/d/o/z/f/image.related.StuffLandscapeSixteenByNine.1420x800.1xdtf4.png/1571967612715.jpg,A majority of Wellington's new councillors have previously stated opposition to the Shelly Bay development as it now stands.
16,https://www.greensboro.com/news/national/iraqi-pm-addresses-the-nation-urges-protesters-to-go-home/article_34bcec8e-44af-5d70-95a5-02b20e2833ef.html,Greensboro News and Record,https://www.greensboro.com/news/national/iraqi-pm-addresses-the-nation-urges-protesters-to-go-home/article_34bcec8e-44af-5d70-95a5-02b20e2833ef.html,404 Error,https://bloximages.newyork1.vip.townnews.com/greensboro.com/content/tncms/custom/image/be6ce48e-f2f4-11e6-9c60-8f5f074fddfd.jpg,This page no longer exists or has been removed
17,https://www.paulickreport.com/news/thoroughbred-racing/oleksandra-kicks-clear-in-franklin-county/,Horse Racing News | Paulick Report,https://www.paulickreport.com/news/thoroughbred-racing/oleksandra-kicks-clear-in-franklin-county/,Oleksandra Kicks Clear In Franklin County  - Horse Racing News | Paulick Report,https://www.paulickreport.com/wp-content/uploads/2019/10/OLEKSANDRA-Buffalo-Trace-Franklin-County-G3-23rd-Running-10-11-19-R09-KEE-Finish-02-128x102.jpg,"Team Valor International's Oleksandra (AUS) found racing room between Morticia and the pacesetting Girls Know Best in deep stretch and went on to win the 23rd running of the $150,000 Buffalo Trace Franklin County (G3) for fillies and mares by two lengths over Morticia before a Friday afternoon crowd of 19,026 at Keeneland. Trained by […]"
18,https://www.expatica.com/ru/uncategorized/turkey-says-syria-assault-wont-stop-as-us-threatens-sanctions-110884/,Expat Guide to Russia | Expatica,https://www.expatica.com/ru/uncategorized/turkey-says-syria-assault-wont-stop-as-us-threatens-sanctions-110884/,Turkey says Syria assault 'won't stop' as US threatens sanctions - Expat Guide to Russia | Expatica,https://cdn.expatica.com/production/sites/11/2019/06/17053115/shutterstock_210753568.jpg,"Battles raged Friday as Turkish President Recep Tayyip Erdogan vowed to press an assault against Kurdish forces in Syria, dismissing “threats” from other countries while the US warned Ankara of fresh sanctions. President Donald Trump, whose order to pull back..."
19,https://www.jpost.com/Opinion/Israels-urgent-need-Stable-government-604469, The Jerusalem Post | JPost.com ,https://www.jpost.com/Opinion/Israels-urgent-need-Stable-government-604469,Israel’s urgent need: Stable government,"https://images.jpost.com/image/upload/f_auto,fl_lossy/t_JD_ArticleMainImageFaceDetect/447469",The US has come across in recent months as unwilling to confront Iran.
20,https://www.cnbc.com/2019/10/11/reuters-america-update-2-u-s-health-officials-say-vaping-illness-may-have-multiple-causes.html,CNBC,https://www.cnbc.com/2019/10/11/reuters-america-update-2-u-s-health-officials-say-vaping-illness-may-have-multiple-causes.html,UPDATE 2-U.S. health officials say vaping illness may have multiple causes,https://sc.cnbcfm.com/applications/cnbc.com/staticcontent/img/cnbc_logo.gif?v=1524171804,"In a conference call with reporters, health officials said more than one agent may be involved in the mysterious illness that has sickened more than 1,000 people in the United States. Anne Schuchat, principal deputy director of the U.S. Centers for Disease Control and Prevention, said on the call. On Tuesday, the CDC reported 1,299 confirmed or probable cases of..."
21,https://dailystandard.com/archive/2019-10-12/stories/38917/group-not-shy-about-gun-safety-legislation,The Daily Standard,https://dailystandard.com/archive/2019-10-12/stories/38917/group-not-shy-about-gun-safety-legislation,Group not shy about gun safety legislation,https://dailystandard.com/picts/2019/10/12/2019-10-12_1_full.jpg,CELINA - Local political activist Cheryl Davis said almost everyone she has talked to at various events for the last several months has agreed to sign a petition that would close state loopholes in ba ...
22,https://www.business-standard.com/article/pti-stories/see-now-campaign-will-be-soon-intensified-fred-hollows-foundation-119101200668_1.html,,https://www.business-standard.com/article/pti-stories/see-now-campaign-will-be-soon-intensified-fred-hollows-foundation-119101200668_1.html,'See Now' campaign will be soon intensified: Fred Hollows Foundation,https://bsmedia.business-standard.com/_media/bs/img/article/default/1191012/full-119101200668.jpg,"A public campaign that seeks to promote eye health care among people in Uttar Pradesh and is supported by legendary actor Amitabh Bachchan, is all set to be intensified after its eight-week pilot project in five districts of the state bore good"
23,https://www.straitstimes.com/asia/south-asia/india-china-agree-to-set-up-mechanism-to-tackle-trade-deficit,The Straits Times,https://www.straitstimes.com/asia/south-asia/india-china-agree-to-set-up-mechanism-to-tackle-trade-deficit,"India, China agree to set up mechanism to tackle trade deficit",https://www.straitstimes.com/sites/default/files/styles/x_large/public/articles/2019/10/13/ST_20191013_FDXIMODI_5181653.jpg?itok=Q7ud-m-T,"MAMALLAPURAM (Tamil Nadu) • India and China will set up a mechanism to tackle India's galloping trade deficit with the world's second-biggest economy, a top Indian diplomat said yesterday, following talks between Prime Minister Narendra Modi and China's President Xi Jinping.. Read more at straitstimes.com."
24,https://www.kstk.org/2019/10/11/landless-tribes-stake-out-selections-in-the-tongass/,KSTK,https://www.kstk.org/2019/10/11/landless-tribes-stake-out-selections-in-the-tongass/,'Landless' tribes stake out selections in the Tongass - KSTK,https://kstk-org.s3.amazonaws.com/wp-content/uploads/2019/10/Wrangell-1of1-Dsize.jpg,"The group is eyeing 115,000 acres they’d like to divide among the five landless tribal communities."
25,https://madison.com/news/local/govt-and-politics/madison-entrepreneurship-program-ceos-of-tomorrow-takes-life-changing-trip/article_26e00d9d-d490-5c6d-8756-0b89ec547914.html,madison.com,https://madison.com/news/local/govt-and-politics/madison-entrepreneurship-program-ceos-of-tomorrow-takes-life-changing-trip/article_26e00d9d-d490-5c6d-8756-0b89ec547914.html,"Madison entrepreneurship program, CEOs of Tomorrow, takes 'life-changing' trip to Botswana",https://bloximages.chicago2.vip.townnews.com/madison.com/content/tncms/assets/v3/editorial/e/93/e939bb3c-5a09-512b-93ee-43cb4e6eb8ae/5da1f1031ae52.image.jpg?crop=960%2C540%2C0%2C90&resize=960%2C540&order=crop%2Cresize,Most of the 8 kids were flying on an airplane for the very first time.
26,https://newsone.com/3889798/amber-guyger-martin-rivera-brandon-washington/,News One,https://newsone.com/3889798/amber-guyger-martin-rivera-brandon-washington/,Everything To Know About The Shooting Of The Unarmed Black Man Killed By Amber Guyger’s Married Lover,https://ionenewsone.files.wordpress.com/2019/09/15697768322785.png?w=560&h=320&crop=1,"Brandon Washington was only 20 years old when he was killed over a candy bar by Martin Rivera, Amber Guyger’s former lover and cop partner."
27,,,,,,
28,,,,,,
29,,,,,,
30,https://www.fox10phoenix.com/news/arkansas-judge-court-to-hear-19-adoption-scheme-cases-against-arizona-man-accused-of-human-trafficking,FOX 10 Phoenix,https://www.fox10phoenix.com/news/arkansas-judge-court-to-hear-19-adoption-scheme-cases-against-arizona-man-accused-of-human-trafficking,Arkansas judge: Court to hear 19 adoption scheme cases against Arizona man accused of human trafficking,https://images.foxtv.com/static.fox10phoenix.com/www.fox10phoenix.com/content/uploads/2019/10/724/407/PAUL-PETERSEN.jpg?ve=1&tl=1,An Arkansas judge ruled Friday that the court will decide individual outcomes to 19 statewide adoption cases against an Arizona elected official accused of human trafficking.
31,https://www.business-standard.com/article/pti-stories/venezuela-denies-entry-of-guatemala-s-president-elect-119101200920_1.html,,https://www.business-standard.com/article/pti-stories/venezuela-denies-entry-of-guatemala-s-president-elect-119101200920_1.html,Venezuela denies entry of Guatemala's president-elect,https://bsmedia.business-standard.com/_media/bs/img/article/default/1191012/full-119101200920.jpg,"The president-elect of Guatemala said he was blocked Saturday from entering Venezuela where he planned to meet opposition leader Juan Guaid, who is seeking to oust socialist President Nicols Maduro.
The commercial flight carrying Alejandro"
32,https://www.republicworld.com/india-news/general-news/after-modi-xi-summit-nepal-decks-up-to-welcome-the-chinese-president,Republic World,https://www.republicworld.com/india-news/general-news/after-modi-xi-summit-nepal-decks-up-to-welcome-the-chinese-president,"After Modi-Xi Summit, Nepal decks up to welcome the Chinese President - Republic World",https://img.republicworld.com/republic-prod/stories/promolarge/xxhdpi/h2ycmu9omeplczpz_1570852407.jpeg?tr=f-jpeg,"The government of Nepal has planned a grand welcome for the President of China, Xi Jinping when he arrives in the country on Saturday for a two-day visit."
33,https://www.timesofisrael.com/nothing-to-declare-two-french-israelis-indicted-on-money-laundering-charges/,,https://www.timesofisrael.com/nothing-to-declare-two-french-israelis-indicted-on-money-laundering-charges/,Nothing to declare? Two French-Israelis indicted on money laundering charges,https://static.timesofisrael.com/www/uploads/2019/06/F180819MS22-1024x640.jpg,Adam Ivgi and Yonatan Yehuda Sisley-Chikli allegedly paid courier to smuggle cash through customs. Prosecutors seek to forfeit apartments they bought
34,https://dunyanews.tv/en/Pakistan/513693-Asad-Qaiser-meets-Turkish-President-discusses-Kashmir-issues,Dunya News,https://dunyanews.tv/en/Pakistan/513693-Asad-Qaiser-meets-Turkish-President-discusses-Kashmir-issues,"Asad Qaiser meets Turkish President, discusses various issues including Kashmir",https://img.dunyanews.tv/news/2019/October/10-12-19/news_big_images/513693_22425246.jpg,NA Speaker discussed challenges and issues of mutual interest in the meeting with Turkish President.
35,https://www.business-standard.com/article/pti-stories/probe-into-deaths-of-family-members-going-on-well-kerala-dgp-119101200309_1.html,,https://www.business-standard.com/article/pti-stories/probe-into-deaths-of-family-members-going-on-well-kerala-dgp-119101200309_1.html,Probe into deaths of family members going on well: Kerala DGP,https://bsmedia.business-standard.com/_media/bs/img/article/default/1191012/full-119101200309.jpg,"Kerala police Chief Loknath Behra  on Saturday expressed satisfaction over the ongoing probe into  the case relating to the mysterious deaths of six members of a  family near here.
Behra, who reached Vatakara to assess the progress of the "
36,https://www.idahopress.com/news/local/new-cecil-d-andrus-white-clouds-wilderness-boundary-signs-going/article_a81b42af-0509-5511-a01a-adfb39705504.html,Idaho Press,https://www.idahopress.com/news/local/new-cecil-d-andrus-white-clouds-wilderness-boundary-signs-going/article_a81b42af-0509-5511-a01a-adfb39705504.html,New Cecil D. Andrus – White Clouds Wilderness boundary signs going up,https://bloximages.chicago2.vip.townnews.com/idahopress.com/content/tncms/assets/v3/editorial/e/6f/e6f3a35d-acca-5ea2-8fc8-15cc6461aadc/5da0eda57fff8.image.jpg?crop=1246%2C1246%2C207%2C0&resize=630%2C630&order=crop%2Cresize,"Those classic wooden Forest Service signs with blocky, chiseled words began to appear at the boundaries of the Cecil D. Andrus – White Clouds Wilderness earlier this week."
37,,,,,,
38,https://www.geekwire.com/2019/shares-gates-backed-vir-bio-tumble-143m-ipo-fund-infectious-disease-efforts/,GeekWire,https://www.geekwire.com/2019/shares-gates-backed-vir-bio-tumble-143m-ipo-fund-infectious-disease-efforts/,Shares of Gates-backed Vir Bio tumble after $143M IPO to fund infectious disease efforts,https://cdn.geekwire.com/wp-content/uploads/2019/10/GeorgeScangos.jpg,"It was a rough Wall Street debut for Vir Biotechnology, a San Francisco company with ambitious plans to battle infectious diseases. After raising $143 million in an initial public offering on…"
39,https://thedmonline.com/campus-groups-make-demands-of-ihl/,The Daily Mississippian,https://thedmonline.com/campus-groups-make-demands-of-ihl/,Campus groups make demands of IHL,https://thedmonline.com/wp-content/uploads/2019/10/IMG_0828_sfw.jpg,"The Black Student Union, United Campus Workers of Mississippi, College Democrats and Abolish IHL have listed demands in their statements about the chancellor search process."
40,https://norfolkdailynews.com/commentary/trade-deal-with-japan-to-benefit-nebraska-farmers/article_e0986360-ed03-11e9-81e4-6ba5ca1280bb.html,The Norfolk Daily News ,https://norfolkdailynews.com/commentary/trade-deal-with-japan-to-benefit-nebraska-farmers/article_e0986360-ed03-11e9-81e4-6ba5ca1280bb.html,Trade deal with Japan to benefit Nebraska farmers,https://bloximages.newyork1.vip.townnews.com/norfolkdailynews.com/content/tncms/assets/v3/editorial/0/08/008c85ac-aed9-11e9-976c-dbaf26587bbb/5d39a2aff2787.image.jpg?resize=948%2C630,"While it’s not the big fish that Nebraska farmers were hoping to reel in, a limited trade agreement between the United States and Japan is better than nothing."
41,https://www.thenational.scot/news/17963956.catalan-indy-trial-supreme-court-dismisses-rebellion-charges/,The National,https://www.thenational.scot/news/17963956.catalan-indy-trial-supreme-court-dismisses-rebellion-charges/,Catalan indy trial: Spanish supreme court dismisses rebellion charges,https://www.thenational.scot/resources/images/9720665/,SPAIN’S supreme court has dismissed charges of rebellion against Catalan independence leaders – the most serious offences they faced which… 
42,https://www.fox34.com/story/41172737/hearing-set-on-motion-to-convert-reagordykes-cases-to-chapter-7,,https://www.fox34.com/story/41172737/hearing-set-on-motion-to-convert-reagordykes-cases-to-chapter-7,Hearing set on motion to convert Reagor-Dykes case to Chapter 7,https://RAMAR.images.worldnow.com/images/18814409_G.jpeg?lastEditedDate=1569973555000,There will be a hearing later this month on a proposal to convert the Reagor-Dykes Auto Group bankruptcy cases to chapter 7 liquidation.
43,https://www.tahlequahdailypress.com/news/what-s-happening-oct/article_00a9f38e-6671-56ab-9eac-bbb1b64a777f.html,Tahlequah Daily Press,https://www.tahlequahdailypress.com/news/what-s-happening-oct/article_00a9f38e-6671-56ab-9eac-bbb1b64a777f.html,What's Happening: Oct. 14-20,https://bloximages.chicago2.vip.townnews.com/tahlequahdailypress.com/content/tncms/custom/image/689209f6-26af-11e7-9604-8f2df806c49b.png,"Monday, Oct. 14"
44,https://ftnnews.com/accommodation/34057-marriott-doubles-portfolio-in-the-middle-east-africa,,https://ftnnews.com/accommodation/34057-marriott-doubles-portfolio-in-the-middle-east-africa,Marriott doubles portfolio in the Middle East & Africa,,Marriott International announced ambitious growth plans for its Middle East and Africa region. The hospitality giant signed more than 30 properties and ove...
45,,YakTriNews.com,,Page not found - YakTriNews.com,,
46,/news/world/others/vice-president-naidu-arrives-in-sierra-leone20191013014002/,,/news/world/others/vice-president-naidu-arrives-in-sierra-leone20191013014002/,Vice President Naidu arrives in Sierra Leone,https://aniportalimages.s3.amazonaws.com/media/details/EGs08Z4X0AA56um_1.jpg,"Freetown [Sierra Leone], Oct 13 (ANI): Vice President M Venkaiah Naidu on Saturday (local time) arrived in Freetown on the second leg of his ongoing five-day visit to Union of Comoros and Sierra Leone."
47,http://www.theguardian.com/world/commentisfree/2019/oct/12/turkey-invasion-syria-trump-withdrawal-gulf-rivals-unite,the Guardian,http://www.theguardian.com/world/commentisfree/2019/oct/12/turkey-invasion-syria-trump-withdrawal-gulf-rivals-unite,Erdoğan has managed the unthinkable: uniting all the other Middle East rivals | Simon Tisdall,https://i.guim.co.uk/img/media/2dabc1bfd45cf9e2a88e5075f2f3644c460bbfde/0_274_5472_3283/master/5472.jpg?width=1200&height=630&quality=85&auto=format&fit=crop&overlay-align=bottom%2Cleft&overlay-width=100p&overlay-base64=L2ltZy9zdGF0aWMvb3ZlcmxheXMvdG8tb3BpbmlvbnMucG5n&enable=upscale&s=eb29c1ec7989cdca49ae87238365c0e7,Turkey’s Syria invasion following US withdrawal of its troops means that all bets are now off in the Middle East
48,,University World News,,Why are universities neglecting their global alumni?,https://www.universityworldnews.com/images/articles/20191009085026266_5.jpg,"So many universities spend money, time and energy recruiting and educating international students, yet lose track of them once they have graduated. In..."
49,https://www.thesun.co.uk/news/10119232/us-troops-saudi-arabia-iran-oil-attack/,The Sun,https://www.thesun.co.uk/news/10119232/us-troops-saudi-arabia-iran-oil-attack/,Trump sends thousands of extra troops to Saudi Arabia after Iran oil attack,https://www.thesun.co.uk/wp-content/uploads/2019/10/NINTCHDBPICT000530151188.jpg?strip=all&quality=100&w=1200&h=800&crop=1,"THE US is sending thousands more troops to protect Saudi Arabia against the threat of Iran after last month’s attack on major oil plants. Donald Trump approved the deployment of 3,000 extra troops …"
50,,,,,,
51,https://globalnews.ca/news/6023100/takeaways-conservative-platform/,Global News,https://globalnews.ca/news/6023100/takeaways-conservative-platform/,4 takeaways from the Conservative election platform,https://shawglobalnews.files.wordpress.com/2019/10/21946107.jpg?quality=70&strip=all&w=720&h=379&crop=1,"Here are a few key takeaways from the platform, and a look at how the other parties stack up."
