,source_url,site_name,site_url,title,img_url,description
244,https://ifpnews.com/apa-concludes-meeting-in-turkey,Iran Front Page,https://ifpnews.com/apa-concludes-meeting-in-turkey,APA Concludes Meeting in Turkey | Iran Front Page,https://ifpnews.com/wp-content/uploads/2019/10/apa-turkey.jpg,The 1st Executive Council meeting of the Asian Parliamentary Assembly (APA) has come to an end after four days in the Turkish city of Rize.
245,https://thefrontierpost.com/afghan-forces-fully-capable-gen-waziri/,The Frontier Post,https://thefrontierpost.com/afghan-forces-fully-capable-gen-waziri/,Afghan Forces fully capable: Gen. Waziri - The Frontier Post,https://i1.wp.com/thefrontierpost.com/wp-content/uploads/2019/10/Afghan-Forces.jpg?fit=1491%2C1000&ssl=1,Monitoring Desk KABUL: The Afghan Army’s Chief of Staff Lt. Gen. Bismillah Waziri said that the Afghan National Security and Defense Forces (ANSDF) have got the full strength in combating insurgents in the battlefields. But the Afghan security forces still need air support: “The Afghan National Defense and Security Forces are undertaking over 90 percent…
246,https://cw39.com/2019/10/31/migrants-in-tractor-trailer-cant-hide-from-alert-u-s-border-patrol-canine/,CW39 Houston,https://cw39.com/2019/10/31/migrants-in-tractor-trailer-cant-hide-from-alert-u-s-border-patrol-canine/,Migrants in tractor-trailer can’t hide from alert U.S. Border Patrol canine,https://tribkiah.files.wordpress.com/2019/10/migrants-in-trailer-1.jpg?quality=85&strip=all&w=1200,"EL PASO, Texas (Border Report) — The U.S. Border Patrol this week stopped a tractor-trailer concealing 13 unauthorized migrants in the sleeper cabin at a highway checkpoint in Sierra Blanca, Texas.

Agents foiled the human-smuggling attempt at around 4:30 a.m. Tuesday while inspecting vehicles at the checkpoint. A Border Patrol canine alerted his human counterparts to the presence of possible contraband in the truck and the vehicle was sent to a secondary inspection area. It was there that the agents discovered 13 individuals hiding inside the sleeper cabin area of the truck."
247,https://www.zerohedge.com/political/john-solomon-debunks-msm-lies-about-ukraine-biden-and-election-interference,Zero Hedge,https://www.zerohedge.com/political/john-solomon-debunks-msm-lies-about-ukraine-biden-and-election-interference,"John Solomon Debunks MSM Lies About Ukraine, Biden And Election Interference",https://zh-prod-1cc738ca-7d3b-4a72-b792-20bd8d8fa069.storage.googleapis.com/s3fs-public/styles/max_650x650/public/2019-10/johnsolomon.jpg?itok=Cuvwq7zO,
248,https://www.tweeddailynews.com.au/news/runs-keep-flowing-for-labuschagne/3867593/,Tweed Daily News,https://www.tweeddailynews.com.au/news/runs-keep-flowing-for-labuschagne/3867593/,Runs keep flowing for Labuschagne,https://media.apnarm.net.au/media/images/2019/10/31/v3imagesbind4b0fcfd32940316171e6db716bbb5ec-nfeedvlhlu0rf5dr8t2_ct1880x930.jpg,Another impressive innings from Marnus Labuschagne in Queensland’s one-day clash with WA will surely have selectors taking notice. 
249,https://www.telegraph.co.uk/racing/2019/10/31/jessica-harrington-looking-crown-finest-year-return-santa-anita/,The Telegraph,https://www.telegraph.co.uk/racing/2019/10/31/jessica-harrington-looking-crown-finest-year-return-santa-anita/,Jessica Harrington looking to crown her finest year on return to Santa Anita,https://www.telegraph.co.uk/content/dam/racing/2019/10/31/TELEMMGLPICT000214723210-xlarge_trans_NvBQzQNjv4BqXW61vz_3bSmK0KpgrSXHYTlaTMTxUhlzF8Rkw038U-A.jpeg?imwidth=1200,"The last time Jessica Harrington was at Santa Anita was for the Los Angeles Olympic Games in 1984, when she was due to represent Ireland in the three-day-event."
250,,,,,,
251,https://www.northcentralpa.com/business/national/ford-uaw-reach-tentative-contract-agreement/article_dcaa4a93-8b11-5d4f-a9a4-c17235f62ee0.html,NorthcentralPA.com,https://www.northcentralpa.com/business/national/ford-uaw-reach-tentative-contract-agreement/article_dcaa4a93-8b11-5d4f-a9a4-c17235f62ee0.html,"Ford, UAW Reach Tentative Contract Agreement",https://bloximages.newyork1.vip.townnews.com/northcentralpa.com/content/tncms/custom/image/6d772780-eaca-11e9-9353-6ff45364e465.jpg,Ford Motor Co. (F) and the United Auto Workers union have reached a proposed tentative agreement on a four-year contract Wednesday without a strike. The proposed agreement includes more than
252,https://www.stuff.co.nz/travel/cruising/117055661/sail-the-world-like-its-1519-with-not-a-mutiny-in-sight,Stuff,https://www.stuff.co.nz/travel/cruising/117055661/sail-the-world-like-its-1519-with-not-a-mutiny-in-sight,Sail the world like it's 1519 (with not a mutiny in sight),https://resources.stuff.co.nz/content/dam/images/1/x/o/w/z/9/image.related.StuffLandscapeSixteenByNine.1420x800.1xowq5.png/1572481152158.jpg,"Five hundred years after Magellan set off to circumnavigate the globe, Chris Moss suggests cruises that follow in his wake."
253,https://english.vov.vn/content/MjQ5MjQz.vov,VOV - VOV Online Newspaper,https://english.vov.vn/content/MjQ5MjQz.vov,"Vietnam, US investigate $4b aluminum origin fraud",https://image-english.vov.vn/w400/Uploaded/TmT2B47lHgLy8UZVeuKg/2019_10_31/aajyivlimg_1_EWQB.jpg,"Ba Ria-Vung Tau Province's Customs Department had seized a suspicious aluminum shipment worth US$4 million that was heading to the US and other countries, a General Department of Vietnam Customs official said."
254,https://lobotero.com/2019/10/31/that-armenian-genocide-thing/,In  Saner  Thought,https://lobotero.com/2019/10/31/that-armenian-genocide-thing/,That Armenian Genocide Thing,https://secure.gravatar.com/blavatar/a4a2b09adc96b49d624b74c048ea36ee?s=200&ts=1579980496,For over 100 years the Armenians have been trying to get the world to hold the Turks responsible for the deaths of thousands of Armenians during and after World War One…. And for that century…
255,,,,,,
256,,Gadsden Times,,Authorities plan to shut down open house parties,https://www.gadsdentimes.com/storyimage/DA/20191030/NEWS/191039851/AR/0/AR-191039851.jpg,Kalab Blake Whitworth died in a shooting Sunday morning in an isolated location outside Attalla. But it could have been anybody — anyone’s
257,,,,,,
258,https://www.bozemandailychronicle.com/outdoors/sagebrush-single-track-copper-city-expands-mountain-biking-opportunities-near/article_10723b64-f7b9-5cfd-8b50-ff083a08bbdd.html,Bozeman Daily Chronicle,https://www.bozemandailychronicle.com/outdoors/sagebrush-single-track-copper-city-expands-mountain-biking-opportunities-near/article_10723b64-f7b9-5cfd-8b50-ff083a08bbdd.html,Sagebrush single-track: Copper City expands mountain biking opportunities near Bozeman,https://bloximages.chicago2.vip.townnews.com/bozemandailychronicle.com/content/tncms/assets/v3/editorial/0/18/01892eee-25f1-5259-99c0-7f610e0d1524/5dba09c67fa78.image.jpg?crop=1568%2C1176%2C97%2C0&resize=840%2C630&order=crop%2Cresize,"COPPER CITY — On a recent windy afternoon, Tim Hawke pointed at a large expanse of rolling hills where trails weaved through the sagebrush. Two mountain bikers headed toward a"
259,https://www.nbcnews.com/news/world/top-u-s-music-school-cancels-china-tour-after-south-n1073721,NBC News,https://www.nbcnews.com/news/world/top-u-s-music-school-cancels-china-tour-after-south-n1073721,Top U.S. music school effectively cancels China tour after South Korean students denied visas,https://media4.s-nbcnews.com/j/newscms/2019_44/3075461/191029-eastman-theatre-google-ac-914p_d74868aa0943996297606c5920f00b0e.nbcnews-fp-1200-630.jpg,"The Eastman School of Music's dean initially said the tour would proceed without the South Koreans, but reversed his decision after community backlash."
260,,,,,,
261,https://www.thehindu.com/errorpage/,The Hindu,https://www.thehindu.com/errorpage/,,https://www.thehindu.com/static/theme/default/base/img/og-image.jpg,
262,,,,,,
263,,Star Tribune,,The latest from the StarTribune,http://assets.startribune.com/static/img/branding/logos/strib-social-card.png?d=1579800756,"Follow the StarTribune for the news, photos and videos from the Twin Cities and beyond."
264,https://triblive.com/local/westmoreland/north-huntingdon-commissioners-7th-ward-race-contested/,TribLIVE.com,https://triblive.com/local/westmoreland/north-huntingdon-commissioners-7th-ward-race-contested/,North Huntingdon commissioners’ 7th ward race contested,https://triblive.com/wp-content/uploads/2019/10/1867674_web1_gtr-EricGassNorthHuntingdon-103119.jpg,"At least three new commissioners will take office in North Huntingdon starting in December, and maybe fourth, depending upon whether the 7th Ward incumbent can beat his challenger. Commissioner Duane Kucera, 68, a Democrat representing the 7th Ward, is seeking his second term against Republican Eric Gass, 54, who lost"
265,,,,,,
266,https://www.thv11.com/article/news/national/military-news/free-discounted-meals-offered-on-veterans-day-2019/91-bfcf6b4f-0fe6-4a3e-82af-2d6a70ba5b69,KTHV,https://www.thv11.com/article/news/national/military-news/free-discounted-meals-offered-on-veterans-day-2019/91-bfcf6b4f-0fe6-4a3e-82af-2d6a70ba5b69,"Free, discounted meals offered on Veterans Day 2019",https://media.thv11.com/assets/KTHV/images/b1e40d05-5ac1-4b20-8617-b967d79ad2e5/b1e40d05-5ac1-4b20-8617-b967d79ad2e5_1140x641.jpg,Here's a list of restaurants offering free or discounted meals on Veterans Day!
267,https://www.theeagle.com/news/national/man-hopes-to-share-colombian-foods-with-sustainable-farming/article_b321d1cf-9482-5c85-be46-21d2f9ef13bd.html,The Eagle,https://www.theeagle.com/news/national/man-hopes-to-share-colombian-foods-with-sustainable-farming/article_b321d1cf-9482-5c85-be46-21d2f9ef13bd.html,404 Error,https://bloximages.chicago2.vip.townnews.com/theeagle.com/content/tncms/custom/image/ea82e954-f846-11e6-848a-43d1424998d2.jpg,This page no longer exists or has been removed
268,https://www.timesenterprise.com/news/local_news/sunlight-project-telling-stories-of-the-macabre-and-mysterious/article_2b3e9885-48fd-5ada-aac8-11b5e988eb6a.html,Thomasville Times-Enterprise,https://www.timesenterprise.com/news/local_news/sunlight-project-telling-stories-of-the-macabre-and-mysterious/article_2b3e9885-48fd-5ada-aac8-11b5e988eb6a.html,SunLight Project: Telling stories of the macabre and mysterious,https://bloximages.chicago2.vip.townnews.com/timesenterprise.com/content/tncms/assets/v3/editorial/5/a8/5a81b907-ff0a-5421-aced-2db584234b87/5dbb55f80709c.image.jpg?resize=450%2C600,"The SunLight Project Team had a little fun and brought together haunting stories from across the state, examining ghostly tales, otherworldly visitors and a cryptozoological phenomenon."
269,http://www.indiannewslink.co.nz/liquor-store-owners-to-pay-450000-for-law-breach/,indiannewslink.co.nz,http://www.indiannewslink.co.nz/liquor-store-owners-to-pay-450000-for-law-breach/,"Liquor store owners to pay $450,000 for law breach",https://s0.wp.com/i/blank.jpg,"Supplied Content Husband and wife, Paramjeet Singh Parihar and Kuldip Kaur Parihar, who owned two Super Liquor stores in Hamilton have been ordered by the Employment Court to pay a record $200,000 …"
270,https://www.cnn.com/2019/10/31/us/hillside-fire-san-bernardino-trnd/index.html,CNN,https://www.cnn.com/2019/10/31/us/hillside-fire-san-bernardino-trnd/index.html,"Their house barely survived a 1980 wildfire. Now, firefighters are trying to save it from another one",https://cdn.cnn.com/cnnnext/dam/assets/191031111150-hillside-fire-san-bernadino-super-tease.jpg,"Julien Cooper remembers the flames licking his property in 1980 when a devastating wildfire destroyed his neighborhood in San Bernardino, California."
271,https://www.nbcnews.com/think/opinion/wework-uber-s-struggles-show-how-venture-capital-backed-tech-ncna1074881,NBC News,https://www.nbcnews.com/think/opinion/wework-uber-s-struggles-show-how-venture-capital-backed-tech-ncna1074881,Opinion | WeWork's collapse revealed the lies tech founders have been telling workers,https://media4.s-nbcnews.com/j/newscms/2019_44/3023641/190924-adam-neumann-ew-137p_ad398d92568cd9dbddf7a538c9b5ce90.nbcnews-fp-1200-630.jpg,"For a decade, tech founders like Adam Neumann promised they were transforming the economy, but the troubles of WeWork and Uber suggest otherwise."
272,,,,,,
273,https://www.myzimbabwe.co.zw/news/55024-vice-president-general-constantino-chiwenga-heading-home-after-successful-operations-in-china.html,My Zimbabwe News,https://www.myzimbabwe.co.zw/news/55024-vice-president-general-constantino-chiwenga-heading-home-after-successful-operations-in-china.html,Vice President General Constantino Chiwenga heading home after successful operations in China,https://i1.wp.com/www.myzimbabwe.co.zw/wp-content/uploads/2017/11/General-Chiwenga-china_600x337.jpg?fit=600%2C337&ssl=1,"Ailing Zimbabwe Vice President Dr Constantino Chiwenga is coming back home after more than 4 months on medical pilgrimage in South Africa and China, sources say. An official working in the office o…"
274,https://www.globalcitizen.org/en/content/sydney-opera-house-global-goals/,Global Citizen,https://www.globalcitizen.org/en/content/sydney-opera-house-global-goals/,The Sydney Opera House Just Pledged to Support the United Nations’ Global Goals,https://media.globalcitizen.org/thumbnails/e5/68/e5684164-fb1d-49d1-a7bd-9613080b75e4/screen_shot_2019-10-31_at_105648_am.png__1500x670_q85_crop_subsampling-2.png,The performing arts institution hosts almost 11 million guests each year.
275,https://sputniknews.com/middleeast/201910311077192400-turkey-and-iran-pose-danger-to-stability-of-middle-east---israeli-foreign-minister/,,https://sputniknews.com/middleeast/201910311077192400-turkey-and-iran-pose-danger-to-stability-of-middle-east---israeli-foreign-minister/,Turkey and Iran Pose Danger to Stability of Middle East - Israeli Foreign Minister,https://cdn4.img.sputniknews.com/images/107689/28/1076892870.jpg,"The statement comes as the head of Israel’s Foreign Ministry is in Greece for a two-day visit. Earlier on Wednesday, Israel Katz praised the US and Gulf States for imposing sanctions on entities associated with the Islamic Revolutionary Guard Corps, a branch of the Iranian military."
276,https://americanfreepress.net/putin-forces-obama-to-rethink-mideast/,American Free Press,https://americanfreepress.net/putin-forces-obama-to-rethink-mideast/,Putin Forces Obama to Rethink Mideast,/wp-content/uploads/2013/10/40_Putin_Schools_Obama.jpg,By Richard Walker Russia’s dramatic return as a major player in Middle East politics has not only forced Barack Hussein Obama II back to the drawing board to reset his Syria policy but has persuade…
277,https://www.agriculture.com/markets/newswire/a-november-to-remember,Successful Farming,https://www.agriculture.com/markets/newswire/a-november-to-remember,A November to Remember,https://images.agriculture.mdpcdn.com/sites/default/files/styles/width_550/public/image/2016/07/21/NaomiCorn_newsite500sq.jpg,"Usually the month of November is uneventful as far as dramatic market action goes, but this November is one to remember. Here are five major events to monitor."
278,https://news.abplive.com/news/world/kulbhushan-jadhav-case-pakistan-violated-vienna-convention-over-access-to-jadhav-icj-chief-tells-unga-1099693,,https://news.abplive.com/news/world/kulbhushan-jadhav-case-pakistan-violated-vienna-convention-over-access-to-jadhav-icj-chief-tells-unga-1099693,"Kulbhushan Jadhav Case: Pakistan Violated Vienna Convention Over Access To Jadhav, ICJ Chief Tells UNGA",https://static.abplive.com/wp-content/uploads/2019/10/31161237/icjjpg.jpg?impolicy=abp_cdn&imwidth=1200&imheight=628,"Yusuf said that in its Judgment in the Jadhav case that was delivered on July 17, 'the Court found that Pakistan had violated its obligations under Article 36 of the Vienna Convention and that appropriate remedies were due in this case'."
279,http://www.nigerianeye.com/2019/10/mompha-lebanese-associates-arrests-big.html,Nigerian News. Latest Nigeria News. Your online Nigerian Newspaper.,http://www.nigerianeye.com/2019/10/mompha-lebanese-associates-arrests-big.html,"Mompha, Lebanese associate’s arrests big achievement – EFCC Chairman, Magu",https://1.bp.blogspot.com/-EZ5FAyzAlb8/XbtFH5hX8yI/AAAAAAAAt8U/aMFXB1qvw0cbR6XNNKHgDVZvtd0gqEIPwCLcBGAsYHQ/w1200-h630-p-k-no-nu/mompha.PNG,"NigerianEye is a Nigerian Online NewsPaper and Breaking News Source.
NIGERIA NEWS ★ TOP NIGERIAN Newspapers ★ Top news headlines from Nigeria."
280,https://www.pressrepublican.com/news/local_news/can-am-celebrate-international-trade-day-together/article_ae27844b-d9ff-508a-a00d-21dd21a3d1e0.html,Press-Republican,https://www.pressrepublican.com/news/local_news/can-am-celebrate-international-trade-day-together/article_ae27844b-d9ff-508a-a00d-21dd21a3d1e0.html,Can-Am celebrate International Trade Day together,https://bloximages.chicago2.vip.townnews.com/pressrepublican.com/content/tncms/assets/v3/editorial/2/4c/24c51e8d-1cec-58d5-8724-16f32d33bf29/5dba51cc56702.image.jpg?resize=800%2C538,"Canada, U.S. agencies host trade workshops."
281,https://www.mironline.ca/tout-le-monde-reste-en-silence-human-rights-violations-in-vietnam/,MIR,https://www.mironline.ca/tout-le-monde-reste-en-silence-human-rights-violations-in-vietnam/,“Tout le Monde Reste en Silence”: Human Rights Violations in Vietnam,https://secureservercdn.net/198.71.233.135/602.a86.myftpupload.com/wp-content/uploads/2019/10/IMG_7303-1-e1571974680144-768x1024.jpg,"On Sunday, October 6th, staff writer Hayah Amin attended ""Vietnamplify,"" a conference that works to spread awareness for current human rights violations within Vietnam and the ways in which the Vietnamese-Canadian community can respond. "
282,https://www.aljazeera.com/news/2019/10/releases-footage-detail-al-baghdadi-raid-191031010956094.html,,https://www.aljazeera.com/news/2019/10/releases-footage-detail-al-baghdadi-raid-191031010956094.html,"US releases footage, provides more detail on al-Baghdadi raid ",https://www.aljazeera.com/mritems/Images/2019/10/31/630af6e55edb44b2a034ddfd8e3a9024_18.jpg,General who oversaw operation explains weekend raid targeting ISIL leader as Pentagon releases short snippets of video.
283,,The Topeka Capital-Journal,,Supreme Court ruling adds twist to Topeka businessman Kent Lindemuth's appeal of threat conviction,https://www.cjonline.com/storyimage/KS/20191030/NEWS/191039903/AR/0/AR-191039903.jpg,An attorney handling the appeal of a Topeka businessman's felony criminal threat conviction Wednesday stepped before the Kansas Supreme Court for what
284,https://www.q95fm.net/2019/10/31/state-officials-hosted-a-conversation-about-senior-hunger-issues/,Q95FM,https://www.q95fm.net/2019/10/31/state-officials-hosted-a-conversation-about-senior-hunger-issues/,State Officials Hosted A Conversation About Senior Hunger Issues. ,https://dehayf5mhw1h7.cloudfront.net/wp-content/uploads/sites/1180/2019/10/31105530/pexels-photo-167964.jpeg,"State officials hosted a conversation about senior hunger issues in Frankfort.  “Unfortunately in Kentucky 1 in 6 seniors do not have enough access to affordable, nutritious food,” said Shannon Gadd with the Commissioner Department for Aging and"
285,https://www.gossipcop.com/ben-affleck-relapse-months-before-slip/,Gossip Cop,https://www.gossipcop.com/ben-affleck-relapse-months-before-slip/,Ben Affleck Secretly Relapsed Months Before His Slip?,https://www.gossipcop.com/wp-content/uploads/2019/10/Ben-Affleck-Relapse-Slip-592x395.jpg,"Ben Affleck did not secretly relapse months prior to his slip this past weekend, despite an untrue tabloid report. Gossip Cop can correct the story. It’s not accurate. As widely reported, Affleck suffered a sobriety setback over the weekend when he was filmed stumbling outside of a Halloween party in Los Angeles. The actor later …"
286,https://www.stuff.co.nz/national/117057026/omv-granted-marine-discharge-consent-for-taranaki-basin-drilling-programme,Stuff,https://www.stuff.co.nz/national/117057026/omv-granted-marine-discharge-consent-for-taranaki-basin-drilling-programme,OMV granted marine discharge consent for Taranaki Basin drilling programme,https://resources.stuff.co.nz/content/dam/images/1/x/p/0/t/0/image.related.StuffLandscapeSixteenByNine.1420x800.1xoxs2.png/1572499232256.jpg,The Environmental Protection Authority says there will be negligible effect on marine life from a drilling programme off Taranaki.
287,https://www.newindianexpress.com/states/kerala/2019/oct/31/cyclone-maha-to-cause-heavy-rain-in-kerala-orange-alert-in-ten-districts-2055083.html,The New Indian Express,https://www.newindianexpress.com/states/kerala/2019/oct/31/cyclone-maha-to-cause-heavy-rain-in-kerala-orange-alert-in-ten-districts-2055083.html,"Cyclone Maha: Heavy rain lashes Kerala, orange alert in 10 districts",https://images.newindianexpress.com/uploads/user/imagelibrary/2019/10/31/w600X390/tvmrain_eps213.jpg,"The State Disaster Management Authority has sounded Orange alert in 10 districts - Alappuzha, Ernakulam, Idukki, Thrissur, Palakkad, Malappuram, Kozhikode, Wayanad, Kannur and Kasaragod."
288,https://www.townandcountrymag.com/leisure/travel-guide/a29390070/private-jet-tour-tcs-world-travel-black-planes/,Town & Country,https://www.townandcountrymag.com/leisure/travel-guide/a29390070/private-jet-tour-tcs-world-travel-black-planes/,"8 Countries, 21 Days, 1 Private Plane: The Ultimate Travel Bucket List Trip","https://hips.hearstapps.com/hmg-prod.s3.amazonaws.com/images/tcx110119tcs012-web-lo-1570545573.jpg?crop=1xw:0.8044744100520993xh;center,top&resize=1200:*",The fantasy of private jet travel has now come true for you and 51 of your new best friends.
289,https://ariananews.af/cia-backed-afghan-forces-commit-atrocities-hrw/,Ariana News,https://ariananews.af/cia-backed-afghan-forces-commit-atrocities-hrw/,CIA-Backed Afghan Forces Commit Atrocities: HRW - Ariana News,https://ariananewspullzone01-j7rguih.netdna-ssl.com/wp-content/uploads/2019/06/Afghan-forces_1.jpg,The CIA-backed Afghan forces have committed summary executions and other grave abuses without accoun
290,https://merryjane.com/culture/a-short-history-on-the-invention-and-evolution-of-weed-infused-candy,MERRY JANE,https://merryjane.com/culture/a-short-history-on-the-invention-and-evolution-of-weed-infused-candy,A Short History on the Invention and Evolution of Weed-Infused Candy,https://files.merryjane.com/uploads/generic/1572558305424_WeedEVOLUTIONWIDECLOCK(2).jpg,"Cannabis candies take center stage during the Halloween holidaze. But where did they get their start, what did the first weed treats look like, and how have they developed over time? "
291,https://www.edie.net/blog/Scary-sustainability-stories-to-tell-in-the-dark-or-at-the-end-of-the-world/6098697,edie.net,https://www.edie.net/blog/Scary-sustainability-stories-to-tell-in-the-dark-or-at-the-end-of-the-world/6098697,Scary sustainability stories to tell in the dark (or at the end of the world) - Matt Mace's blog,https://edienet.s3.amazonaws.com/blog/images/6098697.jpg?v=31/10/2019 15:35:56,"Forget remakes of The Grudge, the only horror stories you need this Halloween are right outside your window. If the world is dying, we're all playing the role of murderer, but its not too late to create an army of saviours."
292,https://www.press-citizen.com/story/news/2019/10/30/speaker-pat-grassley-defends-tax-credits-dummies-meeting/4102273002/,Iowa City Press-Citizen,https://www.press-citizen.com/story/news/2019/10/30/speaker-pat-grassley-defends-tax-credits-dummies-meeting/4102273002/,Incoming Iowa House Speaker Pat Grassley defends 'tax credits for dummies' committee meeting,"https://www.gannett-cdn.com/presto/2019/10/07/PDEM/ecaa9391-edb2-4726-b79a-a5ff68e9b9cc-1007_IowaHouse_006.jpg?crop=2999,1687,x0,y152&width=1600&height=800&fit=bounds","The value of state tax credits grew from $153 million in 2005 to $373 million in 2019, according to the Department of Revenue."
293,https://www.tribuneindia.com/news/archive/hooda-frontrunner-for-clp-leader-post-854175,Tribuneindia News Service,https://www.tribuneindia.com/news/archive/hooda-frontrunner-for-clp-leader-post-854175,Hooda frontrunner for CLP leader post,https://images.tribuneindia.com/cms/gall_content/2019/10/2019_10$largeimg31_Thursday_2019_091934011.jpg,NEW DELHI: Haryana Congress MLAs will meet on November 1 in Chandigarh to elect the leader of the Congress Legislature Party in the 90-member state Assembly.
294,https://in.news.yahoo.com/unseasonal-rain-lashes-parts-gujarat-134922759.html,,https://in.news.yahoo.com/unseasonal-rain-lashes-parts-gujarat-134922759.html,"Unseasonal rain lashes parts of Gujarat, damages crops Ahmedabad, Oct 30 (PTI) Even as cyclone 'Kyar",https://s.yimg.com/cv/apiv2/social/images/yahoo_default_logo.png,"Unseasonal rain lashes parts of Gujarat, damages crops Ahmedabad, Oct 30 (PTI) Even as cyclone 'Kyarr' sparedGujarat and moved towards Oman coast, it brought unseasonalrain at several places in the state in 24 hours till Wednesdaymorning, the India Meteorological Department (IMD) said."
295,https://www.indiatoday.in/india/story/after-drama-over-maharashtra-cm-s-post-bjp-shiv-sena-show-signs-of-truce-1614260-2019-10-31,India Today,https://www.indiatoday.in/india/story/after-drama-over-maharashtra-cm-s-post-bjp-shiv-sena-show-signs-of-truce-1614260-2019-10-31,"After drama over Maharashtra CM's post, BJP, Shiv Sena show signs of truce",https://akm-img-a-in.tosshub.com/indiatoday/images/story/201910/mahsgcdsfdfffefdfvfdgf-647x363.png?EoTwV.wwyss0yWR5ie9Do.kj.ZRkP8Ab,"Thanking Shiv Sena Chief Uddhav Thackeray, Devendra Fadnavis, who is re-elected as leader of the state BJP legislature party, ​said, ""This mandate is for Mahayuti [BJP-Shiv Sena alliance]. No one should have any doubt that the next government will be that of Mahayuti. Do not believe in rumours."" "
