,source_url,site_name,site_url,title,img_url,description
116,https://www.timesnownews.com/india/article/swami-chinmayanand-writes-to-up-police-demands-gangster-act-against-law-student-for-blackmailing-him/506472,,https://www.timesnownews.com/india/article/swami-chinmayanand-writes-to-up-police-demands-gangster-act-against-law-student-for-blackmailing-him/506472,"Swami Chinmayanand writes to UP Police, demands Gangster Act against law student for blackmailing him","https://imgk.timesnownews.com/story/Swami_Chinmayanand.jpg?tr=w-560,h-292,fo-top",The law student and her three friends allegedly demanded Rs 5 crore from Chinmayanand issuing a threat that they will upload online video clips in which the law student was seen giving him a massage.
117,https://www.uppermichiganssource.com/content/news/Human-Rights-Day--563555391.html ,,https://www.uppermichiganssource.com/content/news/Human-Rights-Day--563555391.html ,Human Rights Day recognized at Marquette Alternative High School,https://media.graytvinc.com/images/hr2.PNG,"Students at Marquette Alternative High School spent the day exploring the United Nations Declaration of Human Rights, preparing them for their yearlong focus of building an atmosphere of self-empowerment, tolerance and understanding of other cultures and individuals. "
118,https://latindispatch.com/2019/10/21/state-of-emergency-declared-in-chile-over-subway-fare-increase/,Latin America News Dispatch,https://latindispatch.com/2019/10/21/state-of-emergency-declared-in-chile-over-subway-fare-increase/,State of Emergency Declared in Chile Over Subway Fare Increase - Latin America News Dispatch,https://latindispatch.com/wp-content/uploads/2019/10/7787935244_5c4ed69abb_c.jpg,TODAY IN LATIN AMERICA CHILE: Chilean protesters shut down the capital’s subway system over the weekend in demonstrations against fare increases. The protests began Friday evening when high school students …
119,https://www.wacotrib.com/news/trending/inside-west-virginia-s-opioid-battle-where-thousands-of-children/article_445f0ca8-f883-5c8d-94c9-32b6c7c34e60.html,WacoTrib.com,https://www.wacotrib.com/news/trending/inside-west-virginia-s-opioid-battle-where-thousands-of-children/article_445f0ca8-f883-5c8d-94c9-32b6c7c34e60.html,"Inside West Virginia's opioid battle, where thousands of children are now in foster care",https://bloximages.chicago2.vip.townnews.com/wacotrib.com/content/tncms/assets/v3/editorial/4/45/445f0ca8-f883-5c8d-94c9-32b6c7c34e60/5da9fb642036f.preview.jpg?crop=1851%2C1041%2C69%2C0&resize=1120%2C630&order=crop%2Cresize,The state is a case study in how legal fights against drug companies don't always balance the scales.
120,https://www.nzherald.co.nz/lifestyle/news/article.cfm?c_id=6&objectid=12278489,NZ Herald,https://www.nzherald.co.nz/lifestyle/news/article.cfm?c_id=6&objectid=12278489,Kiwi completes record-breaking bike ride from India to Germany,https://www.nzherald.co.nz/resizer/jvzJD9_mDLVM9ws2cevnyx2H5QA=/1200x0/smart/filters:quality(70)/arc-anglerfish-syd-prod-nzme.s3.amazonaws.com/public/IMSDPS6KVVCBBCWVD5PT3RY6QI.png,Naresh Kumar went on an epic bike ride to raise awareness of human trafficking.
121,,,,,,
122,https://www.defenceweb.co.za/featured/exercise-mosi-will-see-chinese-russian-and-south-african-navies-work-together/,defenceWeb,https://www.defenceweb.co.za/featured/exercise-mosi-will-see-chinese-russian-and-south-african-navies-work-together/,"Exercise Mosi will see Chinese, Russian and South African navies work together - defenceWeb",https://www.defenceweb.co.za/wp-content/uploads/Unorganized/ex_mosi_memo-signing.jpg,"Ahead of the first joint naval exercise between China, Russia and South Africa the main planning conference was held at SA Navy fleet headquarters in Simon’s Town. More than 40 senior officers, including Rear Admiral Tskhui Yuzhong from the People’s Liberation Army Navy (PLAN) and Rear Admiral Vladimir Zemskov from the Russian Federation Navy (RFN) …"
123,https://www.thenational.scot/news/17978869.paul-murton-picks-favourite-shetland-gems/,The National,https://www.thenational.scot/news/17978869.paul-murton-picks-favourite-shetland-gems/,Viking Isles: Author Paul Murton picks his favourite Shetland gems,https://www.thenational.scot/resources/images/10561637/,THE author and BBC Grand Tours presenter Paul Murton has written a new book about his very personal journey to Scotland's Viking Isles: Orkney and… 
124,https://www.aerotechnews.com/blog/2016/08/29/tradoc-g-2-army-will-augment-navy-air-force-in-future-conflicts/,Aerotech News & Review,https://www.aerotechnews.com/blog/2016/08/29/tradoc-g-2-army-will-augment-navy-air-force-in-future-conflicts/,"TRADOC G-2: Army will augment Navy, Air Force in future conflicts | Aerotech News & Review",https://www.aerotechnews.com/wp-content/uploads/2016/08/army-tradoc.jpg,"Missile Defense Agency photograph The Army could use its capabilities, including its missiles, to help shape the battlefield for the Air Force and Navy, said Tom Greco, deputy chief of staff, G-2, Army Training and Doctrine Command. Greco spoke at a Mad Scientist media roundtable, Aug. 23, 2016. The U.S. Army is considered the world’s …"
125,https://www.poz.com/article/25-years-contributors,POZ,https://www.poz.com/article/25-years-contributors,25 Years of Contributors,https://cdn2.poz.com/78765_POZContributors-.jpg_554729ac-baa2-4a0d-b24e-f78a903894fc_x2.jpeg,POZ writers and artists have thrived at the magical intersection of lived experience and boundless talent.
126,https://www.crossville-chronicle.com/community/school_news/smhs-cchs-students-attend-summer-governor-s-school/article_ccc98fcc-f432-11e9-a896-5b2ba8a7cc23.html,Crossville Chronicle,https://www.crossville-chronicle.com/community/school_news/smhs-cchs-students-attend-summer-governor-s-school/article_ccc98fcc-f432-11e9-a896-5b2ba8a7cc23.html,"SMHS, CCHS students attend summer Governor’s School",https://bloximages.chicago2.vip.townnews.com/crossville-chronicle.com/content/tncms/assets/v3/editorial/b/62/b62ac63c-f432-11e9-b73f-a3a1941fff18/5dadfc61512de.image.jpg?resize=840%2C630,"Students from Stone Memorial and Cumberland County High School attended Governor’s School, a summer learning program. There are various study programs to apply to and learn from. These students spent"
127,https://www.peoplesworld.org/article/top-afl-cio-staffer-says-johnsons-brexit-pact-bad-for-u-k-and-u-s-workers/,People's World,https://www.peoplesworld.org/article/top-afl-cio-staffer-says-johnsons-brexit-pact-bad-for-u-k-and-u-s-workers/,Top AFL-CIO staffer says Johnson’s Brexit pact bad for U.K. and U.S. workers,https://www.peoplesworld.org/wp-content/uploads/2019/10/pjimage-27.jpg,"WASHINGTON (PAI)—British Tory Prime Minister Boris Johnson’s new “Brexit” deal, taking the United Kingdom out of the 28-nation European Union, is bad for workers in both the U.K. and the U.S., a top AFL-CIO staffer says. But the pact may sink."
128,https://www.gladstoneobserver.com.au/news/premier-deputy-stay-put-in-the-city/3865231/,Observer,https://www.gladstoneobserver.com.au/news/premier-deputy-stay-put-in-the-city/3865231/,"Premier, deputy stay put in the city",https://media.apnarm.net.au/media/images/2019/10/28/v3imagesbin0401edffc74a60d4cf5e3d9d904c4437-2bsdccr134khss888t2_ct1880x930.jpg,As Queensland’s politicians fanned out across the state to attend regional forums there were two notable exceptions - the Premier and her deputy. 
129,https://112.international/ukraine-and-eu/trump-impeachment-probe-to-focus-on-more-key-witnesses-this-week-44727.html,,https://112.international/ukraine-and-eu/trump-impeachment-probe-to-focus-on-more-key-witnesses-this-week-44727.html,Trump impeachment probe to focus on more key witnesses this week,https://img.112.international/original/2018/08/23/276406.PNG,Veteran State Department officer William Taylor and at least four other witnesses are about to speak before congressional committees
130,https://charter97.org/en/news/2019/10/21/352636/,,https://charter97.org/en/news/2019/10/21/352636/,Video Message: Opponents Of Battery Plant Responded To Lukashenka,https://i.c97.org/ai/336294/aux-head-1559487780-2019_06-02_brest_360.jpg,The Brest citizens reacted to the dictator's words.
131,https://www.forbes.com/sites/jonathonkeats/2019/10/21/liberty/,Forbes,https://www.forbes.com/sites/jonathonkeats/2019/10/21/liberty/,See The Statue Of Liberty’s Italian Sister – And Possible Inspiration – In A Special Exhibit On Ellis Island,https://thumbor.forbes.com/thumbor/600x315/https%3A%2F%2Fspecials-images.forbesimg.com%2Fimageserve%2F5dad1028a210800006f006f7%2F960x0.jpg%3FcropX1%3D0%26cropX2%3D1758%26cropY1%3D155%26cropY2%3D1144,"Three years before the Statue of Liberty was erected in New York Harbor, a similar monument, representing equivalent values, was installed at the Basilica of Santa Croce in Florence. Designed by different sculptors, they’re finally in dialogue… and they have a lot to say to each other."
132,https://patch.com/pennsylvania/doylestown/documents-detail-chaos-bucks-co-campground-killings,"Doylestown, PA Patch",https://patch.com/pennsylvania/doylestown/documents-detail-chaos-bucks-co-campground-killings,Documents Detail Chaos Before Bucks Co. Campground Killings,https://patch.com/img/cdn20/users/127196/20191021/113728/styles/patch_image/public/miles-jones___21113458846.jpg,Information released by police provides details on the moments leading up to a shooting at a Bucks County campground that killed two.
133,https://www.dvidshub.net/news/348380/us-army-japan-holds-emergency-evacuation-program-phase-ii-drill,DVIDS,https://www.dvidshub.net/news/348380/us-army-japan-holds-emergency-evacuation-program-phase-ii-drill,U.S. Army Japan holds Emergency Evacuation Program Phase II Drill,https://cdn.dvidshub.net/media/thumbs/photos/1910/5847472/1000w_q75.jpg,"A group of about 70 volunteers increased not only their personal readiness during the Emergency Evacuation Program Phase II Drill at Camp Zama, Japan, Oct. 17, 2019, but that of U.S. Army Japan as a whole."
134,https://www.starweekly.com.au/localbusiness/in-focus-taking-the-hassle-out-of-holidaysif1019/,Star Weekly,https://www.starweekly.com.au/localbusiness/in-focus-taking-the-hassle-out-of-holidaysif1019/,"Flying soon? No long queues, parking in front of check-in, everything’s cruisy at Avalon Airport",https://www.starweekly.com.au/wp-content/uploads/2019/10/infocusAvalon.jpg,"“You’ve no doubt noticed that the days are longer, the nights are getting warmer, the footy is over, and we’ve all made that confusing clock switch to daylight saving time,” says Avalon Airport’s chief executive Justin Giddings."
135,,,,,,
136,https://www.3quarksdaily.com/3quarksdaily/2019/10/graz-austria-and-me-its-complicated.html,3 Quarks Daily,https://www.3quarksdaily.com/3quarksdaily/2019/10/graz-austria-and-me-its-complicated.html,"Graz, Austria and me? It's complicated | 3 Quarks Daily",https://www.3quarksdaily.com/wp-content/uploads/2019/10/natuerlich-ist-gerlos-ein-malerisch-am-ende-der-tiroler-welt-gelegenes-bergdoerflein-360x203.jpeg,"by Cathy Chua Shortly before my first trip to Austria in September, a story did the rounds of  a tourist sued for leaving a review on Tripadvisor complaining of a photographic display of Nazis at a hotel in a little town called Gerlos in the Tyrolean Alps. The case has not yet ended, but for now…"
137,https://allafrica.com/stories/201910210342.html,allAfrica.com,https://allafrica.com/stories/201910210342.html,"Ghana: Low SHS Enrolment in Bono, Bono East, Ahafo Regions",https://cdn07.allafrica.com/static/images/structure/aa-logo-rgba-no-text-128x128.png,The Parliamentary Select Committee on Education has raised concern about what they termed 'over staffing' in some senior high schools in the country.
138,https://www.blackhillsfox.com/content/news/Sturgis-homeowner-reportedly-shoots-and-kills-intruder-563510031.html ,,https://www.blackhillsfox.com/content/news/Sturgis-homeowner-reportedly-shoots-and-kills-intruder-563510031.html ,Sturgis homeowner reportedly shoots and kills intruder,https://media.graytvinc.com/images/Deadly+Shooting+gfx+MGN.jpg,"Police say when they arrived at the home, the found a man with a single gunshot wound to the chest. He later died at Sturgis Regional Hospital."
139,https://catholicleader.com.au/people/young-woman-chosen-by-iraqi-bishop-to-help-rebuild-isis-ravaged-nation-full-of-hope-at-30,The Catholic Leader,https://catholicleader.com.au/people/young-woman-chosen-by-iraqi-bishop-to-help-rebuild-isis-ravaged-nation-full-of-hope-at-30,Young woman chosen by Iraqi bishop to help rebuild ISIS-ravaged nation full of hope at 30 | The Catholic Leader,https://catholicleader.com.au/wp-content/uploads/2019/10/pg28-hanar-keka.jpg,"HANAR Keka turned 30 earlier this year and, because she was a long way from home, she decided to do something different to celebrate. The young Catholic woman from Iraq spent the day on her own in Brisbane’s St Stephen’s Cathedral. “I decided to take a break in the cathedral,” she said. “I spent all ..."
140,,,,,,
141,https://www.freshplaza.com/article/9154977/organic-supermarket-chain-marqt-is-merging-with-parent-company-of-ekoplaza/,,https://www.freshplaza.com/article/9154977/organic-supermarket-chain-marqt-is-merging-with-parent-company-of-ekoplaza/,Organic supermarket chain Marqt is merging with parent company of Ekoplaza,https://www.freshplaza.com/remote.axd?https://agfstorage.blob.core.windows.net/misc/FP_com/2019/10/21/Retail_1710_2.jpg?preset=OgImage,"Glovo continues expansion in KenyaAfter previously announcing it had expanded its coverage to the towns of Kitengela and Nakuru, Glovo has said it has added Mombasa as well. Glovo said it had…"
142,https://wsau.com/news/articles/2019/oct/21/pentagon-chief-arrives-in-riyadh-as-iran-tensions-simmer-and-russia-makes-moves/949333/,WSAU,https://wsau.com/news/articles/2019/oct/21/pentagon-chief-arrives-in-riyadh-as-iran-tensions-simmer-and-russia-makes-moves/949333/,Pentagon chief visits Saudi Arabia as tensions simmer with Iran,https://radiocms-images.us1.eldarioncloud.com/resize/1200/https://storage.googleapis.com/media.mwcradio.com/mimesis/2019-10/21/2019-10-21T150833Z_1_LYNXMPEF9K15R_RTROPTP_3_USA-AFGHANISTAN-PENTAGON.JPG?upscale=False,"By Idrees Ali
RIYADH (Reuters) - U.S. Defense Secretary Mark Esper arrived in Saudi Arabia on Monday, with tensions simmering between Washington and Tehran, and Russia seeking to boost its influence in the Middle East.
Esper is likely to meet King Salman and Crown Prince Mohammed bin Salman on his first trip to the key regional ally since taking..."
143,,Columbia Daily Tribune,,State blocks $2 million in payments to Medicaid scammers,https://www.columbiatribune.com/storyimage/MO/20191021/NEWS/191029891/AR/0/AR-191029891.jpg,JEFFERSON CITY — Missouri officials have prevented over $2 million from being paid out to a company involved in an apparent attempt to scam the
144,,,,,,
145,https://www.cbc.ca/news/canada/new-brunswick/police-car-dealership-1.5328280,CBC,https://www.cbc.ca/news/canada/new-brunswick/police-car-dealership-1.5328280,Fredericton police investigate fraud allegations involving used car dealer | CBC News,https://i.cbc.ca/1.5328292.1571597801!/fileImage/httpImage/image.jpg_gen/derivatives/16x9_620/w-p-auto.jpg,"Fredericton police are investigating a ""significant fraud"" involving a used car dealership in the city, the force has confirmed. W&P Auto Sales, on Riverside Drive, closed in August."
146,,,,,,
147,https://www.stamfordadvocate.com/opinion/article/Editorial-Lamont-must-release-transit-plan-14548266.php,StamfordAdvocate,https://www.stamfordadvocate.com/opinion/article/Editorial-Lamont-must-release-transit-plan-14548266.php,Editorial: Lamont must release transit plan,https://s.hdnux.com/photos/01/06/35/56/18471836/3/rawImage.jpg,"The failure to date to come up with a transportation funding plan for Connecticut falls entirely on the Lamont administration. The governor came into office this year with a large majority in both Houses of the state Legislature and said transportation was among his top priorities. His record so far on the issue is to go back on a campaign promise and then prove wholly unable to move support in favor of his initial plans. 
 So now the  state is waiting  for the next version of his proposal, which is to be named CT 2030 and call for spending about $20 billion over the next decade on highway and Metro-North maintenance and construction. As the wait continues, the administration says talks are underway among top legislators and Lamont staffers. But as far as the public is concerned, no one knows anything. 
 In the meantime, local communities are sounding the alarm. With $30 million in aid to municipalities months overdue, seasonal spending is taking a hit. That means fall tree trimming and, eventually, winter snow removal are at risk. Lamont is delaying action on a bond package,  according to the CT Mirror , to provide leverage to spur lawmakers to help pass the spending plan - a spending plan that, again, no one has seen. 
 Beyond the immediate concern is the realization that transportation is and will continue to be vital to the state's economic competitiveness. There is no prescription for increased job growth in coming years that doesn't rely on better, more reliable roads and rail service. Lamont has said he understands this, and that he is working hard to get as many people as possible on board before the plan is..."
148,https://qz.com/1732135/kushner-and-mnunchin-will-attend-saudis-davos-in-the-desert/,Quartz,https://qz.com/1732135/kushner-and-mnunchin-will-attend-saudis-davos-in-the-desert/,"Trump admin apparently over Khashoggi killing, will attend Saudi’s ‘Davos in the Desert’",https://cms.qz.com/wp-content/uploads/2019/10/mnuchin-kushner-e1571667863691.jpg?quality=75&strip=all&w=1400,The US skipped last year's event in the wake of the journalist's slaying.
149,https://www.arabianbusiness.com/energy/431073-more-indian-oil-companies-said-to-attract-international-interest,ArabianBusiness.com,https://www.arabianbusiness.com/energy/431073-more-indian-oil-companies-said-to-attract-international-interest,More Indian oil companies said to attract international interest,https://www.arabianbusiness.com/sites/default/files/styles/fb_share_style_image/public/images/2019/10/21/Bharat-Petroleum.jpg?itok=k_qpbC61,The Narenedra Modi-led Indian cabinet has already given the go ahead to privatise state-owned Bharat Petroleum Corp (BPCL)
150,https://www.abc-7.com/story/41209136/tour-the-heart-of-florida-with-joyride-silver-adventures,,https://www.abc-7.com/story/41209136/tour-the-heart-of-florida-with-joyride-silver-adventures,Tour the Heart of Florida with Joyride Silver Adventures,https://WZVN.images.worldnow.com/images/18872151_G.jpg?lastEditedDate=1571654500000,"Joyride Silver Adventures has many tours out of Cape Coral, including a tour through farms across the middle of Florida."
151,https://thediplomat.com/2019/10/the-second-informal-summit-is-done-now-for-the-hard-part-in-india-china-ties/,,https://thediplomat.com/2019/10/the-second-informal-summit-is-done-now-for-the-hard-part-in-india-china-ties/,The Second ‘Informal Summit’ Is Done. Now for the Hard Part in India-China Ties,https://thediplomat.com/wp-content/uploads/2019/10/sizes/td-story-s-2/thediplomat-ap-19285250639875.jpg,"The optics of the latest “informal summit” aside, India and China remain worlds apart on major issues."
152,https://www.afrc.af.mil/News/Article-Display/Article/1993493/senate-confirms-barrett-to-be-air-force-secretary/,March Air Reserve Base,https://www.afrc.af.mil/News/Article-Display/Article/1993493/senate-confirms-barrett-to-be-air-force-secretary/,Senate confirms Barrett to be Air Force secretary,https://media.defense.gov/2019/Oct/16/2002197622/825/780/0/191016-F-XX000-1741.JPG,"The 85 to 7 vote makes Barbara Barrett the third consecutive woman confirmed to lead the Air Force and its 685,000 total force Airmen. Barrett replaces Heather Wilson who resigned in May."
153,https://www.dailymail.co.uk/wires/reuters/article-7586223/Mothers-Colombias-disappeared-seek-justice-war-tribunal.html,Mail Online,https://www.dailymail.co.uk/wires/reuters/article-7586223/Mothers-Colombias-disappeared-seek-justice-war-tribunal.html,Mothers of Colombia's disappeared seek justice at war tribunal,https://i.dailymail.co.uk/i/pix/m_logo_636x382px.png,"By Anastasia MoloneyBOGOTA, Oct 17 (Thomson Reuters Foundation) - Mothers of  young men and teenagers who say their sons were murdered by  government..."
154,https://www.delfi.lt/a/82582585,DELFI,https://www.delfi.lt/a/82582585,US tariffs to affect 0.12 pct of exports to US,https://g2.dcdn.lt/images/pix/suriu-skyrius-82582617.jpg,"US tariffs on 7.5 billion US dollars’ worth of EU goods, imposed by President Donald Trump last week, will only affect 0.12 percent of Lithuanian exports to America."
155,https://www.nytimes.com/2019/10/21/world/canada/trudeau-election.html,,https://www.nytimes.com/2019/10/21/world/canada/trudeau-election.html,Will Canada Forgive Justin Trudeau?,https://static01.nyt.com/images/2019/10/21/world/21canada-trudeau-sub/21canada-trudeau-sub-facebookJumbo.jpg,"Buffeted by controversy, Canada’s prime minister is seeking a second term in a tight race."
156,https://www.bbc.com/news/world-europe-50094830,BBC News,https://www.bbc.com/news/world-europe-50094830,Murdered for trying to save Europe's oldest forests,https://ichef.bbci.co.uk/news/1024/branded_news/12D99/production/_109290277_f45d2490-7362-4ef7-9568-24abb8a7a54a.jpg,"Liviu Pop died last week, the second forest ranger killed in the past month."
157,https://www.sott.net/article/422352-A-panicked-Israel-is-an-even-more-dangerous-Israel,Sott.net,https://www.sott.net/article/422352-A-panicked-Israel-is-an-even-more-dangerous-Israel,A panicked Israel is an even more dangerous Israel -- Sott.net,https://www.sott.net/image/s27/542340/full/President_Trump_at_the_Israel_.jpg,"Former US Presidential Candidate, Pat Buchanan has written, ""the Middle East and world, have been awakened to the reality that, when Trump said he was ending everlasting commitments and bringing U.S. troops home from ""endless wars,"" he was not..."
158,,,,,,
159,https://www.al-monitor.com/pulse/originals/2019/10/palestinian-prime-minister-visit-egypt-economic-deals.html,Al-Monitor,https://www.al-monitor.com/pulse/originals/2019/10/palestinian-prime-minister-visit-egypt-economic-deals.html,"Egypt, Palestine make plans to boost economic ties",https://9c998969b63acdb676d1-37595348221e1b716e1a6cfee3ed7891.ssl.cf1.rackcdn.com/almpics/2019/10/RTR3AFZA.jpg/RTR3AFZA-870.jpg,"A Palestinian delegation to Egypt discussed ways to boost cooperation in the fields of oil, economy and trade as Palestinians work to sever economic ties with Israel."
160,https://www.tcpalm.com/story/news/local/shaping-our-future/growth/2019/10/21/st-lucie-looking-new-home-aquarium-regional-history-center/4026701002/,TCPalm,https://www.tcpalm.com/story/news/local/shaping-our-future/growth/2019/10/21/st-lucie-looking-new-home-aquarium-regional-history-center/4026701002/,"St. Lucie wants to move county aquarium, Regional History Center to Fort Pierce locations","https://www.gannett-cdn.com/presto/2019/06/08/PTCN/0163ce94-4a19-433a-9cec-9644d1bf1930-TCN_WORLD_OCEANS_0001.JPG?crop=6437,3621,x0,y122&width=3200&height=1680&fit=bounds",The county wants to move the aquarium and the History Center because both are in an evacuation zone.
161,,,,,,
162,https://www.poz.com/article/25-years-contributors,POZ,https://www.poz.com/article/25-years-contributors,25 Years of Contributors,https://cdn2.poz.com/78765_POZContributors-.jpg_554729ac-baa2-4a0d-b24e-f78a903894fc_x2.jpeg,POZ writers and artists have thrived at the magical intersection of lived experience and boundless talent.
163,https://www.infowars.com/trump-demands-deposition-of-corrupt-adam-schiff/,,https://www.infowars.com/trump-demands-deposition-of-corrupt-adam-schiff/,Trump ‘Demands Deposition’ Of ‘Corrupt’ Adam Schiff,https://assets.infowars.com/2019/10/trumpschiff293869.jpg,Critics charge Schiff and Pelosi of violating The Logan Act.
164,https://www.timesargus.com/news/world/the-latest-erdogan-aide-meets-with-russia-s-syria-envoy/article_33c022a9-7cf6-51af-8ad5-db2c6216a2c0.html,Times Argus,https://www.timesargus.com/news/world/the-latest-erdogan-aide-meets-with-russia-s-syria-envoy/article_33c022a9-7cf6-51af-8ad5-db2c6216a2c0.html,404 Error,https://bloximages.chicago2.vip.townnews.com/timesargus.com/content/tncms/custom/image/b304aa08-5df8-11e8-b455-b382f4872e89.jpg?resize=600%2C748,This page no longer exists or has been removed
165,https://allafrica.com/stories/201910220155.html,allAfrica.com,https://allafrica.com/stories/201910220155.html,Morocco: Moroccan Journalist Hajar Raissouni Free At Last,https://allafrica.com/download/pic/main/main/csiid/00540854:ce24dbe9725430146047038d8d4d1be3:arc614x376:w1200.jpg,"Press Release - Reporters Without Borders (RSF) welcomes the release of Hajar Raissouni, a Moroccan journalist held since 30 August who was sentenced on 30 September to a year in prison for seeking an &quot;illegal abortion&quot; and for &quot;sexual relations outside marriage.&quot;"
166,https://eurasianet.org/turkic-council-expands-as-trade-falls,Eurasianet,https://eurasianet.org/turkic-council-expands-as-trade-falls,Turkic Council expands as trade falls,,The Turkic Council’s first 10 years offer little reason for economic optimism
