,source_url,site_name,site_url,title,img_url,description
173,https://www.ktvh.com/news/helena-news/helena-indian-alliance-looking-at-expansion-after-outgrowing-current-building,KTVH,https://www.ktvh.com/news/helena-news/helena-indian-alliance-looking-at-expansion-after-outgrowing-current-building,Helena Indian Alliance looking at expansion after outgrowing current building,https://ewscripps.brightspotcdn.com/dims4/default/ecd5819/2147483647/strip/true/crop/1920x1008+0+36/resize/1200x630!/quality/90/?url=https%3A%2F%2Fewscripps.brightspotcdn.com%2F06%2F4f%2Fab99828a4464b166d9a4f3f317d9%2Fleo-pocha.png,"For the past 50 years HIA has been advocating for and addressing the mental, physical, and social welfare of the Native American population in the Helena Community."
174,http://www.canindia.com/pakistan-offers-to-host-saudi-iran-talks/,Canindia News,http://www.canindia.com/pakistan-offers-to-host-saudi-iran-talks/,Pakistan offers to host Saudi-Iran talks,,"Islamabad, Oct 15 (IANS) Pakistan is pushing for direct talks between Saudi and Iranian officials as part of its ongoin..."
175,https://www.cnet.com/roadshow/news/california-ab179-law-dealership-recall-warranty-reimbursement-rate/,Roadshow,https://www.cnet.com/roadshow/news/california-ab179-law-dealership-recall-warranty-reimbursement-rate/,New California law sets the reimbursement rate for dealers who do recalls - Roadshow,https://cnet3.cbsistatic.com/img/_4Sx8EftiCaP-9JdcR8yAxzDAww=/2019/10/14/8d45b42c-0e3f-4362-a303-b73c1e19616c/gettyimages-1159407615.jpg,The law also applies to warranty work and will bring the rates closer to parity with retail customer rates.
176,https://fox43.com/2019/10/15/suspect-showed-up-to-police-station-with-body-in-car-told-officers-he-killed-three-more-at-his-apartment-officials-say/,WPMT FOX43,https://fox43.com/2019/10/15/suspect-showed-up-to-police-station-with-body-in-car-told-officers-he-killed-three-more-at-his-apartment-officials-say/,"Suspect showed up to police station with body in car, told officers he killed three more at his apartment, officials say",https://tribwpmt.files.wordpress.com/2019/10/promo395375876.jpg?quality=85&strip=all&w=1200,"ROSEVILLE, Calif. – Police in Northern California launched a homicide investigation Monday after a suspect told officers he had allegedly killed four people.

At a news conference, Roseville Police Capt. Josh Simon said the sole suspect was in custody after showing up at the Mount Shasta police department Monday in a vehicle with a body inside. The suspect also told Mt. Shasta police that he had allegedly killed people at his apartment in Roseville."
177,https://www.detroitnews.com/story/news/local/michigan/2019/10/15/judge-dismisses-case-child-life-support-at-university-of-michigan-hospital/3975313002/,Detroit News,https://www.detroitnews.com/story/news/local/michigan/2019/10/15/judge-dismisses-case-child-life-support-at-university-of-michigan-hospital/3975313002/,Bobby Reyes dies after UM takes him off life support,"https://www.gannett-cdn.com/presto/2019/10/15/PDTN/a2cee18c-7a17-4f73-8e09-bf2335570588-reyes1.jpg?crop=5102,2870,x0,y566&width=3200&height=1680&fit=bounds",Michigan Medicine says a second brain function exam Tuesday showed no brain activity for Bobby Reyes. Life support was halted and Reyes died
178,https://www.fiercebiotech.com/medtech/philips-to-bring-spencer-health-s-digital-pill-hub-to-europe,FierceBiotech,https://www.fiercebiotech.com/medtech/philips-to-bring-spencer-health-s-digital-pill-hub-to-europe,Philips to bring Spencer Health's digital pill hub to Europe,https://qtxasset.com/fiercebiotech/1571162585/Spencer_Philips_1.jpg?fZNu8b4w3zMk9jgAvmL8Shyi_BqTqPPq,Philips is expanding its partnership with medication adherence and telehealth provider Spencer Health with plans to bring its solutions to a selection of countries in Europe.
179,https://www.zanesvilletimesrecorder.com/story/news/local/2019/10/14/john-mcintires-legacy-lives-today-his-260th-birthday/3821720002/,Zanesville Times Recorder,https://www.zanesvilletimesrecorder.com/story/news/local/2019/10/14/john-mcintires-legacy-lives-today-his-260th-birthday/3821720002/,"John McIntire's legacy lives on today, his 260th birthday","https://www.gannett-cdn.com/presto/2019/09/30/PZAN/8d1b206d-9ddf-479a-a9fa-7c0f5108f8b1-john_mcintire.jpg?crop=599,337,x0,y160&width=1600&height=800&fit=bounds",Founding father and philanthropist John McIntire's influence in the community is still felt today as 98 college students began college this fall.
180,https://www.telegraphindia.com/india/economy-home-truth-for-nirmala-sitharaman/cid/1711786,,https://www.telegraphindia.com/india/economy-home-truth-for-nirmala-sitharaman/cid/1711786,Economy home truth for Nirmala Sitharaman,https://static.telegraphindia.com/derivative/THE_TELEGRAPH/1711786/2X1/derivative2X11571104509964.jpg?v=50,Minister’s husband asks Modi government to follow Rao and Manmohan
181,,,,,,
182,https://sluggerotoole.com/2019/10/15/borders-in-the-mind-and-the-enduring-question-of-identity/,Slugger O'Toole,https://sluggerotoole.com/2019/10/15/borders-in-the-mind-and-the-enduring-question-of-identity/,Borders in the mind: And the enduring question of identity…,https://sluggerotoole.com/wp-content/uploads/2019/10/ccimage-1-1.jpg,"Growing up a Catholic in Northern Ireland, I had no doubt that I was Irish. I have an Irish name. An early memory is learning to write my full name as Gaeilge. At my Catholic primary school I learned Irish, céilidh dancing and the Irish national anthem. I recited poems in Irish at ‘Feiseanna’ in predominantly Catholic towns. However, I also recited poems in English and danced ballet at ‘Festivals’ in predominantly Protestant towns. At my convent boarding school, thanks …"
183,https://prospect.org/api/content/e8d9ac10-ef69-11e9-b223-12f1225286c6/,The American Prospect,https://prospect.org/api/content/e8d9ac10-ef69-11e9-b223-12f1225286c6/,The 2020 Foreign-Policy Primary,https://prospect.org/downloads/12879/download/Guyer-FP%20primary%20101519.jpg?cb=b01cb27562bfcab19bc4f7f13ebab4d7&w=1200,"Bernie Sanders, Elizabeth Warren, and Joe Biden are staking out different territory."
184,https://www.wkms.org/post/former-trump-press-secretary-campaigns-kentucky-governor,,https://www.wkms.org/post/former-trump-press-secretary-campaigns-kentucky-governor,Former Trump Press Secretary Campaigns for Kentucky Governor,https://www.wkms.org/sites/wkms/files/styles/medium/public/201910/SarahHuckabeeSanders.jpg,President Donald Trump's former press secretary has made a pitch for Gov. Matt Bevin's reelection campaign during a visit to Kentucky's largest city.
185,https://www.policeone.com/legal/articles/cop-training-firm-claims-netflix-series-defames-interrogation-technique-AdaV5BjJ5U6BjYvv/,PoliceOne,https://www.policeone.com/legal/articles/cop-training-firm-claims-netflix-series-defames-interrogation-technique-AdaV5BjJ5U6BjYvv/,Cop-training firm claims Netflix series defames interrogation technique,https://media.cdn.lexipol.com/article-images/whentheyseeus_101519_news.jpg?w=1600,The lawsuit alleges 'When They See Us' misrepresents the Reid Technique
186,https://www.kmov.com/news/charged-in-robbery-chase-and-crash-that-left-st-louis/article_90bb6b44-ee98-11e9-a73e-fbc7216aa814.html,KMOV.com,https://www.kmov.com/news/charged-in-robbery-chase-and-crash-that-left-st-louis/article_90bb6b44-ee98-11e9-a73e-fbc7216aa814.html,"3 charged in robbery, chase and crash that left St. Louis County woman paralyzed",https://bloximages.newyork1.vip.townnews.com/kmov.com/content/tncms/assets/v3/editorial/c/96/c9695e0c-ef9b-11e9-a3c6-9b643529c955/5da649bdb04cf.image.jpg?resize=1120%2C630,Thee suspects are facing charges in connection with an armed robbery and bi-state police chase that happened Sunday afternoon.
187,https://northernstar.info/from_ap/impeachment-tests-democrats-foothold-in-swing-districts/article_81297f2d-6f09-5d1d-adf9-a56f179008ec.html,Northern Star Online,https://northernstar.info/from_ap/impeachment-tests-democrats-foothold-in-swing-districts/article_81297f2d-6f09-5d1d-adf9-a56f179008ec.html,404 Error,https://bloximages.newyork1.vip.townnews.com/northernstar.info/content/tncms/custom/image/c80a4d18-020e-11e8-8469-3fd238472d7c.jpg?resize=600%2C168,This page no longer exists or has been removed
188,https://www.app.com/story/opinion/columnists/2019/10/15/nj-attorney-general-ice-directive-immigration/3971045002/,Asbury Park Press,https://www.app.com/story/opinion/columnists/2019/10/15/nj-attorney-general-ice-directive-immigration/3971045002/,Attorney General's ICE directive doesn't tie law enforcement's hands,"https://www.gannett-cdn.com/presto/2018/09/19/PAPP/54db0091-dc7d-4c7f-bd34-744a4fad194a-grewaltease.jpg?crop=599,337,x0,y0&width=1600&height=800&fit=bounds","In cases of serious crimes, local law enforcement is not constrained by NJ Attorney General Gurbir Grenwal's immigration directive."
189,,,,,,
190,https://wtop.com/middle-east/2019/10/irans-guard-says-it-detains-paris-based-exiled-journalist/,WTOP,https://wtop.com/middle-east/2019/10/irans-guard-says-it-detains-paris-based-exiled-journalist/,Iran’s Guard says it detains Paris-based exiled journalist | WTOP,https://wtop.com/wp-content/uploads/2017/04/wtop_logo_512x512.png,"TEHRAN, Iran (AP) — Iran’s paramilitary Revolutionary Guard said Monday it arrested an exiled journalist who helped fan the flames of nationwide economic protests that struck the country at the end of…"
191,https://www.kgun9.com/news/local-news/how-to-keep-arizona-wildlife-safe-when-decorating-for-halloween,KGUN,https://www.kgun9.com/news/local-news/how-to-keep-arizona-wildlife-safe-when-decorating-for-halloween,How to keep wildlife safe when decorating for Halloween,https://ewscripps.brightspotcdn.com/dims4/default/5ef331b/2147483647/strip/true/crop/1280x672+0+24/resize/1200x630!/quality/90/?url=https%3A%2F%2Fewscripps.brightspotcdn.com%2Fc8%2Fb1%2Fc76140684323ab34657db1885b0e%2Fjavelinapumpkins.jpg,"When you're decorating for Halloween this month, consider the safety of Arizona wildlife."
192,,,,,,
193,,,,,,
194,https://blogs.timesofisrael.com/the-second-great-betrayal-czechoslovakia-1938-kurdistan-2019/,,https://blogs.timesofisrael.com/the-second-great-betrayal-czechoslovakia-1938-kurdistan-2019/,"The Second Great Betrayal: Czechoslovakia 1938, Kurdistan 2019",https://static.timesofisrael.com/blogs/uploads/users/James-R-Russell-1530953795-400x400.jpg,From the blog of James R. Russell at The Times of Israel
195,https://www.kirkusreviews.com/features/ashley-bryan-revisits-his-world-war-ii-letters-and/,Kirkus Reviews,https://www.kirkusreviews.com/features/ashley-bryan-revisits-his-world-war-ii-letters-and/,Ashley Bryan revisits his World War II letters and sketches to create Infinite Hope | Kirkus Reviews,http://d3eoifnsb8kxf0.cloudfront.net/blog/lead_art/Oct_15_Profile_Bryan_cGabe_Souza-Portland_Portland_Press_Herald_via_Getty_Images.jpg,"Kirkus Reviews talks with Ashley Bryan, author and illustrator of Infinite Hope"
196,https://www.bbc.com/news/technology-50054725,BBC News,https://www.bbc.com/news/technology-50054725,Microsoft seeks to clean up Xbox game chat with AI,https://ichef.bbci.co.uk/news/1024/branded_news/352E/production/_109241631_friendly.jpg,Text messages will be the first to be filtered but the tech will also be applied to voice chat.
197,https://www.sbs.com.au/news/kurdish-refugee-behrouz-boochani-warns-of-genocide-in-northern-syria,SBS News,https://www.sbs.com.au/news/kurdish-refugee-behrouz-boochani-warns-of-genocide-in-northern-syria,Kurdish refugee Behrouz Boochani warns of 'genocide' in northern Syria,https://sl.sbs.com.au/public/image/file/2d6b0bb0-3b6c-41e0-9174-e6a290a0268e/crop/16x9,SBS News spoke to Behrouz Boochani in Papua New Guinea about the fate of Kurds back in the Middle East.
198,https://thehill.com/policy/international/asia-pacific/465801-hong-kong-dismisses-concessions-as-protests-escalate,TheHill,https://thehill.com/policy/international/asia-pacific/465801-hong-kong-dismisses-concessions-as-protests-escalate,Hong Kong dismisses concessions as protests escalate,https://thehill.com/sites/default/files/hongkong_100619getty.jpg,Hong Kong’s beleaguered leader Carrie Lam on Tuesday dismissed the prospect of making concessions to pro-democracy protesters as violence escalates. 
199,https://www.thestar.com/news/world/asia/2019/10/22/taliban-say-new-intra-afghan-peace-talks-to-be-held-in-china.html,thestar.com,https://www.thestar.com/news/world/asia/2019/10/22/taliban-say-new-intra-afghan-peace-talks-to-be-held-in-china.html,Taliban say new intra-Afghan peace talks to be held in China | The Star,https://images.thestar.com/XHNhaWhi5B7FCH-1JaQLMGMVyKU=/1280x1024/smart/filters:cb(1571771390593)/https://www.thestar.com/content/dam/thestar/news/world/asia/2019/10/22/taliban-say-new-intra-afghan-peace-talks-to-be-held-in-china/AFG102-528_2019_101811.jpg,"ISLAMABAD - A fresh round of intra-Afghan peace talks will be held in China next week, Taliban spokesman Suhail Shaheen said Tuesday, raising hopes for renewed negotiations, even as violence surges in Afghanistan's 18-year war."
200,https://www.eonline.com/ca/news/1082661/meet-the-90-day-fiance-season-7-couples-and-all-their-drama,E! News,https://www.eonline.com/ca/news/1082661/meet-the-90-day-fiance-season-7-couples-and-all-their-drama,Meet the 90 Day Fiancé Season 7 Couples and All Their Drama,"https://akns-images.eonline.com/eol_images/Entire_Site/2019914/rs_600x600-191014094823-600-3-90-day-season-7-ch-101419.jpg?fit=around|600:467&crop=600:467;center,top&output-quality=90",Exclusive! The hit TLC series is back with seven new pairs ready to walk down the aisle
201,https://theprint.in/india/mohan-bhagwat-gir-cow-breed-promoted-brazilian-variety-yields-120-more-milk/305917/,ThePrint,https://theprint.in/india/mohan-bhagwat-gir-cow-breed-promoted-brazilian-variety-yields-120-more-milk/305917/,This is why India needs semen of Brazilian cow breed Mohan Bhagwat is opposed to,https://d2c7ipcroan06u.cloudfront.net/wp-content/uploads/2019/10/Gir_Bull_rev.jpg,"In India, the average milk yield of the Gir is 1,590 kg per lactation while the Brazilian breed averages 3,500 kg."
202,https://www.sthelensstar.co.uk/news/national/17969004.ex-thomas-cook-boss-deeply-sorry-firms-failure/,St Helens Star,https://www.sthelensstar.co.uk/news/national/17969004.ex-thomas-cook-boss-deeply-sorry-firms-failure/,Ex-Thomas Cook boss ‘deeply sorry’ over firm’s failure,https://www.sthelensstar.co.uk/resources/images/10545075/,"Peter Fankhauser is one of five senior Thomas Cook figures giving evidence to the Commons’ Business, Energy and Industrial Strategy Committee."
203,,,,Presidential Activity September 2019,,Presidential Activity September 2019
204,https://www.telegraph.co.uk/news/2019/10/15/harry-dunns-parents-visit-white-house/,The Telegraph,https://www.telegraph.co.uk/news/2019/10/15/harry-dunns-parents-visit-white-house/,"Harry Dunn's parents turn down meeting with Anne Sacoolas as Trump intervenes to broker solution

",https://img.youtube.com/vi/_FkkXB5aY8M/mqdefault.jpg,Harry Dunn&rsquo;s parents have turned down a surprise meeting with the American woman who killed their son as Donald Trump personally greeted them at the White House to broker a solution.
205,https://www.wbal.com/article/415353/112/what-you-need-to-know-about-whos-fighting-in-syria-and-what-the-us-withdrawal-means,wbal.com,https://www.wbal.com/article/415353/112/what-you-need-to-know-about-whos-fighting-in-syria-and-what-the-us-withdrawal-means,What you need to know about who's fighting in Syria and what the US withdrawal means,https://cdn.s3-media.wbal.com/Media/2019/10/14/fe9a9bab-4474-4299-98b1-4c636c1ff11c/thumb-400.jpg,"WBAL NewsRadio 1090/FM 101.5 - (WASHINGTON) -- For over four years, the U.S. armed and fought with Syrian Kurdish forces who served as America's foot soldiers against the Islamic State terror group. But with President Donald Trump..."
206,https://hotair.com/archives/ed-morrissey/2019/10/15/brexit-rella-eu-sets-midnight-deadline-resolving-irish-border-issue/,HotAir,https://hotair.com/archives/ed-morrissey/2019/10/15/brexit-rella-eu-sets-midnight-deadline-resolving-irish-border-issue/,Brexit-rella? EU sets midnight deadline for resolving Irish border issue,https://hotair.com/wp/wp-content/uploads/2019/10/barnier-ap.png,"“Northern Ireland would de jure be in the UK’s customs territory but de facto in the European Union’s."""
207,http://www.theguardian.com/australia-news/live/2019/oct/16/economy-coalition-labor-morrison-albanese-politics-live,the Guardian,http://www.theguardian.com/australia-news/live/2019/oct/16/economy-coalition-labor-morrison-albanese-politics-live,Arthur Sinodinos says MPs must act on 'the best science' when it comes to climate – as it happened,https://i.guim.co.uk/img/media/399d0901e3a1716faf36b0bf3f3b615d0e115adc/0_132_3992_2397/master/3992.jpg?width=1200&height=630&quality=85&auto=format&fit=crop&overlay-align=bottom%2Cleft&overlay-width=100p&overlay-base64=L2ltZy9zdGF0aWMvb3ZlcmxheXMvdGctbGl2ZS5wbmc&enable=upscale&s=c614de0a791dee5fd121718928149a5d,"Liberal senator gives final speech. Plus, Scott Morrison tells parliament IMF update ‘reflects the uncertainty of the times in which we live’"
208,https://www.fox13news.com/news/after-serving-his-country-veteran-given-custom-home-to-serve-his-needs,FOX 13 Tampa Bay,https://www.fox13news.com/news/after-serving-his-country-veteran-given-custom-home-to-serve-his-needs,"After serving his country, veteran given custom home to serve his needs",https://images.foxtv.com/static.fox13news.com/www.fox13news.com/content/uploads/2019/10/724/407/Smart_home_gifted_to_quadriplegic_vetera_2_7692621_ver1.0.jpg?ve=1&tl=1,"He served his country for two decades, but during his last combat deployment, Anthony Kenworthy suffered severe injuries that left him a quadriplegic."
209,https://www.arabnews.com/node/1569551/saudi-arabia,Arab News,https://www.arabnews.com/node/1569551/saudi-arabia,Russian culture festival launched in Riyadh,https://www.arabnews.com/sites/default/files/2019/10/16/1800516-788389492.jpg,"RIYADH: The Moscow-based Tchaikovsky Symphony Orchestra inaugurated the “Russian Culture in Riyadh” festival with a concert featuring opera stars and music conducted by Felix Korobov. The event was held at the King Fahd Cultural Center on Monday. The Saudi Ministry of Culture, in collaboration with the Russian Direct Investment Fund (RDIF), organized performances, exhibitions and movie screenings to celebrate Russian culture and ties between the two countries."
210,,,,,,
211,http://www.theguardian.com/media/2019/oct/15/ronan-farrow-catch-and-kill-book-trump-harvey-weinstein,the Guardian,http://www.theguardian.com/media/2019/oct/15/ronan-farrow-catch-and-kill-book-trump-harvey-weinstein,Shredded Trump documents and spy games: Ronan Farrow's biggest scoops,https://i.guim.co.uk/img/media/c41a7cc64ff3477e1e96de8748b2a561f968bfb8/0_51_3000_1801/master/3000.jpg?width=1200&height=630&quality=85&auto=format&fit=crop&overlay-align=bottom%2Cleft&overlay-width=100p&overlay-base64=L2ltZy9zdGF0aWMvb3ZlcmxheXMvdGctZGVmYXVsdC5wbmc&enable=upscale&s=f28cc413a59ecae72294027c0c889d63,Farrow’s new book Catch and Kill draws in many powerful figures in politics and media – and offers shocking revelations
212,,,,,,
213,https://www.irishexaminer.com/breakingnews/ireland/241m-investment-for-n5-westport-to-turlough-road-project-announced-957410.html,,https://www.irishexaminer.com/breakingnews/ireland/241m-investment-for-n5-westport-to-turlough-road-project-announced-957410.html,€241m investment for N5 Westport to Turlough road project announced,https://www.irishexaminer.com/remote/media.central.ie/media/images/m/michaelRingMinisterOfStateforSport_large.jpg?width=648&s=ie-957410,A minister says a new investment in rural Ireland will bring more tourism and stag parties to the west of Ireland.
214,https://www.kmov.com/news/charged-in-robbery-chase-and-crash-that-left-st-louis/article_90bb6b44-ee98-11e9-a73e-fbc7216aa814.html,KMOV.com,https://www.kmov.com/news/charged-in-robbery-chase-and-crash-that-left-st-louis/article_90bb6b44-ee98-11e9-a73e-fbc7216aa814.html,"3 charged in robbery, chase and crash that left St. Louis County woman paralyzed",https://bloximages.newyork1.vip.townnews.com/kmov.com/content/tncms/assets/v3/editorial/c/96/c9695e0c-ef9b-11e9-a3c6-9b643529c955/5da649bdb04cf.image.jpg?resize=1120%2C630,Thee suspects are facing charges in connection with an armed robbery and bi-state police chase that happened Sunday afternoon.
215,https://www.factcheck.org/2019/10/the-democratic-letter-to-ukraine/,FactCheck.org,https://www.factcheck.org/2019/10/the-democratic-letter-to-ukraine/,The Democratic Letter to Ukraine,https://cdn.factcheck.org/UploadedFiles/randpaul.png,"In May 2018, three Democratic senators wrote to the Ukrainian prosecutor general, asking about a report that he had frozen four Ukrainian investigations involving Paul Manafort to avoid angering President Donald Trump. Republicans have called the letter a ""threat"" to withhold support for aid to Ukraine, saying it's similar to what critics have charged Trump did."
216,https://in.reuters.com/article/uk-wework-locations-analysis-idINKBN1WT0F0,IN,https://in.reuters.com/article/uk-wework-locations-analysis-idINKBN1WT0F0,WeWork opens new sites at breakneck speed despite cash-burn concerns,https://s4.reutersmedia.net/resources/r/?m=02&d=20191014&t=2&i=1440862178&w=1200&r=LYNXMPEF9D0BT,WeWork has opened almost as many new locations in the last 3-1/2 months as it di...
217,https://www.zanesvilletimesrecorder.com/story/news/local/2019/10/15/local-news-briefs/3984007002/,Zanesville Times Recorder,https://www.zanesvilletimesrecorder.com/story/news/local/2019/10/15/local-news-briefs/3984007002/,Local News Briefs,https://www.gannett-cdn.com/-mm-/1f5cf201681a65be6127472788853de159a5467f/c=0-729-3333-2604/local/-/media/2018/10/05/Zanesville/B9334189759Z.1_20181005164204_000_G8RN2PERC.1-0.jpg?width=3200&height=1680&fit=crop,"City,Muskingum Valley Parks District working with Putnam area residents for Saturday's cleanup day."
218,https://www.truthdig.com/articles/facebook-ceo-cozies-up-to-conservatives-at-private-dinners/,"Truthdig: Expert Reporting, Current News, Provocative Columnists",https://www.truthdig.com/articles/facebook-ceo-cozies-up-to-conservatives-at-private-dinners/,Facebook CEO Cozies up to Conservatives at Private Dinners,https://www.truthdig.com/wp-content/uploads/2018/09/AP_18143565387631-1-1024x683.jpg,"For a company that’s come under congressional and public scrutiny from all sides of the political spectrum, including for influencing the 2016 presidenti"
219,http://thefacts.com/article_6956faa7-e0fd-5338-994a-df7e82f5a854.html,The Facts,http://thefacts.com/article_6956faa7-e0fd-5338-994a-df7e82f5a854.html,Sullivan releases recording of Bonnen meeting,https://bloximages.chicago2.vip.townnews.com/thefacts.com/content/tncms/custom/image/ec547444-62f8-11e5-829b-7f8741774b92.jpg,Michael Quinn Sullivan released the audio he secretly recorded during a June meeting with House Speaker Dennis Bonnen in which Bonnen implies he’d like Sullivan to target House members in
220,https://www.13newsnow.com/article/news/local/north-carolina/orville-wright-bust-found-on-kill-devil-hills-beach-investigation-continues/291-f794c8ef-ff92-49be-a7ad-4b10574a8e81,13newsnow.com,https://www.13newsnow.com/article/news/local/north-carolina/orville-wright-bust-found-on-kill-devil-hills-beach-investigation-continues/291-f794c8ef-ff92-49be-a7ad-4b10574a8e81,Orville Wright bust found on Kill Devil Hills beach; investigation continues,https://media.13newsnow.com/assets/WVEC/images/dae36c15-aeee-4030-8a79-86942bb9a077/dae36c15-aeee-4030-8a79-86942bb9a077_1140x641.jpg,The bust was about a mile from the Wright Brothers National Memorial tucked away in some dunes.
221,https://www.irishtimes.com/news/politics/e-scooter-users-may-be-fined-for-speeding-under-bill-tabled-by-fianna-f%C3%A1il-1.4051372,The Irish Times,https://www.irishtimes.com/news/politics/e-scooter-users-may-be-fined-for-speeding-under-bill-tabled-by-fianna-f%C3%A1il-1.4051372,E-scooter users may be fined for speeding under Bill tabled by Fianna Fáil,https://www.irishtimes.com/image-creator/?id=1.4051371&origw=1440,Opposition proposes reclassifying e-scooters to remove need for licence and insurance
222,https://theprint.in/india/high-interest-easy-loans-commissions-how-1-5-lakh-rajasthanis-were-duped-of-rs-953-cr/305601/,ThePrint,https://theprint.in/india/high-interest-easy-loans-commissions-how-1-5-lakh-rajasthanis-were-duped-of-rs-953-cr/305601/,A Saradha-like 'scam' unfolds in Rajasthan – 1.5 lakh investors ‘duped’ of Rs 953 cr,https://d2c7ipcroan06u.cloudfront.net/wp-content/uploads/2019/10/Sanjivani-Nahargarh.jpg,Sanjivani Credit Cooperative Society was booked last month for alleged fraud and its premises in Rajasthan are now sealed.
223,,,,,,
224,http://www.dailynebraskan.com/news/unl-professor-s-lecture-at-georgia-southern-ends-with-protest/article_d1c37756-eeef-11e9-b91d-9720963cd250.html,The Daily Nebraskan,http://www.dailynebraskan.com/news/unl-professor-s-lecture-at-georgia-southern-ends-with-protest/article_d1c37756-eeef-11e9-b91d-9720963cd250.html,"UNL professor’s lecture at Georgia Southern ends with protest, burning of book",https://bloximages.newyork1.vip.townnews.com/dailynebraskan.com/content/tncms/assets/v3/editorial/b/0a/b0a152f4-eef0-11e9-a5f4-3f8609630d61/5da5446334723.image.jpg?resize=944%2C630,A lecture led by a University of Nebraska-Lincoln professor ended in protest and the burning of her book after discussions of white privilege enraged attendees.
