,source_url,site_name,site_url,title,img_url,description
167,https://keyj.com/back-the-badge-abilene/,Rock 108,https://keyj.com/back-the-badge-abilene/,Show Your Support for Local Officers at 'Back the Badge' Breakfast,https://townsquare.media/site/114/files/2015/09/backbadge.jpg?w=1200&h=0&zc=1&s=0&a=t&q=89,Show your support for our local law enforcement during the Back the Badge breakfast. Join us October 26th from 8am - 10am at TaMolly's 4400 Ridgemont Dr.
168,https://www.deseret.com/opinion/2019/10/21/20923555/in-our-opinion-2020-presidential-plans-should-rely-first-on-the-people-not-the-government,Deseret News,https://www.deseret.com/opinion/2019/10/21/20923555/in-our-opinion-2020-presidential-plans-should-rely-first-on-the-people-not-the-government,"In our opinion: 2020 presidential ‘plans’ should rely first on the people, not the government",https://cdn.vox-cdn.com/thumbor/_JCx0eBaE2wQlTHd7bDrWRY5HcI=/0x172:1200x800/fit-in/1200x630/cdn.vox-cdn.com/uploads/chorus_asset/file/17629492/1138792.jpg,"The 2020 election cycle looms large on the horizon. Politicians national and local have begun the drumbeat of ""solutions"" and ""I have a plan for that"" slogans common to such campaigns. Government..."
169,https://www.montgomeryadvertiser.com/story/news/2019/10/21/jessica-taylor-6th-republican-enter-race-2nd-congressional-district/4051454002/,The Montgomery Advertiser,https://www.montgomeryadvertiser.com/story/news/2019/10/21/jessica-taylor-6th-republican-enter-race-2nd-congressional-district/4051454002/,Jessica Taylor 6th Republican to enter race for 2nd congressional district,"https://www.gannett-cdn.com/presto/2019/10/21/PMOY/6ea04277-0337-4bd5-a6d2-aa0bde97127f-Jessica_Taylor.jpg?crop=1444,813,x0,y0&width=1600&height=800&fit=bounds","The owner of a grant consulting firm attacked ""radical socialists and liberal loudmouths"" in her announcement."
170,https://hungarytoday.hu/orban-government-ready-work-cooperative-local-councils/,Hungary Today,https://hungarytoday.hu/orban-government-ready-work-cooperative-local-councils/,Orbán: Govt Ready to Work with Cooperative Local Councils,https://hungarytoday.hu/wp-content/uploads/2019/10/D__AS20191021001.jpg,"The government is ready to “cooperate with all mayors and local councils that are themselves ready to cooperate,” Prime Minister Viktor Orbán said in parliament’s opening autumn session on Monday. Referring to the recent local elections, Orbán said that “everybody, regardless of party affiliation, must work for Hungary and the Hungarian people.” “The nation cannot […]"
171,https://thekashmirwalla.com/2019/10/bar-association-on-strike-petitioners-wear-black-gown-to-secure-justice/,The Kashmir Walla,https://thekashmirwalla.com/2019/10/bar-association-on-strike-petitioners-wear-black-gown-to-secure-justice/,"Bar Association on strike, petitioners wear black gown to secure justice",https://i0.wp.com/thekashmirwalla.com/wp-content/uploads/2019/10/Screenshot-2019-10-21-at-23.12.15.png?fit=836%2C510&ssl=1,"Astonished association moved against the order, not only in court, but also – in the backdrop of an executive-members meeting – announced a “non-official” strike “against the abrogation of the article 370, arrests of Bar members, and on-going human rights violation in Kashmir.”"
172,http://www.theguardian.com/australia-news/2019/oct/22/taxpayers-funded-174m-in-government-advertising-last-financial-year,the Guardian,http://www.theguardian.com/australia-news/2019/oct/22/taxpayers-funded-174m-in-government-advertising-last-financial-year,Taxpayers funded $174m in government advertising last financial year,https://i.guim.co.uk/img/media/e88a1b686387c0ea6815a242219c67323e2c4704/0_77_4385_2632/master/4385.jpg?width=1200&height=630&quality=85&auto=format&fit=crop&overlay-align=bottom%2Cleft&overlay-width=100p&overlay-base64=L2ltZy9zdGF0aWMvb3ZlcmxheXMvdGctZGVmYXVsdC5wbmc&enable=upscale&s=e0c24576a1c24ad2233486fb2ffa8e53,"Spending included $156m on major campaigns, many of which promoted key policies in the Coalition’s re-election pitch"
173,https://www.afr.com/politics/federal/labor-waves-through-ftas-but-issues-new-big-stick-demand-20191021-p532kp,Australian Financial Review,https://www.afr.com/politics/federal/labor-waves-through-ftas-but-issues-new-big-stick-demand-20191021-p532kp,Labor waves through FTAs but issues new big stick demand,https://static.ffx.io/images/$zoom_0.1995%2C$multiply_0.7554%2C$ratio_1.777778%2C$width_1059%2C$x_0%2C$y_26/t_crop_custom/e_sharpen:25%2Cq_85%2Cf_auto/743769dd62b14d52b31c23bb0fe491a7ebb70909,Labor has waved through legislation to enable three free trade agreements after the government agreed to a handful of concessions.
174,https://thefrontierpost.com/hamas-decries-israels-participation-in-bahrain-meet/,The Frontier Post,https://thefrontierpost.com/hamas-decries-israels-participation-in-bahrain-meet/,Hamas decries Israel’s participation in Bahrain meet - The Frontier Post,,"Monitoring Desk GAZA CITY: Palestinian resistance group Hamas has decried Israel’s participation in a U.S.-led maritime security meeting in Bahrain. Israel’s Channel 13 reported that an Israeli delegation would attend the event, due to open in Manama on Sunday. Israel and Bahrain do not have diplomatic relations. In a statement, Hamas spokesman Hazem Qasim said…"
175,https://www.thehindu.com/news/states/tn-tops-in-reporting-grave-crimes-against-senior-citizens/article29762784.ece,The Hindu,https://www.thehindu.com/news/states/tn-tops-in-reporting-grave-crimes-against-senior-citizens/article29762784.ece,T.N. tops in reporting grave crimes against senior citizens,https://www.thehindu.com/news/states/xhee2m/article29762783.ece/ALTERNATES/LANDSCAPE_615/22OCTTHELDERLYPEOPLE,NCRB data reveals that 188 elders were murdered in the State in 2017
176,https://www.urdupoint.com/en/world/syrian-kurds-agree-to-damascus-military-pres-736764.html,UrduPoint,https://www.urdupoint.com/en/world/syrian-kurds-agree-to-damascus-military-pres-736764.html,Syrian Kurds Agree To Damascus Military Presence Near Turkish Border - Official - UrduPoint,https://photo-cdn.urdupoint.com/media/2019/10/_3/730x425/pic_1571073007.jpg,"The Syrian military will place its soldiers near the border with Turkey without entering cities, Abed Hamad Mehbash, the co-chair of the Autonomous Administration of North and East Syrias Executive Council, said on Monday"
177,https://www.express.co.uk/news/uk/1193634/Brexit-news-UK-EU-Parliament-Brexit-deal-Boris-Johnson-latest-update,Express.co.uk,https://www.express.co.uk/news/uk/1193634/Brexit-news-UK-EU-Parliament-Brexit-deal-Boris-Johnson-latest-update,Brexit blockers: EU Parliament refuses to sign off Boris Johnson's deal until after MPs,https://cdn.images.express.co.uk/img/dynamic/1/750x445/1193634.jpg,"MEMBERS of the European Parliament will not sign off on Boris Johnson’s Brexit deal until the Prime Minister officially secures support in the House of Commons.
"
178,https://www.kktv.com/content/news/MONDAYS-MOST-WANTED-October-21-563544191.html ,,https://www.kktv.com/content/news/MONDAYS-MOST-WANTED-October-21-563544191.html ,MONDAY'S MOST WANTED: October 21,https://media.graytvinc.com/images/MGN_1280x720_50225B00-LNUKL.jpg,A sex offender who has failed to register and a man accused of assaulting a law enforcement officer are among this week's 'Most Wanted.'
179,,,,,,
180,https://www.masslive.com/police-fire/2019/10/suspended-troopers-investigated-in-overtime-abuse-scandal-cannot-be-reinstated-mass-superior-court-judge-rules.html,masslive,https://www.masslive.com/police-fire/2019/10/suspended-troopers-investigated-in-overtime-abuse-scandal-cannot-be-reinstated-mass-superior-court-judge-rules.html,"Suspended troopers investigated in OT scandal cannot be reinstated, judge rules",https://www.masslive.com/resizer/6Dn5-9ZnETTolUqYXUdzBx7gGz0=/1280x0/smart/arc-anglerfish-arc2-prod-advancelocal.s3.amazonaws.com/public/PIF7MBKM6ZDSFG6SFYGIWZNEHE.jpeg,Judge Paul D. Wilson overturned the Civil Service Commission's decision ordering the Massachusetts State Police to reinstate the troopers.
181,https://kpel965.com/costco-employees-say-they-wont-buy-these-items-at-the-store/,KPEL 96.5,https://kpel965.com/costco-employees-say-they-wont-buy-these-items-at-the-store/,Costco Employees Say They Won't Buy These Items at the Store,https://townsquare.media/site/33/files/2019/10/GettyImages-93037611.jpg?w=1200&h=0&zc=1&s=0&a=t&q=89,"Business Insider asked Costco workers what items they would be reluctant to purchase in their store, and you might be surprised at their answers, and the reasons why"
182,https://www.mlive.com/news/2019/10/this-michigan-dnr-officer-has-saved-five-lives-since-2012.html,mlive,https://www.mlive.com/news/2019/10/this-michigan-dnr-officer-has-saved-five-lives-since-2012.html,This Michigan DNR officer has saved five lives since 2012,https://www.mlive.com/resizer/1G0Pv3QYe8cDDKPPS47wPofRwx0=/1280x0/smart/arc-anglerfish-arc2-prod-advancelocal.s3.amazonaws.com/public/A5KKQAF2RVB2REOEZLRO5OIKVM.jpg,"His on-the-job heroics include resuscitation, first aid, and search and rescue."
183,http://www.netnewsledger.com/2019/10/20/our-national-security-is-at-stake-canadas-national-shipbuilding-strategy/,NetNewsLedger,http://www.netnewsledger.com/2019/10/20/our-national-security-is-at-stake-canadas-national-shipbuilding-strategy/,NetNewsLedger - Our national security is at stake: Canada's national shipbuilding strategy,http://www.netnewsledger.com/wp-content/uploads/2019/10/Heddle-Shipyards-Thunder-Bay-Drydock.jpg,THUNDER BAY – The Government of Canada is in the process of seeking a qualifying shipyard to become the third shipyard in the National Shipbuilding Strategy (NSS). The NSS is a massive procurement program designed to rebuild the fleets of the Royal Canadian Navy and CanadianCoast Guard. The NSS is projected to be over $100-billion …
184,https://www.nationalobserver.com/2019/10/21/news/exclusive-liberal-government-let-reddit-hook-disinformation,National Observer,https://www.nationalobserver.com/2019/10/21/news/exclusive-liberal-government-let-reddit-hook-disinformation,EXCLUSIVE: The Liberal government let Reddit off the hook on disinformation,https://www.nationalobserver.com/sites/nationalobserver.com/files/img/2019/10/18/181030_-_ate_-_karina_gould-1_0.jpg,An internal memo obtained by National Observer shows government officials incorrectly thought Reddit doesn’t struggle with fake news and disinformation.
185,https://www.premiumtimesng.com/health/health-features/358727-10-takeaways-from-national-health-dialogue-2019.html,Premium Times Nigeria,https://www.premiumtimesng.com/health/health-features/358727-10-takeaways-from-national-health-dialogue-2019.html,10 takeaways from National Health Dialogue 2019 -,https://i2.wp.com/media.premiumtimesng.com/wp-content/files/2019/10/033A7515.jpg?fit=800%2C480&ssl=1,The 2019 National Health Dialogue called on Nigeria to reinvigorate its pursuit of universal health coverage by 2030.............
186,https://allafrica.com/stories/201910210244.html,allAfrica.com,https://allafrica.com/stories/201910210244.html,Libya: Deadly Airstrike Apparently Unlawful,https://allafrica.com/download/pic/main/main/csiid/00501910:608b0f7123f12df453ab609325adc8ab:arc614x376:w1200.jpg,"Press Release - An airstrike by the Libyan National Army (LNA), on a home in a residential area of Tripoli on October 14, 2019 that killed three girls and wounded their mother and another sister, is an apparent violation of the laws of war, Human Rights Watch said today. This attack on civilians is one of many that require an impartial and independent investigation to attribute responsibility and hold those responsible to account."
187,,"Oakridger - Oak Ridge, TN",,"Roane State building renamed for Ken Yager, lifelong public servant",https://www.oakridger.com/storyimage/TN/20191021/NEWS/191029993/AR/0/AR-191029993.jpg,"From members of his Sunday School class to lieutenant governors, from fellow Rockwood Civitan Club members to the chancellor of the Tennessee Board of"
188,,,,,,
189,https://www.yorkshirepost.co.uk/news/crime/yorkshire-police-force-allowing-convicted-rapists-to-be-recorded-as-females-if-they-no-longer-identify-with-their-male-birth-sex-1-10059493,,https://www.yorkshirepost.co.uk/news/crime/yorkshire-police-force-allowing-convicted-rapists-to-be-recorded-as-females-if-they-no-longer-identify-with-their-male-birth-sex-1-10059493,Yorkshire police force allowing convicted rapists to be recorded as females if they no longer identify with their male birth sex,"https://images-a.jpimedia.uk/imagefetch/f_auto,ar_3:2,q_auto:low,c_fill/if_h_lte_200,c_mfit,h_201/https://www.yorkshirepost.co.uk/webimage/1.10059492.1571587080!/image/image.jpg",A Yorkshire Police force is one of six in the country which is allowing convicted male rapists to be recorded as female if they no longer want to identify with their sex at birth.
190,https://www.yahoo.com/lifestyle/trump-changes-mind-doing-least-144836987.html,,https://www.yahoo.com/lifestyle/trump-changes-mind-doing-least-144836987.html,Trump Changes His Mind About Doing at Least One Impeachable Offense,https://s.yimg.com/uu/api/res/1.2/ECYjms2BZho2a4lRjgCD_w--~B/aD0yOTk5O3c9NDI2NjtzbT0xO2FwcGlkPXl0YWNoeW9u/https://media.zenfs.com/en/gq_402/c8631e86f85066aa95459b45f31b1e42,"“I thought I was doing something very good for our Country by using Trump National Doral, in Miami, for hosting the G-7 Leaders.”"
191,,,,,,
192,https://patch.com/massachusetts/braintree/where-braintree-mayoral-candidates-stand-traffic-issues,"Braintree, MA Patch",https://patch.com/massachusetts/braintree/where-braintree-mayoral-candidates-stand-traffic-issues,Where The Braintree Mayoral Candidates Stand On Traffic Issues,https://patch.com/img/cdn20/shutterstock/23017426/20191021/041212/styles/patch_image/public/shutterstock-573830026___21161112377.jpg,The Braintree's mayoral candidates announced how they plan to address traffic issues in town.
193,https://www.business-standard.com/article/pti-stories/12-sentenced-to-death-for-killing-law-chamber-clerk-in-bangladesh-over-land-dispute-119102100821_1.html,,https://www.business-standard.com/article/pti-stories/12-sentenced-to-death-for-killing-law-chamber-clerk-in-bangladesh-over-land-dispute-119102100821_1.html,12 sentenced to death for killing law chamber clerk in Bangladesh over land dispute,https://bsmedia.business-standard.com/_media/bs/img/article/default/1191021/full-119102100821.jpg,"Twelve people were sentenced to death by a fast track court in Bangladesh on Monday for killing a law chamber clerk with a spear over a land dispute in 2015, according to media reports.
Mubarak Hossain Bhuiyan was killed on October 22, 2015 in"
194,https://www.standardmedia.co.ke/article/2001346311/criminals-now-turn-to-security-guards-to-withdraw-stolen-cash,The Standard,https://www.standardmedia.co.ke/article/2001346311/criminals-now-turn-to-security-guards-to-withdraw-stolen-cash,Criminals now turn to security guards to withdraw stolen cash : The Standard,http://www.standardmedia.co.ke/images/monday/thumb_criminals_now_turn_t5daddd93d04a9.png,Criminals have resorted to using security guards to withdraw cash from Automated Teller Machines (ATMs) to avoid being captured by CCTV cameras.
195,https://www.standard.co.uk/news/londoners-diary/the-londoner-media-needs-to-warm-to-xr-a4266696.html,Evening Standard,https://www.standard.co.uk/news/londoners-diary/the-londoner-media-needs-to-warm-to-xr-a4266696.html,The Londoner: 'Media needs to warm to XR',https://static.standard.co.uk/s3fs-public/thumbnails/image/2019/10/21/11/gettyimages-1176382766.jpg,Extinction Rebellion’s protests may have drawn criticism last week but Channel 4 News presenter Krishnan Guru-Murthy told The Londoner the protest group is challenging the media — owing to its leaderless structure.
196,https://www.newson6.com/story/41208391/texas-man-pleas-guilty-in-scheme-involving-a-former-muscogee-creek-nation-leader,,https://www.newson6.com/story/41208391/texas-man-pleas-guilty-in-scheme-involving-a-former-muscogee-creek-nation-leader,Texas Man Pleas Guilty In Scheme Involving A Former Muscogee Creek Nation Leader,https://KOTV.images.worldnow.com/images/18871618_G.jpeg?lastEditedDate=1571648743000,A Texas man has pleaded guilty to multiple charges in a scheme involving a former Muscogee Creek Nation leader. This relates to work for the Wetumka-based Alabama-Quassarte Tribal Town.
197,https://www.businessghana.com/,BusinessGhana,https://www.businessghana.com/,MainOne expands Data Center Footprint in Ghana,https://businessghana.com/site/img/logo.png,"The Tier III facility will be constructed on 4,047 sqm land area in Appolonia City

MainOne (www.MainOne.net) has announced the expansion of its..."
198,,,,,,
199,https://www.clickorlando.com/error/404,WKMG,https://www.clickorlando.com/error/404,404 Error,https://arc-anglerfish-arc2-prod-gmg.s3.amazonaws.com/public/OTK2AZWOFRGLRNRBPD4GVF7MKE.png,The page you're trying to access could not be found or is no longer available.
200,,,,,,
201,,,,,,
202,https://www.theverge.com/2019/10/21/20923660/google-pixel-4-xl-review-camera-radar-face-unlock-90hz-display-telephoto,The Verge,https://www.theverge.com/2019/10/21/20923660/google-pixel-4-xl-review-camera-radar-face-unlock-90hz-display-telephoto,Google Pixel 4 and 4 XL review: more than the sum of its sensors,https://cdn.vox-cdn.com/thumbor/Zfxzc3sbSZ7Pc3b6liRGliIM3VQ=/0x146:2040x1214/fit-in/1200x630/cdn.vox-cdn.com/uploads/chorus_asset/file/19303843/vpavic_191019_3725_0300.jpg,The fourth-gen phone has five big new features
203,http://www.connectionnewspapers.com/news/2019/oct/21/order-court-alexandria/,,http://www.connectionnewspapers.com/news/2019/oct/21/order-court-alexandria/,Order in the Court in Alexandria,,
204,https://www.banburycake.co.uk/news/17982373.woman-fined-thousands-subletting-oxford-council-flat/,Banbury Cake,https://www.banburycake.co.uk/news/17982373.woman-fined-thousands-subletting-oxford-council-flat/,57-year-old fined thousands after subletting council flat,https://www.banburycake.co.uk/resources/images/10569697/,A WOMAN was fined thousands of pounds after subletting her council flat.
205,https://asia.nikkei.com/Business/Business-trends/Shariah-banking-Indonesia-s-bold-plans-for-a-troubled-industry,Nikkei Asian Review,https://asia.nikkei.com/Business/Business-trends/Shariah-banking-Indonesia-s-bold-plans-for-a-troubled-industry,Shariah banking: Indonesia's 'bold plans' for a troubled industry,https://www.ft.com/__origami/service/image/v2/images/raw/https%3A%2F%2Fs3-ap-northeast-1.amazonaws.com%2Fpsh-ex-ftnikkei-3937bb4%2Fimages%2F3%2F9%2F4%2F6%2F23026493-1-eng-GB%2F1309718.jpg?source=nar-cms&width=1024&height=512&fit=cover&gravity=faces,Mixed prospects for Islamic-friendly finance in world's most populous Muslim country
206,https://colombiareports.com/us-refusing-to-cooperate-with-colombia-in-uribe-investigation-report/,Colombia News | Colombia Reports,https://colombiareports.com/us-refusing-to-cooperate-with-colombia-in-uribe-investigation-report/,US refusing to cooperate with Colombia in Uribe investigation: report,https://colombiareports.com/wp-content/uploads/2019/07/noturibe.jpg,"The US government is refusing to cooperate with Colombia’s Supreme Court that is investigating former President Alvaro Uribe on fraud and bribery charges, according to weekly Semana. Supreme Court magistrate…"
207,,,,,,
208,"http://www.angop.ao/angola/en_us/noticias/africa/2019/9/43/Egypt-press-for-outside-mediator-Ethiopia-dam-dispute,07ec4771-6260-4e6e-b9be-c3b459cf59fa.html",ANGOP,"http://www.angop.ao/angola/en_us/noticias/africa/2019/9/43/Egypt-press-for-outside-mediator-Ethiopia-dam-dispute,07ec4771-6260-4e6e-b9be-c3b459cf59fa.html",Egypt to press for outside mediator in Ethiopia dam dispute,http://www.angop.ao/static/images/og-angop.jpg,"CAIRO - Egypt will push Ethiopia this week to agree to an external mediator to help resolve a deepening dispute over a giant hydropower dam being built on Ethiopia’s Blue Nile, officials said on Sunday."
209,https://dailycaller.com/2019/10/21/ukraine-business-oleksandr-onyshchenko-burisma-natural-gas-hunter-biden/,,https://dailycaller.com/2019/10/21/ukraine-business-oleksandr-onyshchenko-burisma-natural-gas-hunter-biden/,Ukrainian Businessman Says Gas Company Hired Hunter Biden For Protection,https://cdn01.dailycaller.com/wp-content/uploads/2019/09/joe-biden-hunter-biden-e1569255442164.jpg,"A former member of the Ukrainian parliament says Burisma Holdings hired Hunter Biden for protection, according to a Reuters report."
210,,,,,,
211,,,,,,
212,https://graphicartsmag.com/news/2019/10/please-support-the-canadian-companies-at-printing-united/,Graphic Arts Magazine,https://graphicartsmag.com/news/2019/10/please-support-the-canadian-companies-at-printing-united/,Please support the Canadian companies at Printing United,https://s0.wp.com/i/blank.jpg,"The Kay Bailey Hutchison Convention Center in Dallas, Texas will host what’s anticipated to be an entirely new tradeshow experience from Oct. 23 to 25, 2019. Built on the successful foundation of t…"
213,https://www.bbc.com/news/uk-scotland-scotland-politics-50117164,BBC News,https://www.bbc.com/news/uk-scotland-scotland-politics-50117164,Court delays decision on PM's Brexit tactics,https://ichef.bbci.co.uk/news/1024/branded_news/16077/production/_109313209_johnson_getty.jpg,Campaigners said the move would ensure that Boris Johnson fully complied with the Benn Act.
214,https://www.japantimes.co.jp/article-expired/,The Japan Times,https://www.japantimes.co.jp/article-expired/,Article expired | The Japan Times,https://cdn.japantimes.2xx.jp/wp-content/uploads/2017/04/jt-sns.png,"News on Japan, Business News, Opinion, Sports, Entertainment and More"
215,http://www.thetidenewsonline.com/2019/10/21/wike-begins-construction-of-three-flyover-bridges/,,http://www.thetidenewsonline.com/2019/10/21/wike-begins-construction-of-three-flyover-bridges/,Wike Begins Construction Of Three Flyover Bridges,http://www.thetidenewsonline.com/wp-content/uploads/2019/08/FRED-30082019-NEWS-3W.jpg,"The Rivers State Governor, Chief Nyesom Wike, last week commenced the construction of the three flyover bridges he promised the people of the state in his second term inauguration speech on May 29th 2019. Agreement for the three flyover bridges contract valued at N21billion was signed in Government House, Port Harcourt last Friday between Rivers […]"
216,,,,,https://www.rdrnews.com/wp-content/uploads/2019/10/Wagoner-blackdom.jpg,
217,https://www.nzherald.co.nz/nz/news/article.cfm?c_id=1&objectid=12278463,NZ Herald,https://www.nzherald.co.nz/nz/news/article.cfm?c_id=1&objectid=12278463,Jared Savage: Why the landmark Court of Appeal decision is not 'soft on crime',https://www.nzherald.co.nz/resizer/NBFCVNEqBPO6IA4KP1TO4TwgH3k=/1200x0/smart/filters:quality(70)/arc-anglerfish-syd-prod-nzme.s3.amazonaws.com/public/KCPWM63EYREE7CKGOGNVK52UQM.jpg,ANALYSIS: Why the Court of Appeal judgment sheds new light on NZ's meth crisis.
218,https://www.thegazette.com/subject/news/government/michael-bennet-pitches-health-care-plan-cheaper-than-medicare-for-all-sanders-warren-20191021,The Gazette,https://www.thegazette.com/subject/news/government/michael-bennet-pitches-health-care-plan-cheaper-than-medicare-for-all-sanders-warren-20191021,Michael Bennet pitches health care plan that's cheaper than Medicare for all,https://www.thegazette.com/storyimage/GA/20191021/ARTICLE/191029947/AR/0/AR-191029947.jpg?cb=167,"CEDAR RAPIDS - It's not just the $31 trillion price tag, but also the lack of cost-savings that cause Michael Bennet to reject the Medicare for all plans some of his rivals for the 2020 Democratic presidential nomination are proposing on the campaign trail."
219,https://www.nyoooz.com/news/delhi/1410777/2-murdered-over-suspected-monetary-dispute-1-held/,NYOOOZ,https://www.nyoooz.com/news/delhi/1410777/2-murdered-over-suspected-monetary-dispute-1-held/,2 murdered over suspected monetary dispute 1 held | Delhi NYOOOZ,https://www.nyoooz.com/df-images/delhi/df-delhi-5.jpg,"New Delhi: Two persons were shot dead in a suspected monetary dispute case in Shahbad Dairy area on Monday.
Police identified the deceased as Amit (30)and his servant Nikhil Gulati (40).
The report was lodged by Amit's brother Jaideep the next day at police station Shahbad Dairy.
"
220,https://www.poz.com/article/25-years-contributors,POZ,https://www.poz.com/article/25-years-contributors,25 Years of Contributors,https://cdn2.poz.com/78765_POZContributors-.jpg_554729ac-baa2-4a0d-b24e-f78a903894fc_x2.jpeg,POZ writers and artists have thrived at the magical intersection of lived experience and boundless talent.
221,https://www.rnz.co.nz/news/political/401510/new-terrorism-legislation-faces-first-reading-in-parliament,RNZ,https://www.rnz.co.nz/news/political/401510/new-terrorism-legislation-faces-first-reading-in-parliament,New terrorism legislation faces first reading in Parliament,https://www.rnz.co.nz/assets/news_crops/79477/eight_col_190430-labour-caucus_15.jpg?1557172749,"New terrorism legislation is up for its first reading in Parliament this evening, but it's unclear whether it will have the numbers to pass."
222,https://www.cnbc.com/2019/10/21/ralph-nader-calls-for-removal-boeing-ceo-muilenburg-entire-board.html,CNBC,https://www.cnbc.com/2019/10/21/ralph-nader-calls-for-removal-boeing-ceo-muilenburg-entire-board.html,"Ralph Nader, whose grandniece died in a 737 Max crash, says Boeing CEO Muilenburg and entire board need to go",https://image.cnbcfm.com/api/v1/image/101810974-171750872.jpg?v=1404394172,Consumer advocate Ralph Nader calls for the removal of Boeing's CEO and the company's board as the fallout intensifies over the grounded 737 Max.
