,source_url,site_name,site_url,title,img_url,description
149,https://www.pulse.com.gh/news/world/turkey-keeps-up-assault-on-kurd-held-syria-border-towns/ptpcck6,,https://www.pulse.com.gh/news/world/turkey-keeps-up-assault-on-kurd-held-syria-border-towns/ptpcck6,Turkey keeps up assault on Kurd-held Syria border towns,https://ocdn.eu/pulscms-transforms/1/rv-ktkuTURBXy9kNDg4YmFiNi0wZjRhLTRhYzMtODg3ZS0yMjIwYmNjODMzZGEuanBlZ5GTBc0EsM0Cdg,"Turkey kept up its assault on Kurdish-held border towns in northeastern Syria on Saturday on the fourth day of an offensive that is drawing growing international condemnation, even from Washington."
150,https://wnmtradio.com/news/articles/2019/oct/11/us-company-supplying-tear-gas-to-hong-kong-police-faces-mounting-criticism/946453/,AM 650 WNMT,https://wnmtradio.com/news/articles/2019/oct/11/us-company-supplying-tear-gas-to-hong-kong-police-faces-mounting-criticism/946453/,U.S. company supplying tear gas to Hong Kong police faces mounting criticism,https://radiocms-images.us1.eldarioncloud.com/resize/1200/https://storage.googleapis.com/media.mwcradio.com/mimesis/2019-10/11/2019-10-11T201415Z_1_LYNXMPEF9A214_RTROPTP_3_HONGKONG-PROTESTS-USA-TEARGAS.JPG?upscale=False,"By Rajesh Kumar Singh
CHICAGO (Reuters) - Another U.S. senator has joined a chorus against Pennsylvania-based NonLethal Technologies Inc for selling riot gear to Hong Kong that is being used against pro-democracy protesters.
The privately held company, which makes and exports a wide range of riot and crowd control equipment for military and law ..."
151,https://www.trussvilletribune.com/2019/10/12/center-point-high-school-students-have-opportunities-in-career-tech/,The Trussville Tribune,https://www.trussvilletribune.com/2019/10/12/center-point-high-school-students-have-opportunities-in-career-tech/,Center Point High School students have opportunities in career-tech,https://www.trussvilletribune.com/wp-content/uploads/2019/10/center-point-career-tech.png,"By Erica Thomas, managing editor CENTER POINT — It’s not all about making the grade at Center Point High School. Principal Van Phillips is focusing on grades, but he also wants students to get r"
152,https://www.theage.com.au/politics/federal/experts-urge-senate-to-hold-the-line-on-refugee-medical-help-20191012-p5302g.html,The Age,https://www.theage.com.au/politics/federal/experts-urge-senate-to-hold-the-line-on-refugee-medical-help-20191012-p5302g.html,Experts urge Senate to hold the line on refugee medical help,https://static.ffx.io/images/$zoom_0.2124%2C$multiply_0.7554%2C$ratio_1.777778%2C$width_1059%2C$x_0%2C$y_58/t_crop_custom/q_86%2Cf_auto/d654699a314b9c3c5c538f3d8b98d8892f259dce,The 11 groups will move on Sunday to convince key Senate crossbenchers to protect the existing laws amid rumours of backroom deals.
153,https://bangaloremirror.indiatimes.com/news/india/at-modi-xi-meet-glocal-diplomacy-on-display/articleshow/71547184.cms,Bangalore Mirror,https://bangaloremirror.indiatimes.com/news/india/at-modi-xi-meet-glocal-diplomacy-on-display/articleshow/71547184.cms,"At Modi-Xi meet, glocal diplomacy on display","https://static.toiimg.com/photo/imgsize-162738,msid-71546636/71546636.jpg",Chinese Prez reaches Chennai for 2-day India tour; PM Modi’s traditional attire while welcoming him is seen as his reply to detractors who had called him anti-TamilCHENNAI The arrival of Chinese Presi.
154,https://www.arabnews.com/node/1567971,Arab News,https://www.arabnews.com/node/1567971,"We should extinguish fires, not light more in Syria",https://www.arabnews.com/sites/default/files/authors/1527691-cm.png,"When Donald Trump withdrew US troops from the Syrian-Turkish border, he was making good on a promise, but the consequences are reverberating well beyond Syria. In the past week more than 100,000 Kurdish civilians, having already endured civil war and the atrocities of Daesh, have fled Turkish military action in northeast Syria."
155,https://www.aljazeera.com/indepth/features/oligarch-friend-trump-pavel-fuchs-171217151538382.html,,https://www.aljazeera.com/indepth/features/oligarch-friend-trump-pavel-fuchs-171217151538382.html,"Oligarch, friend of Trump: Who is Pavel Fuchs?",https://www.aljazeera.com/mritems/Images/2017/12/18/c36f5446648d45389e0459a1a64602d8_18.jpg,Al Jazeera probes a businessman who conspired to buy frozen assets linked to former Ukrainian President Yanukovich.
156,https://unwatch.org/mauritania-set-to-win-seat-on-uns-top-human-rights-body-despite-500000-slaves/,UN Watch,https://unwatch.org/mauritania-set-to-win-seat-on-uns-top-human-rights-body-despite-500000-slaves/,"Mauritania set to win seat on UN's top human rights body, despite 500,000 slaves - UN Watch",https://unwatch.org/wp-content/uploads/2019/10/ghazouani.jpg,"President Mohamed Ould Cheikh El Ghazouani Mauritania’s bid for a seat on the UN’s top human rights body should be rejected, as it fails to meet the basic membership criteria. The election of 14 new countries to the Human Rights Council will be held at the UN in New York tomorrow, October 17, 2019. See our full report on all candidates, and press release. Regrettably, because the African group only has four candidates running for the same amount of available seats, many ambassadors from the 193 UN member states who will vote on Thursday wrongly assume that they are obliged to endorse Mauritania. “Electing slave-holding Mauritania as a UN judge on human rights is like making an arsonist into the town fire chief,” warned Hillel Neuer, executive director of UN Watch, who has led a social media campaign opposing Mauritania. UN Watch documents Mauritania’s abuses below. Mauritania’s Human Rights Record Mauritania commits serious human rights violations, including: Torture Arbitrary and politically motivated arrests Harsh and life-threatening prison conditions Restrictions on freedom of assembly, association and religion Corruption Rape and domestic violence against women Ethnic discrimination by government actors Criminalization of same-sex conduct Slavery Human trafficking Child labor Discussion Mauritania is headed by Mohamed Ould Ghazouani who was elected in June 2019 amidst cries of election irregularities.[1] He follows former President Mohamed Ould Abdel Aziz who came to power in 2008 through a military coup and was re-elected in 2014 in elections boycotted by the main opposition party due to allegations the electoral process was flawed.[2] Government corruption is widespread at the …"
157,https://missoulian.com/news/national/man-charged-in-sex-sting-after-walking-hundreds-of-miles/article_13f9cac6-5245-585c-b948-6c7ae6e7a7de.html,missoulian.com,https://missoulian.com/news/national/man-charged-in-sex-sting-after-walking-hundreds-of-miles/article_13f9cac6-5245-585c-b948-6c7ae6e7a7de.html,404 Error,,This page no longer exists or has been removed
158,https://www.messengernewspapers.co.uk/news/national/17964704.foreign-secretary-criticises-turkeys-military-assault-syria/,Messenger Newspapers,https://www.messengernewspapers.co.uk/news/national/17964704.foreign-secretary-criticises-turkeys-military-assault-syria/,Foreign Secretary criticises Turkey’s military assault in Syria,https://www.messengernewspapers.co.uk/resources/images/10535597/,"At least 11 civilians have died and dozens of fighters from both Kurdish-led and pro-Turkish factions killed, reports say."
159,,,,,https://www.globalresearch.ca/wp-content/uploads/2019/07/erdogan-400x254.jpg,
160,https://www.independent.ie/regionals/enniscorthyguardian/browne-warns-of-potential-chaos-at-rosslare-europort-38571992.html,Independent.ie,https://www.independent.ie/regionals/enniscorthyguardian/browne-warns-of-potential-chaos-at-rosslare-europort-38571992.html,Browne warns of 'potential chaos' at Rosslare Europort - Independent.ie,https://www.independent.ie/regionals/enniscorthyguardian/news/0679d/38571991.ece/ALTERNATES/h342/2019-10-08_wex_53946017_I1.JPG,"Fianna Fáil TD James Browne has once again warned of 'potential chaos' at Rosslare Europort in the event of a no-deal Brexit, having received confirmation that works being carried out t"
161,https://www.azfamily.com/news/b-of-a-reimburses-anthem-couple-who-fell-victim-to/article_22666920-ebc1-11e9-91e0-3b672a289c3c.html,AZFamily,https://www.azfamily.com/news/b-of-a-reimburses-anthem-couple-who-fell-victim-to/article_22666920-ebc1-11e9-91e0-3b672a289c3c.html,B of A reimburses Anthem couple who fell victim to gas skimmers,https://bloximages.newyork1.vip.townnews.com/azfamily.com/content/tncms/assets/v3/editorial/a/75/a75a10ca-ebc4-11e9-9a40-0fce27baf1f8/5d9fd84aa1cf9.image.jpg?resize=1120%2C630,Valley couple is out a lot of money after someone made bogus purchases on their debit card. The charges took place shortly after Megan filled her SUV up with gas
162,https://torontosun.com/news/world/there-may-be-multiple-causes-to-vaping-related-illness-cdc/wcm/81dc7128-cb0b-4582-9618-3a0900bb1bbc,Toronto Sun,https://torontosun.com/news/world/there-may-be-multiple-causes-to-vaping-related-illness-cdc/wcm/81dc7128-cb0b-4582-9618-3a0900bb1bbc,Vaping illness may have multiple causes: CDC,https://postmediatorontosun.files.wordpress.com/2019/10/health-vaping-illness-e1569519099271.jpg,"U.S. health officials said on Friday there may be more than one cause behind the nationwide outbreak of serious lung illnesses linked to vaping, and that they have not yet seen a meaningful drop in…"
163,,,,,,
164,,,,,,
165,http://news.trust.org/item/20191012060829-co7kw/,news.trust.org,http://news.trust.org/item/20191012060829-co7kw/,Turkish forces intensify bombardment around Syrian town,"https://d2sh4fq2xsdeg9.cloudfront.net/contentAsset/image/e0e50d07-a389-4de5-bc55-48b4bda02066/image/byInode/1/filter/Resize,Jpeg/jpeg_q/70/resize_w/1100","More than 100 reported killed including civilians; United Nations says 100,000 people have fled their homes"
166,https://missoulian.com/business/local/new-three-story-stockman-bank-opens-in-missoula-s-midtown/article_e4a49825-2ffc-5824-85c8-4ddb103a272f.html,missoulian.com,https://missoulian.com/business/local/new-three-story-stockman-bank-opens-in-missoula-s-midtown/article_e4a49825-2ffc-5824-85c8-4ddb103a272f.html,New three-story Stockman Bank opens in Missoula's Midtown area,https://bloximages.chicago2.vip.townnews.com/missoulian.com/content/tncms/assets/v3/editorial/f/55/f55db56d-0dad-53f5-b115-61ec61676343/5da0f4d846094.image.jpg?crop=1762%2C991%2C0%2C92&resize=1120%2C630&order=crop%2Cresize,"Stockman Bank opened a new $18 million facility on Brooks Street earlier this month and to celebrate, the company donated $15,000 to Chief Charlo Elementary for a new playground that"
167,,,,,,
168,https://www.vaildaily.com/news/vail-valley-habitat-for-humanity-school-district-partnership-growing/,,https://www.vaildaily.com/news/vail-valley-habitat-for-humanity-school-district-partnership-growing/,"Vail Valley Habitat for Humanity, school district partnership growing",https://cdn.vaildaily.com/wp-content/uploads/sites/7/2019/10/Habitat1-1024x683.jpg,"EDWARDS — A new housing partnership is providing a hand up for a longtime staff member of Eagle County Schools. Manuel Panuco, and his family, will become the sixth school district staffer tabbed as a..."
169,https://www.nytimes.com/2019/10/11/opinion/democracy-free-speech.html,,https://www.nytimes.com/2019/10/11/opinion/democracy-free-speech.html,Opinion | The Free World at 30,https://static01.nyt.com/images/2019/10/14/opinion/11cohen1/11cohen1-facebookJumbo.jpg,"“If you don’t fight for democracy, you don’t deserve it.”"
170,https://www.shreveporttimes.com/story/news/education/2019/10/12/praise-academy-christian-group-makes-shreveport-allendale-mission-field/2444179001/,shreveporttimes.com,https://www.shreveporttimes.com/story/news/education/2019/10/12/praise-academy-christian-group-makes-shreveport-allendale-mission-field/2444179001/,How a Christian group has made Shreveport its mission field,"https://www.gannett-cdn.com/presto/2019/09/26/PSHR/5ae2a5b5-6668-4bcb-bffe-c0795fbbd0a8-111610.JPG?crop=3683,2072,x0,y195&width=3200&height=1680&fit=bounds","People of Praise's work in Allendale has expanded through the years and now includes Praise Academy, a kindergarten through eighth grade school."
171,https://www.standardmedia.co.ke/article/2001345266/mbiti-philosopher-who-challenged-demonic-view-of-africa-s-religion,The Standard,https://www.standardmedia.co.ke/article/2001345266/mbiti-philosopher-who-challenged-demonic-view-of-africa-s-religion,Mbiti: Philosopher who challenged ‘demonic’ view of Africa’s religion : The Standard,http://www.standardmedia.co.ke/images/friday/thumb_mbiti_philosopher_w5da0c94e95219.jpg,"While still in high school, Mbiti became the first African to be published by the East African Literature Bureau "
172,https://www.businessghana.com/,BusinessGhana,https://www.businessghana.com/,Turkey Syria offensive: Dozens killed as assault continues,http://www.businessghana.com/site/img/../../cms/img/news/2019-10-11-1358099.jpg,"Casualties are increasing as Turkey presses on with its cross-border offensive on Kurdish-held areas of northern Syria.

At least 11 civilians..."
173,https://www.pal-item.com/story/opinion/readers/2019/10/12/richmond-letters-editor-oct-13/3923204002/,Pal-Item,https://www.pal-item.com/story/opinion/readers/2019/10/12/richmond-letters-editor-oct-13/3923204002/,"Letters to the editor, Oct. 13",https://www.gannett-cdn.com/-mm-/6ceafe67699e9fd6ca0749f5be24fd8b3c343fcb/c=0-26-507-311/local/-/media/2017/08/11/Richmond/B9328841107Z.1_20170811185441_000_GL8J9GTJK.1-0.jpg?width=1600&height=800&fit=crop,Letter-writers question city budget shortfall and endorse candidates for the Nov. 5 election.
174,https://www.standardmedia.co.ke/article/2001345373/anxiety-as-dci-probes-team-over-ferry-deaths,The Standard,https://www.standardmedia.co.ke/article/2001345373/anxiety-as-dci-probes-team-over-ferry-deaths,Anxiety as DCI probes team over Likoni ferry deaths  : The Standard,http://www.standardmedia.co.ke/images/saturday/thumb_anxiety_as_dci_probe5da2355d2a191.jpg,Kighenda’s widower John Wambua said the retrieved car was in parking gear and the handbrake engaged
175,https://www.theintelligencer.net/news/community/2019/10/wheeling-physician-earns-credit-for-licensure/,theintelligencer.net,https://www.theintelligencer.net/news/community/2019/10/wheeling-physician-earns-credit-for-licensure/,Wheeling Physician Earns Credit for Licensure,https://s3.amazonaws.com/ogden_images/www.theintelligencer.net/images/2019/10/11201052/Reeves-1-800x449.jpg,"WHEELING – A pioneering Wheeling physician led the fight for licensure of doctors in West Virginia and, by extension, for nationwide requirements. Dr. James Reeves, a highly academic practitioner and distinguished doctor in Wheeling in the mid-1800s, helped transform medicine into a legally recognized profession. “He influenced medical education and medical practice in this entire […]"
176,,,,,http://www.bssnews.net/wp-content/uploads/2019/03/cricket-live-updates-app.jpg,
177,,southcoasttoday.com,,"AP Explains: Columbus, once immigrant hero, now heel to some",https://www.southcoasttoday.com/storyimage/NB/20191011/NEWS/191019897/AR/0/AR-191019897.jpg,"ALBUQUERQUE, N.M.  — The image and story of Christopher Columbus, the 15th century navigator who began European incursions into the Americas,"
178,,,,,,
179,https://sputniknews.com/interviews/201910121077030300-first-human-spacewalker-alexei-leonov-we-have-gone-through-fire-water-everything/,,https://sputniknews.com/interviews/201910121077030300-first-human-spacewalker-alexei-leonov-we-have-gone-through-fire-water-everything/,"First Human Spacewalker Alexei Leonov: We Have Gone Through 'Fire, Water, Everything'",https://cdn5.img.sputniknews.com/images/107703/06/1077030606.jpg,"Alexei Leonov, the first human to conduct a spacewalk and a participant in the milestone joint US-Soviet Union space mission which saw a US Apollo module dock with a USSR Soyuz spacecraft in July 1975, passed away on Friday at the age of 85."
180,/news/world/asia/top-us-senator-accuses-pakistan-of-supporting-taliban-al-qaeda-in-afghanistan20191012224551/,,/news/world/asia/top-us-senator-accuses-pakistan-of-supporting-taliban-al-qaeda-in-afghanistan20191012224551/,"Top US senator accuses Pakistan of supporting Taliban, al-Qaeda in Afghanistan ",https://aniportalimages.s3.amazonaws.com/media/details/maggie_hassan.jpg,"New Delhi [India], Oct 12 (ANI): A top US senator has accused Pakistan of supporting terror groups like the Taliban and al-Qaeda in Afghanistan and harbouring terrorists belonging to these groups in the war-torn country."
181,,,,Robert De Niro calls Trump a dirty player,http://www.gulftoday.ae/-/media/gulf-today/images/articles/culture/2019/10/12/deniro1.ashx?h=400&w=750&hash=87CB00F99B975A55A2DDD4097B101B31,"Legendary Hollywood actor Robert De Niro renewed his criticism of Donald Trump on Friday, telling a London audience the US president was trying to ""destroy"" American institutions ""to save himself""."
182,https://www.malaymail.com/news/showbiz/2019/10/12/de-niro-talks-trump-and-acting-technique-at-london-film-fest/1799608,,https://www.malaymail.com/news/showbiz/2019/10/12/de-niro-talks-trump-and-acting-technique-at-london-film-fest/1799608,De Niro talks Trump and acting technique at London Film Fest | Malay Mail,https://media.malaymail.com/resize_cache/uploads/articles/2019/2019-10/20101012scorsese_deniro-seo.jpg,"LONDON, Oct 12 — Legendary Hollywood actor Robert De Niro renewed his criticism of Donald Trump yesterday, telling a London audience the US president was trying to “destroy” American institutions “to save himself”. &nbsp; In a wide-ranging question-and-answer event at the London Film..."
183,,eNCA,,Pupil stabbed to death at Sebokeng school laid to rest,https://www.enca.com/sites/default/files/styles/facebook/public/2019-10/web_photo_tshepo_burial.jpg?h=ddb1ad0c&itok=U6uvnA6B,Tshepo Mphehlo was stabbed on Monday at Thuto Tiro Comprehensive School in Sebokeng near Vanderbijlpark.
184,https://fox2now.com/2019/10/11/southern-illinois-communities-mourn-the-loss-of-second-law-enforcement-officer-in-two-months/,FOX2now.com,https://fox2now.com/2019/10/11/southern-illinois-communities-mourn-the-loss-of-second-law-enforcement-officer-in-two-months/,Southern Illinois communities mourn the loss of second law enforcement officer in two months,https://localtvktvi.files.wordpress.com/2019/10/promo395116717.jpg?quality=85&strip=all&w=1200,"WATERLOO, Ill. – In Waterloo, Illinois they’re getting ready for Saturday’s annual pumpkin festival, but there’s sorrow in people’s hearts. For the second time in two months, a law enforcement officer who lives in the rural area has been killed.

St. Louis County Police Officer James Ellis served in the Jennings precinct. He died Thursday night in a collision while on his way home from work. He was 49."
185,https://www.newsnation.in/india/news/modi-government-amit-shah-human-right-violation-zero-tolerance-custodial-deaths-police-atrocities-240691.html,https://www.newsnation.in,https://www.newsnation.in/india/news/modi-government-amit-shah-human-right-violation-zero-tolerance-custodial-deaths-police-atrocities-240691.html," Modi Govt Has Zero-Tolerance On Custodial Deaths, Police Atrocities: Amit Shah  - News Nation",https://cdn6.newsnation.in/images/2019/10/12/amitshah11-42.jpg,"Union Home Minister Amit Shah on Saturday hailed the Narendra Modi government of working “extensively to protect the human rights”, saying the Central government has zero-tolerance on custodial deaths, extra-judicial deaths, and police atrocities."
186,https://reliefweb.int/report/serbia/report-secretary-general-united-nations-interim-administration-mission-kosovo-s2019797,ReliefWeb,https://reliefweb.int/report/serbia/report-secretary-general-united-nations-interim-administration-mission-kosovo-s2019797,Report of the Secretary-General on the United Nations Interim Administration Mission in Kosovo (S/2019/797) - Serbia,https://reliefweb.int/sites/reliefweb.int/files/styles/attachment-large/public/resources-pdf-previews/1380448-S_2019_797_E.png?itok=pmthWHnz,"English UN Document on Serbia about Peacekeeping and Peacebuilding, Protection and Human Rights, Children, IDPs and more; published on 04 Oct 2019 by UN SC"
187,https://legalinsurrection.com/2019/10/turkeys-erdogan-threatens-eu-oppose-our-attack-on-kurds-and-we-will-send-3-6-million-migrants-to-you/,Le·gal In·sur·rec·tion,https://legalinsurrection.com/2019/10/turkeys-erdogan-threatens-eu-oppose-our-attack-on-kurds-and-we-will-send-3-6-million-migrants-to-you/,"Turkey's Erdogan threatens EU: Oppose our attack on Kurds and ""we will ... send 3.6 million migrants to you""",https://legalinsurrection.com/wp-content/uploads/2019/10/Erdogan-Turkey-Migrants-e1570883305600.jpg,"""Hey EU, wake up. I say it again: if you try to frame our operation [against Kurds] as an invasion, our task is simple: we will open the doors and send 3.6 million migrants to you,"""
188,https://thehill.com/policy/defense/465540-five-ways-trumps-syria-decision-spells-trouble,TheHill,https://thehill.com/policy/defense/465540-five-ways-trumps-syria-decision-spells-trouble,Five ways Trump's Syria decision spells trouble,https://thehill.com/sites/default/files/syria_kurds_101119getty_0.jpg,"President Trump this week showed no sign of backing down on his decision to withdraw U.S. troops from northern Syria, stoking fears in Washington of worst-case scenarios from abandoning a crucial defense partner. "
189,,,,,,
190,,Yeni Şafak,,Turkey to respond tit-for-tat to possible US sanctions,https://img.piri.net/mnresize/600/-/resim/imagecrop/2019/10/12/10/58/resized_f08ee-1259_eng_picture_20191011_19593481_19593480.jpg,"No one should doubt Turkey will respond within framework of full reciprocity, says country's foreign ministry"
191,https://gazette.com/thetribune/monument-man-arrested-after-dna-ties-him-to-murder-of/article_97f415b6-35fa-11e9-8066-5326785a58b6.html,Colorado Springs Gazette,https://gazette.com/thetribune/monument-man-arrested-after-dna-ties-him-to-murder-of/article_97f415b6-35fa-11e9-8066-5326785a58b6.html,Monument man arrested after DNA ties him to 1973 murder of 11-year-old California girl,https://bloximages.newyork1.vip.townnews.com/gazette.com/content/tncms/assets/v3/editorial/5/31/53180f96-35fb-11e9-9141-ffb8dd947c72/5c6dacfd854bf.image.png?resize=200%2C250,A 72-year-old man who had been living in Monument for the past three years was arrested Feb. 20 after DNA tied him to a decades-old murder of an 11-year-old California
192,,,,,,
193,,,,,,
194,https://finance.yahoo.com/news/turkey-bombards-syrian-kurdish-militia-065104547.html,,https://finance.yahoo.com/news/turkey-bombards-syrian-kurdish-militia-065104547.html,"Turkey bombards Syrian Kurdish militia, thousands flee as death toll mounts",https://s.yimg.com/cv/apiv2/social/images/yahoo_default_logo.png,"Turkish warplanes and artillery hit Kurdish militia targets in northeast Syria on the third day of an offensive that has killed hundreds of people, forced tens of thousands to flee and turned Washington's establishment against President Donald Trump.  Since Trump pulled U.S. troops out of the way"
195,https://www.dallasnews.com/news/2019/10/12/dallas-council-freshman-chad-west-appointed-to-lead-housing-committee/,Dallas News,https://www.dallasnews.com/news/2019/10/12/dallas-council-freshman-chad-west-appointed-to-lead-housing-committee/,Dallas council freshman Chad West appointed to lead housing committee,https://dmn-dallas-news-prod.cdn.arcpublishing.com/resizer/3GP0AERGEUKwAOlnBcrSjEnk0Lg=/1200x630/smart/filters:no_upscale()/arc-anglerfish-arc2-prod-dmn.s3.amazonaws.com/public/MXXCJXZR3MJHDTB3MCGL4BIZQU.jpg,"Dallas Mayor Eric Johnson on Friday announced his City Council committee appointments, naming all but two freshmen to leadership positions. The..."
196,https://www.kzoo.edu/news/young-voters/,News and Events,https://www.kzoo.edu/news/young-voters/,K Student Helps Secretary of State Empower Young Voters,https://www.kzoo.edu/news/files/2019/10/Hope-Miller-Empowers-Young-Voters_Facebook.jpg,"If helping young voters in Michigan is the goal, Kalamazoo College could be a part of the solution thanks to Hope Miller ’22."
197,http://www.taipeitimes.com/News/taiwan/archives/2019/10/13/2003723860,,http://www.taipeitimes.com/News/taiwan/archives/2019/10/13/2003723860,Chen Chien-jen says Holy See values Taiwan ties - Taipei Times,http://www.taipeitimes.com/images/2019/10/13/thumbs/p03-191013-vp.jpg,"The Holy See attaches importance to its relations with Taiwan and an agreement between the Vatican and China on the appointment of bishops merely shows Pope Francis’ efforts to improve religious freedom there, Vice President Chen Chien-jen (陳建仁) said on Friday."
198,https://www.record-eagle.com/news/business/october-declared-michigan-agritourism-month/article_4a259428-e9f4-11e9-a2fa-a70e48a91f3f.html,Traverse City Record-Eagle,https://www.record-eagle.com/news/business/october-declared-michigan-agritourism-month/article_4a259428-e9f4-11e9-a2fa-a70e48a91f3f.html,October declared Michigan Agritourism Month,https://bloximages.chicago2.vip.townnews.com/record-eagle.com/content/tncms/custom/image/1edfec9c-04b0-11ea-80eb-27e1f67b4a63.jpg,TRAVERSE CITY – Governor Gretchen Whitmer has proclaimed October as Michigan Agritourism Month to recognize the economic and social benefits of agritourism to our state’s farms and communities.
