,source_url,site_name,site_url,title,img_url,description
0,https://thepigsite.com/news/2019/10/farming-for-the-future-in-the-face-of-brexit-and-climate-change,,https://thepigsite.com/news/2019/10/farming-for-the-future-in-the-face-of-brexit-and-climate-change,Farming for the future in the face of Brexit and climate change,https://5mpublishing.sirv.com/pig%2Farticles%2Farticle-specific%2Fthree-counties-farming-conference.jpg?scale.option=fill&scale.width=1200&scale.height=630&crop.width=1200&crop.height=630&crop.y=center&crop.x=center,
1,https://www.ncronline.org/news/vatican/amazon-synods-secrecy-shows-tension-between-transparency-and-discernment,National Catholic Reporter,https://www.ncronline.org/news/vatican/amazon-synods-secrecy-shows-tension-between-transparency-and-discernment,Amazon synod's secrecy shows tension between transparency and discernment,https://www.ncronline.org/sites/default/files/styles/facebook_ratio/public/web%2020191011T0515-636-CNS-VATICAN-LETTER-CREATION.jpg?itok=jTUE1I4X,"The Synod of Bishops for the Amazon region, being held at the Vatican from Oct. 6-27, got underway well before its official opening with one of the most exhaustive, inclusive and transparent preparati..."
2,https://www.nzherald.co.nz/entertainment/news/article.cfm?c_id=1501119&objectid=12276893,NZ Herald,https://www.nzherald.co.nz/entertainment/news/article.cfm?c_id=1501119&objectid=12276893,Cuba Gooding Jr faces accusations from 14 women of sexual misconduct,https://www.nzherald.co.nz/resizer/O-8ssVsnKMgCPNyhRSIX5N4DN_8=/1200x0/smart/filters:quality(70)/arc-anglerfish-syd-prod-nzme.s3.amazonaws.com/public/RKCPWDG6UNHIVKUNANTMK5VNVM.jpg,Another victim has come forward revealing what happened with Cuba Gooding Jr.
3,/news/world/asia/no-further-export-licenses-to-turkey-for-military-related-items-says-uk-foreign-secretary20191015201547/,,/news/world/asia/no-further-export-licenses-to-turkey-for-military-related-items-says-uk-foreign-secretary20191015201547/,"No further export licenses to Turkey for military-related items, says UK Foreign Secretary",https://aniportalimages.s3.amazonaws.com/media/details/Dominic_Raab_Ji8A7J9.jpg,"London [UK], Oct 15 (ANI): United Kingdom Foreign Secretary Dominic Raab on Tuesday condemned the Turkish military offensive in the northern part of Syria and said the country will not grant licenses to Turkey for items that might be used in military operations."
4,,,,,,
5,https://www.kmov.com/news/charged-in-robbery-chase-and-crash-that-left-st-louis/article_90bb6b44-ee98-11e9-a73e-fbc7216aa814.html,KMOV.com,https://www.kmov.com/news/charged-in-robbery-chase-and-crash-that-left-st-louis/article_90bb6b44-ee98-11e9-a73e-fbc7216aa814.html,"3 charged in robbery, chase and crash that left St. Louis County woman paralyzed",https://bloximages.newyork1.vip.townnews.com/kmov.com/content/tncms/assets/v3/editorial/c/96/c9695e0c-ef9b-11e9-a3c6-9b643529c955/5da649bdb04cf.image.jpg?resize=1120%2C630,Thee suspects are facing charges in connection with an armed robbery and bi-state police chase that happened Sunday afternoon.
6,,,,,,
7,,,,,,
8,https://www.voanews.com/africa/sudans-first-female-chief-justice-wins-wide-acceptance,Voice of America,https://www.voanews.com/africa/sudans-first-female-chief-justice-wins-wide-acceptance,Sudan's First Female Chief Justice Wins Wide Acceptance,https://media.voltron.voanews.com/Drupal/01live-166/2019-10/AP_19255655626797.jpg,"Sudanese citizens have largely embraced the sovereign council’s move to appoint Nemat Abdallah as Sudan’s first female chief justice, a first in the Arab world.

Nemat Abdallah Mohammed Khair’s appointment is monumental not only for Sudan but for all of Africa."
9,https://lompocrecord.com/news/national/still-his-race-to-lose-nobody-s-ko-d-biden/article_1a960bed-5c98-560d-bdd0-2fc1d9f24b85.html,Lompoc Record,https://lompocrecord.com/news/national/still-his-race-to-lose-nobody-s-ko-d-biden/article_1a960bed-5c98-560d-bdd0-2fc1d9f24b85.html,404 Error,https://bloximages.chicago2.vip.townnews.com/lompocrecord.com/content/tncms/custom/image/6f422ece-a7da-11e6-8c00-8fa964c714c2.jpg?resize=600%2C600,This page no longer exists or has been removed
10,,Ocala.com,,Editorial: Who is our ally?,https://www.ocala.com/storyimage/LK/20191015/OPINION/191018589/AR/0/AR-191018589.jpg,"Republicans and Democrats finally found something to agree on, shouldering together recently to rip President Donald Trump's decision to abruptly pull U.S."
11,,,,,,
12,https://www.pressherald.com/2019/10/15/childrens-museum-sells-building-to-portland-museum-of-art-in-boost-for-both/,Press Herald,https://www.pressherald.com/2019/10/15/childrens-museum-sells-building-to-portland-museum-of-art-in-boost-for-both/,"Children’s museum sells building to Portland art museum, in boost for both",https://multifiles.pressherald.com/uploads/sites/10/2019/10/10946787_20191015_ChildrensMuseum_0047-1024x683.jpg,The sale for $2.1 million means the Children’s Museum & Theatre of Maine can advance its plans to move to Thompson's Point and the Portland Museum of Art gains flexibility for expansion.
13,https://www.lowyinstitute.org/the-interpreter/plogging-along-india-china-struggle-find-momentum,,https://www.lowyinstitute.org/the-interpreter/plogging-along-india-china-struggle-find-momentum,Plogging along: India-China struggle to find momentum,https://www.lowyinstitute.org/sites/default/files/EGnR1NNUEAAnKV-.jpg,Little of substance appeared to come from weekend talks between Modi and Xi – and maybe that’s the point.
14,https://whotv.com/2019/10/15/rock-in-prevention-loses-150k-grant-from-polk-county/,whotv.com,https://whotv.com/2019/10/15/rock-in-prevention-loses-150k-grant-from-polk-county/,Rock in Prevention Loses $150K Grant from Polk County,https://localtvwhotv.files.wordpress.com/2019/10/promo395450174.jpg?quality=85&strip=all&w=1200,"DES MOINES, Iowa -- A long-time nonprofit that uses music to discourage bullying and drug use is under scrutiny after the Polk County Board of Supervisors received some conflicting information about the director’s salary.

On Tuesday, the Polk County Board of Supervisors pulled the plug on a $150,000 grant to Rock in Prevention. All five supervisors voted to rescind the grant."
15,https://www.illinoispolicy.org/red-light-camera-backlash-gains-bipartisan-momentum-in-springfield/,Illinois Policy,https://www.illinoispolicy.org/red-light-camera-backlash-gains-bipartisan-momentum-in-springfield/,Red-light camera backlash gains bipartisan momentum in Springfield,https://files.illinoispolicy.org/wp-content/uploads/2018/08/shutterstock_160419041-1024x683.jpg,Driver headaches and corruption flow from red-light cameras. Two bills with bipartisan support would ban the traffic devices in Illinois.
16,,,,,,
17,https://www.forbes.com/sites/michaellynch/2019/10/15/slowing-permian-oil-supply-might-be-reversed-soon/,Forbes,https://www.forbes.com/sites/michaellynch/2019/10/15/slowing-permian-oil-supply-might-be-reversed-soon/,Slowing Permian Oil Supply Might Be Reversed Soon,https://thumbor.forbes.com/thumbor/600x315/https%3A%2F%2Fspecials-images.forbesimg.com%2Fdam%2Fimageserve%2F1161946771%2F960x0.jpg%3Ffit%3Dscale,"The recent slow-down in Permian oil production growth might represent producers waiting for higher prices and new pipelines come online, rather than a geological peak."
18,https://www.thejournal.ie/inquest-park-ranger-suicide-4852073-Oct2019/,TheJournal.ie,https://www.thejournal.ie/inquest-park-ranger-suicide-4852073-Oct2019/,'He had a heart of gold': Inquest rules death of park ranger at council depot was suicide ,https://img2.thejournal.ie/article/4852073/river/?height=400&version=4852454,The inquest heard the phrase “Stand up to bullies” was spray-painted on the wall of the canteen where Stephen Taylor’s body was found.
19,,,,,,
20,,,,,,
21,https://www.newsbytesapp.com/timeline/World/53107/244968/donald-trump-to-celebrate-diwali-on-thursday,NewsBytes App,https://www.newsbytesapp.com/timeline/World/53107/244968/donald-trump-to-celebrate-diwali-on-thursday,"Before India, Donald Trump will celebrate Diwali in White House",https://i.cdn.newsbytesapp.com/images/l141_23241571735305.jpg,"United States President Donald Trump will celebrate Diwali at the White House on Thursday, three days before the festival of lights will be celebrated in India. This will be the third time that Trump will be basking in Diwali festivities. This tradition was started by his predecessor Barack Obama."
22,https://www.dw.com/en/why-the-world-is-talking-about-georgian-wine/a-50798532,DW.COM,https://www.dw.com/en/why-the-world-is-talking-about-georgian-wine/a-50798532,Why the world is talking about Georgian wine | DW | 15.10.2019,https://www.dw.com/image/50808335_304.jpg,"After 8,000 years, Georgians are still making wine as they used to in clay pots buried underground. DW's Sarah Hucal took a trip to Georgian wine country in the South Caucasus to see what it’s all about. "
23,https://www.nytimes.com/2019/10/15/us/politics/native-americans-health-care.html,,https://www.nytimes.com/2019/10/15/us/politics/native-americans-health-care.html,"Fed Up With Deaths, Native Americans Want to Run Their Own Health Care",https://static01.nyt.com/images/2019/10/11/us/politics/11dc-indianhealth1-promo2/11dc-indianhealth1-promo-facebookJumbo-v2.jpg,"After decades of enduring poor care from the government-run Indian Health Service, tribal groups are taking over management of hospitals."
24,https://www.business-standard.com/article/pti-stories/trump-says-will-impose-sanctions-on-turkey-prepared-to-swiftly-destroy-its-economy-119101500092_1.html,,https://www.business-standard.com/article/pti-stories/trump-says-will-impose-sanctions-on-turkey-prepared-to-swiftly-destroy-its-economy-119101500092_1.html,"Trump says will impose sanctions on Turkey, prepared to 'swiftly destroy' its economy",https://bsmedia.business-standard.com/_media/bs/img/article/default/1191015/full-119101500092.jpg,"Protesting Turkey's military offensive into northeast Syria, US President Donald Trump on Monday announced he will authorise sanctions against Turkish officials, raise steel tariffs and end negotiations on a USD 100 billion trade deal.
Turkey"
25,https://www.naturalnews.com/2019-10-15-cornell-law-prof-pushes-arrest-trump-associates.html,NaturalNews.com,https://www.naturalnews.com/2019-10-15-cornell-law-prof-pushes-arrest-trump-associates.html,Cornell Law prof pushes Dems to arrest and jail associates of Trump in impeachment push,https://www.naturalnews.com/wp-content/uploads/sites/91/2019/10/Trump-Donald-Ivanka-Kushner-Jared-Melania-Election.jpg,"The American Left has been increasingly comfortable in the Democrat Party now for decades, becoming more so after Barack Obama the Marxist took it over when he was elected in 2008.

And with increasing Leftism comes increasing authoritarianism — because all of today’s modern Left-wing political id"
26,,,,,,
27,,,,,,
28,http://www.myjoyonline.com/opinion/2019/October-15th/who-are-the-kurds-and-why-is-turkey-attacking-them-in-syria.php,,http://www.myjoyonline.com/opinion/2019/October-15th/who-are-the-kurds-and-why-is-turkey-attacking-them-in-syria.php,"Who are the Kurds, and why is Turkey attacking them in Syria?",http://photos.myjoyonline.com/photos/news/201208/160072816_750088.jpg,Why did Turkey invade? Why did America leave? How did the Kurds gain so much land? We answer 10 key questions about the Turkish invasion of northern Syria.
29,,,,,,
30,https://www.wmky.org/post/china-has-begun-moving-xinjiang-muslim-detainees-formal-prisons-relatives-say,,https://www.wmky.org/post/china-has-begun-moving-xinjiang-muslim-detainees-formal-prisons-relatives-say,"'Illegal Superstition': China Jails Muslims For Practicing Islam, Relatives Say",https://mediad.publicbroadcasting.net/p/shared/npr/styles/medium/nprshared/202001/764201138.jpeg,"This August, Aibota Zhanibek received a surprising call in Kazakhstan from a relative through Chinese chat app WeChat. It was about her sister, Kunekai"
31,,,,,,
32,http://ticklethewire.com/2019/10/15/fbi-investigation-corruption-in-blooming-marijuana-industry-in-california-and-nevada/,Tickle The Wire,http://ticklethewire.com/2019/10/15/fbi-investigation-corruption-in-blooming-marijuana-industry-in-california-and-nevada/,FBI Investigating Corruption in Blooming Marijuana Industry in California And Nevada - Tickle The Wire,http://ticklethewire.com/wp-content/uploads/2018/08/MarijuanaintheMittenphoto-300x200.jpg,The FBI warned in August that the blooming marijuana industry was a “public corruption threat” because of the money and power involved. Now agents are investigating cases in Nevada and California.
33,https://www.militarytimes.com/news/your-military/2019/10/14/syrian-army-moves-to-confront-turkish-forces-as-us-withdraws/,Army Times,https://www.militarytimes.com/news/your-military/2019/10/14/syrian-army-moves-to-confront-turkish-forces-as-us-withdraws/,Syrian army moves to confront Turkish forces as US withdraws,https://www.armytimes.com/resizer/wqHB43C5nUDauxWL9fa1-9sS3pY=/1200x630/filters:quality(100)/arc-anglerfish-arc2-prod-mco.s3.amazonaws.com/public/F73SKASJZ5AITCTVHBJBW7JGBQ.jpg,"The Syrian army's deployment near the Turkish border came hours after Syrian Kurdish forces previously allied with the U.S. said they had reached a deal with President Bashar Assad's government to help fend off Turkey's invasion, now in its sixth day."
34,https://www.delawareonline.com/story/news/crime/2019/10/15/newark-police-delaware-doj-announce-indictment-decades-old-rape/3977325002/,delawareonline,https://www.delawareonline.com/story/news/crime/2019/10/15/newark-police-delaware-doj-announce-indictment-decades-old-rape/3977325002/,Pennsylvania man charged in decades-old rape case after DNA links him to attack,"https://www.gannett-cdn.com/presto/2019/10/15/PWIL/532ff96c-3667-4051-9050-bf8dff822aa1-rapist_comnposite.jpg?crop=814,458,x0,y0&width=1600&height=800&fit=bounds","Decades after a woman was raped near the University of Delaware campus, her attacker has been identified though DNA and ""cutting-edge technology."""
35,https://www.ajc.com/blog/politics/hunter-biden-interview-and-the-ghost-billy-carter/5FIjlqRv3zvBuycJtcIfpN/,ajc,https://www.ajc.com/blog/politics/hunter-biden-interview-and-the-ghost-billy-carter/5FIjlqRv3zvBuycJtcIfpN/,Hunter Biden's interview and the ghost of Billy Carter ,https://www.ajc.com/rf/image_large/Pub/p10/AJC/2019/10/15/Images/hunterbiden2_20191015174924.PNG,"We often forget that politicians, just like you and me, are subject to the immutable bylaws that gov..."
36,https://www.dvidshub.net/news/347678/lrafb-ddrp-wins-2019-red-ribbon-award,DVIDS,https://www.dvidshub.net/news/347678/lrafb-ddrp-wins-2019-red-ribbon-award,LRAFB DDRP wins 2019 Red Ribbon Award,https://cdn.dvidshub.net/media/thumbs/photos/1910/5833011/1000w_q75.jpg,"The 19th Airlift Wing Drug Demand Reduction Program won the 29th-annual Secretary of Defense Community Drug Awareness Award, which is given once per year, to one installation in each military branch, making LRAFB the U.S. Air Force category winner. 
The Red Ribbon Award highlights all the prevention efforts that have been made throughout the past year by the DDRP’s joint service and multiagency coalition."
37,https://northernstar.info/from_ap/impeachment-tests-democrats-foothold-in-swing-districts/article_81297f2d-6f09-5d1d-adf9-a56f179008ec.html,Northern Star Online,https://northernstar.info/from_ap/impeachment-tests-democrats-foothold-in-swing-districts/article_81297f2d-6f09-5d1d-adf9-a56f179008ec.html,404 Error,https://bloximages.newyork1.vip.townnews.com/northernstar.info/content/tncms/custom/image/c80a4d18-020e-11e8-8469-3fd238472d7c.jpg?resize=600%2C168,This page no longer exists or has been removed
38,https://theprint.in/opinion/global-print/william-kate-pakistan-visit-hardly-matters-to-modi-but-india-will-follow-it-closely/305988/,ThePrint,https://theprint.in/opinion/global-print/william-kate-pakistan-visit-hardly-matters-to-modi-but-india-will-follow-it-closely/305988/,William-Kate’s Pakistan visit hardly matters to Modi but India will follow it closely,https://d2c7ipcroan06u.cloudfront.net/wp-content/uploads/2019/10/William-Kate-Pakistan-visit.jpg,The royal trip shatters all the illusions about Pakistan being isolated over Kashmir.
39,https://www.nvdaily.com/nvdaily/federal-court-unseals-eda-documents/article_b451f415-9272-58f6-8caf-8d344c7c383c.html,The Northern Virginia Daily,https://www.nvdaily.com/nvdaily/federal-court-unseals-eda-documents/article_b451f415-9272-58f6-8caf-8d344c7c383c.html,Federal court unseals EDA documents,https://bloximages.newyork1.vip.townnews.com/nvdaily.com/content/tncms/custom/image/f49c34a0-9ca4-11e8-8115-4714fd783b28.png,FRONT ROYAL – Court documents in the U.S. Western District Court of Virginia were unsealed Tuesday and detailed evidence removed from the Front Royal-Warren County Economic Development Authority’s office during
40,https://www.thejakartapost.com/news/2019/10/15/ri-must-clear-obstacles-to-reap-benefits-from-trade-with-latin-america-caribbean.html,The Jakarta Post,https://www.thejakartapost.com/news/2019/10/15/ri-must-clear-obstacles-to-reap-benefits-from-trade-with-latin-america-caribbean.html,"RI must clear obstacles to reap benefits from trade with Latin America, Caribbean",https://img.jakpost.net/c/2019/03/25/2019_03_25_68439_1553498890._large.jpg,"Indonesian businesses need to overcome several hurdles in trade with countries of Latin America and the Caribbean, but officials say their rewards could be worth the effort."
41,,,,,,
42,https://www.fox5dc.com/news/kidnapper-on-the-run-after-kidnapped-mother-2-children-found-safe-in-south-carolina,FOX 5 DC,https://www.fox5dc.com/news/kidnapper-on-the-run-after-kidnapped-mother-2-children-found-safe-in-south-carolina,"Kidnapper on the run after kidnapped mother, 2 children found safe in South Carolina",https://images.foxtv.com/static.fox5dc.com/www.fox5dc.com/content/uploads/2019/10/724/407/E420159E5F13422EA999123EF84BA5A3.jpg?ve=1&tl=1,"Authorities said they have located the mother and two young children part of a Levi's Call, Georgia's Amber Alert system. The trio was kidnapped at knifepoint from their home along Forest Hill Road in Powder Springs around 1 a.m. Monday, authorities said."
43,https://indianexpress.com/article/india/religare-fund-diversion-case-delhi-court-extends-police-custody-of-singh-brothers-by-two-days-6070205/,The Indian Express,https://indianexpress.com/article/india/religare-fund-diversion-case-delhi-court-extends-police-custody-of-singh-brothers-by-two-days-6070205/,Religare fund diversion case: Delhi court extends police custody of Singh brothers by two days,https://images.indianexpress.com/2019/04/malvinder-m-singh-and-shivinder-m-singh-759.jpg?w=759,"Chief Metropolitan Magistrate Deepak Sherawat extended custodial interrogation of Singh brothers, along with senior official Sunil Godhwani, after the probe agency sought their two-day custody saying that new material has come up in the case, PTI reported."
44,http://www.taipeitimes.com/News/world/archives/2019/10/16/2003724051,,http://www.taipeitimes.com/News/world/archives/2019/10/16/2003724051,Texas officer charged with murder - Taipei Times,http://www.taipeitimes.com/images/2019/10/16/thumbs/P07-191016-309.jpg,A white Fort Worth police officer who shot and killed a black woman through a back window of her home while responding to a call about an open front door was on Monday evening charged with murder after resigning from the force.
45,https://allafrica.com/stories/201910150252.html,allAfrica.com,https://allafrica.com/stories/201910150252.html,Sudan: Asma and China Ambassador Discuss Ways to Reinforce Biateral Relations,https://cdn07.allafrica.com/static/images/structure/aa-logo-rgba-no-text-128x128.png,"The Minister of Foreign Affairs, Asma Mohamed Abdalla, received in her office Monday noon the Ambassador of China to Sudan, Ma Xinmin, and discussed progress of the relations between Sudan and China and means of consolidating them during the transitional period."
46,https://www.kwqc.com/content/news/Temporary-trial-date-set-for-Iowa-man-accused-of-killing-Michelle-Martinko-563100271.html ,,https://www.kwqc.com/content/news/Temporary-trial-date-set-for-Iowa-man-accused-of-killing-Michelle-Martinko-563100271.html ,Temporary trial date set for Iowa man accused of killing Michelle Martinko,https://media.graytvinc.com/images/1014_JerryBurns_CedarRapidsPD.jpg,"The trial for Jerry Burns, 65, the man charged in the death of Michelle Martinko, is now temporarily set for Feb. 10."
47,,,,,http://mastercms.alhilalgroup.com/source/TA/2019/10/15/TA_20191015132544743_359821.jpg,
48,https://www.sify.com/news/maharashtra-polls-bjp-releases-manifesto-news-national-tkplo6fhfbdjf.html,Sify,https://www.sify.com/news/maharashtra-polls-bjp-releases-manifesto-news-national-tkplo6fhfbdjf.html,"Maharashtra polls: BJP releases manifesto
",https://static.sify.com/cms/image/manifesto-tkplozejicjdc_small.jpg,Elections for the 288 member assembly will be held on 21st of this month while counting will be taken up on the 24th.
49,,,,,,
50,https://www.al.com/news/mobile/2019/10/man-shot-in-kellogg-street-apartment-guns-drugs-found-at-scene.html,al,https://www.al.com/news/mobile/2019/10/man-shot-in-kellogg-street-apartment-guns-drugs-found-at-scene.html,"Man shot in Kellogg Street apartment, guns, drugs found",https://www.al.com/resizer/m3VGXwFZlnBeUp8XXyrmikS5KZ4=/1280x0/smart/arc-anglerfish-arc2-prod-advancelocal.s3.amazonaws.com/public/2B5UT3JMEZE3XK46ULGBLK2NPI.jpg,"According to the Mobile PD, authorities found a male victim shot in the 1400 block of Kellogg Street."
51,https://www.indiatoday.in/india/story/kerala-serial-murders-police-conduct-second-round-of-evidence-collection-complainant-to-give-statement-1609445-2019-10-15,India Today,https://www.indiatoday.in/india/story/kerala-serial-murders-police-conduct-second-round-of-evidence-collection-complainant-to-give-statement-1609445-2019-10-15,"Kerala serial murders: Police conduct second round of evidence collection, complainant to give statement",https://akm-img-a-in.tosshub.com/indiatoday/images/story/201910/jolly-647x363.jpeg?D_TAf4opMzpJkxnXNO2uYv1amwX58HZy,"In another round of evidence gathering, Kerala Police brought prime accused in Kozhikode serial killings Jolly Joseph to the Ponnamttam house where three deaths had taken place."
52,,,,,,
53,https://tass.com/politics/1083275,TASS,https://tass.com/politics/1083275,Russian national detained in Minsk provided with necessary support — Foreign Ministry,https://tass.com/img/blocks/common/tass_logo_share_ru.png,"In February 2018, US officials pressed charges against 13 Russian citizens, including Anna Bogacheva, accusing them of attempting to interfere in the US political process"
54,https://www.tulsaworld.com/news/local/education/tcc-celebrates-grand-opening-of-chemistry-and-biology-labs-at/article_f16ad412-144e-5180-83e6-0d4398d6e369.html,Tulsa World,https://www.tulsaworld.com/news/local/education/tcc-celebrates-grand-opening-of-chemistry-and-biology-labs-at/article_f16ad412-144e-5180-83e6-0d4398d6e369.html,TCC celebrates grand opening of chemistry and biology labs at Metro Campus,https://bloximages.newyork1.vip.townnews.com/tulsaworld.com/content/tncms/assets/v3/editorial/4/5d/45d09399-df4b-582b-b9a6-2c9bf07f9312/5da646c10187c.image.jpg?crop=1709%2C961%2C0%2C125&resize=1120%2C630&order=crop%2Cresize,Tulsa Community College student Nikki Morgan is no longer complaining about the antiquated science labs at the Metro Campus.Tulsa Community College announces $20-million campaign to enhance student services
55,https://www.kezi.com/content/news/Psychiatric-patient-reported-missing-in-Eugene--563132111.html,KEZI News,https://www.kezi.com/content/news/Psychiatric-patient-reported-missing-in-Eugene--563132111.html,Psychiatric patient reported missing in Eugene,http://media.heartlandtv.com/images/Peace+Wickham.jpg,Law enforcement don’t consider the patient to be a danger to himself or others but he should not be approached.
56,https://www.ajc.com/blog/politics/hunter-biden-interview-and-the-ghost-billy-carter/5FIjlqRv3zvBuycJtcIfpN/,ajc,https://www.ajc.com/blog/politics/hunter-biden-interview-and-the-ghost-billy-carter/5FIjlqRv3zvBuycJtcIfpN/,Hunter Biden's interview and the ghost of Billy Carter ,https://www.ajc.com/rf/image_large/Pub/p10/AJC/2019/10/15/Images/hunterbiden2_20191015174924.PNG,"We often forget that politicians, just like you and me, are subject to the immutable bylaws that gov..."
57,https://www.wgal.com/article/coroner-man-dies-in-one-vehicle-crash-in-heidleberg-township-york-county/29472605,WGAL,https://www.wgal.com/article/coroner-man-dies-in-one-vehicle-crash-in-heidleberg-township-york-county/29472605,UPDATE: Coroner identifies man who died in one-vehicle crash,"https://kubrick.htvapps.com/vidthumb/9f97540d-362a-4d45-8b2f-9a001b66af14/9f97540d-362a-4d45-8b2f-9a001b66af14_image.jpg?crop=1xw:1.0xh;center,top&resize=1200:*","The crash happened around 11 p.m. Monday in Heidleberg Township, York County, according to the coroner."
58,,,,,,
59,https://chargedaffairs.org/phones-and-force-the-geostrategy-of-smartphones-in-an-era-of-us-chinese-competition/,Charged Affairs,https://chargedaffairs.org/phones-and-force-the-geostrategy-of-smartphones-in-an-era-of-us-chinese-competition/,Phones and Force: The Geostrategy of Smartphones in an Era of US-Chinese Competition - Charged Affairs,https://chargedaffairs.org/wp-content/uploads/2019/10/building-burj-khalifa-city-47423-e1571019612485-1024x512.jpg,"Smartphones will gain geostrategic significance. The Gulf States, through Apple and Huawei, have aligned with the United States and China, respectively. Their strategic importance makes them noteworthy test cases in the rising geostrategic significance of supply chains."
