,source_url,site_name,site_url,title,img_url,description
58,https://www.limerickleader.ie/news/home/209902/limerick-council-accused-of--jumping.html,,https://www.limerickleader.ie/news/home/209902/limerick-council-accused-of--jumping.html,Limerick council accused of 'jumping gun' on footbridge,https://www.limerickleader.ie/resizer/600/315/true/GN4_DAT_7022381.jpg--limerick_council_accused_of__jumping_gun__on_footbridge.jpg,Long-awaited plans for €16m project to be presented to council members this Thursday
59,https://www.ripplesnigeria.com/agf-says-nigeria-saves-over-n250bn-from-ippis-as-senate-rejects-budget-of-ndelta-ministry/,Latest Nigeria News | Top Stories from Ripples Nigeria,https://www.ripplesnigeria.com/agf-says-nigeria-saves-over-n250bn-from-ippis-as-senate-rejects-budget-of-ndelta-ministry/,AGF says Nigeria saves over N250bn from IPPIS as Senate rejects budget of N’Delta ministry | Ripples Nigeria,https://www.ripplesnigeria.com/wp-content/uploads/2019/10/sad-Akpabio.jpg,"According to the Accountant-General of the Federation, Ahmed Idris, Nigeria has saved over N250 billion in 3 years due to the implementation of the |"
60,https://www.ctvnews.ca/world/ecuador-crisis-weakens-president-strengthens-indigenous-1.4637366,CTVNews,https://www.ctvnews.ca/world/ecuador-crisis-weakens-president-strengthens-indigenous-1.4637366,"Ecuador crisis weakens president, strengthens indigenous",https://www.ctvnews.ca/polopoly_fs/1.4637368.1571052059!/httpImage/image.jpg_gen/derivatives/landscape_620/image.jpg,"Thousands of indigenous demonstrators, student volunteers and local residents launched a mass cleanup Monday of a Quito park where anti-austerity protesters fought police for days, leaving piles of burning tires, trees and construction material."
61,https://ph.news.yahoo.com/4-suspects-mall-robbery-killed-162200236.html,,https://ph.news.yahoo.com/4-suspects-mall-robbery-killed-162200236.html,"4 suspects in mall robbery killed, 1 wounded",https://s.yimg.com/uu/api/res/1.2/vZmKrmGyfZIW9lju8jJjDA--~B/aD01NTI7dz04MDA7c209MTthcHBpZD15dGFjaHlvbg--/https://media.zenfs.com/en/sunstar_ph_3/29b30b6df5b0d95555b160e226c92c1b,"FOUR of nine men nabbed for robbing three jewelry shops, a money changer and a pawnshop in a mall in Mandaue City Saturday have been killed in an operation in Bogo City in northern Cebu, while one has"
62,https://thestandard.org.nz/the-fast-death-of-broadcast-free-to-air-tv/,The Standard,https://thestandard.org.nz/the-fast-death-of-broadcast-free-to-air-tv/,The fast death of broadcast free to air TV,https://cdn.thestandard.org.nz/wp-content/uploads/2019/10/tv-off-line.jpg?x77751,"That free-to-air TV are getting creamed doesn’t surprise me. TV3 is essentially being given away (or closed). Blame the broadcast model, the pain of noisy advertising and the rush to bottom i…"
63,https://www.nbcnewyork.com/news/politics/timeline-trump-ukraine-biden/1827849/,NBC New York,https://www.nbcnewyork.com/news/politics/timeline-trump-ukraine-biden/1827849/,Trump Impeachment Timeline: Senate Trial Begins,https://media.nbcnewyork.com/2019/09/AP_19352587154111.jpg?resize=1200%2C675,"The Senate trial into whether President Donald Trump should be removed from office over his attempts to pressure Ukraine into investigating his main political rival, former Vice President Joe Biden, has begun."
64,http://brooklyn.news12.com/story/8945/our-apologies,,http://brooklyn.news12.com/story/8945/our-apologies,Our Apologies,,
65,https://muscatinejournal.com/news/state-and-regional/govt-and-politics/democratic-voters-eye-candidates-not-impeachment/article_d9ab8c34-074d-514a-bd8e-c3f7380acca1.html,Muscatine Journal,https://muscatinejournal.com/news/state-and-regional/govt-and-politics/democratic-voters-eye-candidates-not-impeachment/article_d9ab8c34-074d-514a-bd8e-c3f7380acca1.html,404 Error,,This page no longer exists or has been removed
66,https://www.business-standard.com/article/news-ani/maharashtra-3-dead-16-injured-in-bus-accident-on-mumbai-pune-expressway-119102100993_1.html,,https://www.business-standard.com/article/news-ani/maharashtra-3-dead-16-injured-in-bus-accident-on-mumbai-pune-expressway-119102100993_1.html,Maharashtra: 3 dead 16 injured in bus accident on Mumbai-Pune expressway,https://bsmedia.business-standard.com/_media/bs/img/article/default/1191021/full-119102100993.jpg,Three people lost their lives while 16 others were injured when a private bus carrying 35 persons met with an accident at Mumbai-Pune Expressway in the wee hours of Monday.Police and rescue teams arrived at the accident spot after the incident which
67,https://www.rnz.co.nz/international/pacific-news/401461/indonesia-s-hrc-calls-for-probe-into-west-papuan-riot-deaths,RNZ,https://www.rnz.co.nz/international/pacific-news/401461/indonesia-s-hrc-calls-for-probe-into-west-papuan-riot-deaths,Indonesia's HRC calls for probe into West Papuan riot deaths,https://www.rnz.co.nz/assets/news_crops/88185/eight_col_71381589_2127894017511586_5821831339413864448_n.jpg?1569280854,Indonesia's human rights commission has called for a probe into the deaths of dozens of Papuans in recent violence.
68,https://focustaiwan.tw/cross-strait/201910210022,,https://focustaiwan.tw/cross-strait/201910210022,Shanghai official visits Taipei mayor to promote city-to-city ties - Focus Taiwan,https://imgcdn.cna.com.tw/Eng/WebEngPhotos/1024/2019/20191021/201910210022t0002.jpg,"Taipei, Oct. 21 (CNA) Taipei Mayor Ko Wen-je (柯文哲) met with Li Wenhui (李文輝), the director of Shanghai's Taiwan Affairs Office, in Taipei on Monday to discuss cultural, trade and economic ties between the two cities."
69,https://www.niagara-gazette.com/opinion/piccirillo-city-kids-deserve-a-great-place-to-play/article_9879aa55-bb2a-5660-b173-6ba3eee5cfd0.html,Niagara Gazette,https://www.niagara-gazette.com/opinion/piccirillo-city-kids-deserve-a-great-place-to-play/article_9879aa55-bb2a-5660-b173-6ba3eee5cfd0.html,PICCIRILLO: City kids deserve a great place to play,https://bloximages.chicago2.vip.townnews.com/niagara-gazette.com/content/tncms/assets/v3/editorial/2/aa/2aa51729-e0ca-5001-a877-c3089b7ad65e/5dabd1396358c.image.jpg?resize=377%2C600,"All children benefit from play. Not just in uniforms on a team. Not just if they can walk, run or communicate with other children. Not just if they live in"
70,https://www.timesargus.com/news/world/the-latest-erdogan-aide-meets-with-russia-s-syria-envoy/article_33c022a9-7cf6-51af-8ad5-db2c6216a2c0.html,Times Argus,https://www.timesargus.com/news/world/the-latest-erdogan-aide-meets-with-russia-s-syria-envoy/article_33c022a9-7cf6-51af-8ad5-db2c6216a2c0.html,404 Error,https://bloximages.chicago2.vip.townnews.com/timesargus.com/content/tncms/custom/image/b304aa08-5df8-11e8-b455-b382f4872e89.jpg?resize=600%2C748,This page no longer exists or has been removed
71,https://www.thenational.ae/world/asia/coalition-forces-killed-more-afghan-civilians-at-2010-protest-than-nato-claimed-1.926419,The National,https://www.thenational.ae/world/asia/coalition-forces-killed-more-afghan-civilians-at-2010-protest-than-nato-claimed-1.926419,Coalition forces killed more Afghan civilians at 2010 protest than Nato claimed,https://www.thenational.ae/image/policy:1.926418:1571817336/image.jpg?f=16x9&q=0.6&w=1200&$p$f$q$w=70c86c9,"Rights group says five were shot dead by soldiers who fired on crowd, not one as alliance said"
72,https://qz.com/1732135/kushner-and-mnunchin-will-attend-saudis-davos-in-the-desert/,Quartz,https://qz.com/1732135/kushner-and-mnunchin-will-attend-saudis-davos-in-the-desert/,"Trump admin apparently over Khashoggi killing, will attend Saudi’s ‘Davos in the Desert’",https://cms.qz.com/wp-content/uploads/2019/10/mnuchin-kushner-e1571667863691.jpg?quality=75&strip=all&w=1400,The US skipped last year's event in the wake of the journalist's slaying.
73,,,,,,
74,http://news.trust.org/item/20191021080028-ayv4x/,news.trust.org,http://news.trust.org/item/20191021080028-ayv4x/,U.S. troops cross into Iraq as part of withdrawal from Syria,"https://d2sh4fq2xsdeg9.cloudfront.net/contentAsset/image/075588a8-17ac-4486-a59f-b7fba69f79ee/image/byInode/1/filter/Resize,Jpeg/jpeg_q/70/resize_w/1100","SYRIA-SECURITY/ (TV, PIX):U.S. troops cross into Iraq as part of withdrawal from Syria"
75,https://www.telegraphherald.com/news/national_world/article_683d56b5-e9c4-5c7d-a01f-8cfac6bd0802.html,TelegraphHerald.com,https://www.telegraphherald.com/news/national_world/article_683d56b5-e9c4-5c7d-a01f-8cfac6bd0802.html,World News in Brief,https://bloximages.newyork1.vip.townnews.com/telegraphherald.com/content/tncms/custom/image/646a89a2-fd9d-11e5-9db5-4b01910bfaa0.jpg,Qantas completes longest commercial non-stop flight from New York to Sydney
76,,Explore SE Iowa,,Page not found | Explore SE Iowa,https://www.exploreseiowa.com/wp-content/uploads/2019/09/exploreseiowasocial.jpg,
77,,,,,,
78,https://finance.yahoo.com/news/fallout-trumps-trade-wars-felt-222326390.html,,https://finance.yahoo.com/news/fallout-trumps-trade-wars-felt-222326390.html,Fallout from Trump's trade wars felt by economies around the world,https://s.yimg.com/uu/api/res/1.2/9dR6V0LTmCFXxIILvXLykA--~B/aD00NTU7dz03OTk7c209MTthcHBpZD15dGFjaHlvbg--/https://media.zenfs.com/en-US/reuters.com/c2c21e8fb00bc17a1b1f815f9c73b4cb,The collateral damage of the United States' trade wars is being felt from the fjords of Iceland to the auto factories of Japan.  Central bank governors and finance ministers traded grim tales of suffering economies at the International Monetary Fund and World Bank fall meetings in Washington this
79,https://www.journalnow.com/news/crime/year-old-robbed-killed-man-who-was-found-on-gillespie/article_b1c95fc1-9c8a-5b83-81aa-fa913fc7d1e0.html,Winston-Salem Journal,https://www.journalnow.com/news/crime/year-old-robbed-killed-man-who-was-found-on-gillespie/article_b1c95fc1-9c8a-5b83-81aa-fa913fc7d1e0.html,"19-year-old robbed, killed man who was found on Gillespie Street last week, Greensboro police say",https://bloximages.newyork1.vip.townnews.com/journalnow.com/content/tncms/assets/v3/editorial/9/de/9de7d262-cb4d-5183-ba00-1e11ad6f481a/5dadc9d351710.image.png?crop=458%2C258%2C15%2C152&resize=458%2C258&order=crop%2Cresize,33-year-old Douglas Wheless was found dead beside the road.
80,https://www.arabnews.com/node/1572436/saudi-arabia,Arab News,https://www.arabnews.com/node/1572436/saudi-arabia,Saudi minister hails ‘special relationship’ with Japan,https://www.arabnews.com/sites/default/files/2019/10/22/1809826-1222445163.jpg,"TOKYO: Saudi Arabia has a “special relationship” with Japan, which is “reliable strategic partner and friend” of the Kingdom, the Saudi Minister for Commerce and Investment Majid Al-Qasabi said on Monday. The minister was speaking at the launch in Tokyo of the Japanese-language online edition of Arab News, in the latest stage of its global expansion. The event came on the eve of Tuesday’s ceremonial enthronement of Emperor Naruhito in the Japanese capital. “This is a great opportunity, a moment in history,” Al-Qasabi said."
81,https://www.dailymail.co.uk/news/article-7596103/Police-raid-Indian-call-centres-defrauded-Britons-350-000.html,Mail Online,https://www.dailymail.co.uk/news/article-7596103/Police-raid-Indian-call-centres-defrauded-Britons-350-000.html,"Indian call centres defrauded Britons of at least £350,000",https://i.dailymail.co.uk/1s/2019/10/21/11/19986836-0-image-a-8_1571655148763.jpg,"The raid in Kolkata came as part of a four-year international investigation, carried out by British and Indian police and tech-giant Microsoft, into computer software fraud."
82,https://whdh.com/news/ag-man-charged-in-shooting-at-nh-church-attacked-attorney-during-jailhouse-meeting/,,https://whdh.com/news/ag-man-charged-in-shooting-at-nh-church-attacked-attorney-during-jailhouse-meeting/,AG: Man charged in shooting at NH church attacked attorney during jailhouse meeting,https://sunbeamwhdh.files.wordpress.com/2019/10/191013-dale-holloway.jpg?quality=60&strip=color&w=775,"MANCHESTER, N.H. (WHDH) - A 37-year-old man accused of shooting two people — a bride and a bishop — during a wedding ceremony at a..."
83,https://www.forsythnews.com/local/what-to-know-about-forsyth-countys-namesake-before-his-239th-birthday/,,https://www.forsythnews.com/local/what-to-know-about-forsyth-countys-namesake-before-his-239th-birthday/,What to know about Forsyth County’s namesake before his 239th birthday,https://forsythnews.cdn-anvilcms.net/media/images/2019/10/19/images/JohnForsythSoS11_WEB.max-640x480.jpg,"The namesake of Forsyth County has a big birthday coming up
with this week."
84,https://aawsat.com/english/home/article/1955191/%E2%80%98shell-egypt%E2%80%99-sell-assets-western-desert,Asharq AL-awsat,https://aawsat.com/english/home/article/1955191/%E2%80%98shell-egypt%E2%80%99-sell-assets-western-desert,‘Shell Egypt’ to Sell Assets in Western Desert,https://aawsat.com/sites/default/files/styles/large/public/2019/10/21/shell_0.jpg?itok=8cOF0_jl,"“Shell Egypt” plans to sell its onshore upstream assets in the Western Desert to focus on expanding its offshore gas explorations.
Shell issued a statement, a copy of which was received by Asharq Al-Awsat, saying that it remains committed to Egypt an"
85,https://www.cheatsheet.com/entertainment/are-cory-booker-and-rosario-dawson-still-dating.html/,Showbiz Cheat Sheet,https://www.cheatsheet.com/entertainment/are-cory-booker-and-rosario-dawson-still-dating.html/,Are Cory Booker and Rosario Dawson Still Dating?,https://www.cheatsheet.com/wp-content/uploads/2019/10/rosario-dawson-1024x683.jpg,Cory Booker and Rosario Dawson made headlines when they first started dating. Is the power couple still together?
86,https://www.nyoooz.com/news/kolkata/1410795/kmc-brings-in-provisions-to-send-owners-of-unsafe-buildings-to-jail/,NYOOOZ,https://www.nyoooz.com/news/kolkata/1410795/kmc-brings-in-provisions-to-send-owners-of-unsafe-buildings-to-jail/,KMC brings in provisions to send owners of unsafe buildings to jail | Kolkata NYOOOZ,https://www.nyoooz.com/df-images/kolkata/df-kolkata-3.jpg,
87,https://www.dailymail.co.uk/news/article-7596645/Donald-Trump-berates-House-Democrats-backing-Corrupt-Adam-Schiff.html,Mail Online,https://www.dailymail.co.uk/news/article-7596645/Donald-Trump-berates-House-Democrats-backing-Corrupt-Adam-Schiff.html,Donald Trump berates House Democrats for backing 'Corrupt Adam Schiff',https://i.dailymail.co.uk/1s/2019/10/21/14/19992850-0-image-a-14_1571666088260.jpg,"Donald Trump berated Democrats for their support of Intelligence Committee Chairman Adam Schiff, the man the president has made the target of his fury in the impeachment inquiry."
88,http://www.royalgazette.com/politics/article/20191021/second-councillor-quits-in-st-george,The Royal Gazette,http://www.royalgazette.com/politics/article/20191021/second-councillor-quits-in-st-george,Second councillor quits in St George | The Royal Gazette:Bermuda News,http://www.royalgazette.com/storyimage/RG/20191021/NEWS01/191029982/AR/0/AR-191029982.jpg,"A second councillor in St George has resigned over the leadership style of the town’s mayor.Philip Seaman, a business ratepayers’ councillor for four years, stepped down in part over a decision by George Dowling this summer to open a pedestrianised section of Water Street to traffic without a council vote. Mr Seaman, who said he had considered running for mayor before Mr Dowling put himself forward this year, said: ""Water Street didn’t go to a vote and it contributed to my decision to step"
89,,,,,,
90,https://www.vanguardngr.com/2019/10/lagos-state-govt-re-arraigns-two-doctors-over-alleged-attempted-murder/,Vanguard News,https://www.vanguardngr.com/2019/10/lagos-state-govt-re-arraigns-two-doctors-over-alleged-attempted-murder/,"Lagos State Govt, re- arraigns two doctors over alleged attempted murder",https://i2.wp.com/www.vanguardngr.com/wp-content/uploads/2019/10/Court.jpg?fit=700%2C400&ssl=1,"Nigeria News: Two Medical doctors, a husband, and wife were yesterday re-arraigned by the Lagos State government before a Lagos High Court..."
91,https://goodmenproject.com/ethics-values/church-atrocities-receded-in-europe-because-of-the-enlightenment/,The Good Men Project,https://goodmenproject.com/ethics-values/church-atrocities-receded-in-europe-because-of-the-enlightenment/,Church Atrocities Receded in Europe Because of the Enlightenment - The Good Men Project,https://goodmenproject.com/wp-content/uploads/2019/09/church.jpg,"During the 1700s, religion’s throttlehold upon Europe slowly loosened. Religious killing still occurred, but with decreasing frequency."
92,https://starofmysore.com/dialogue-with-divinity/,Star of Mysore,https://starofmysore.com/dialogue-with-divinity/,Dialogue with Divinity - Star of Mysore,https://starofmysore.com/wp-content/uploads/2019/10/divinity.jpg,Not believing in the existence of God as super power concerned with fates and actions of human beings (or even other life forms such as animals) and outright rejection of the belief that any deities exist are diverse views on God per se that may not be within the grasp of lay people while Philosophers...
93,,,,,,
94,,,,,,
95,https://www.northernstar.com.au/news/remarkable-swim-patterns-of-hobarts-penguins/3858817/,Northern Star,https://www.northernstar.com.au/news/remarkable-swim-patterns-of-hobarts-penguins/3858817/,Remarkable swim patterns of Hobart’s penguins,https://media.apnarm.net.au/media/images/2019/10/20/v3imagesbinfd6bfef81e5b9e60914cdc384af50b62-jctib586iiinozvk6t2_ct1880x930.jpg,The sea adventures of little penguins in and around Hobart has been scrutinised as part of a world-first study.
96,https://www.statnews.com/2019/10/21/new-crispr-tool-has-potential-to-correct-most-disease-causing-dna-glitches/,STAT,https://www.statnews.com/2019/10/21/new-crispr-tool-has-potential-to-correct-most-disease-causing-dna-glitches/,New CRISPR tool could fix almost all disease-causing DNA glitches - STAT,https://www.statnews.com/wp-content/uploads/2019/10/AdobeStock_154392349-1024x576.jpeg,The tool can precisely change any of DNA’s “letters” into any other and insert or delete any stretch of DNA — all more efficiently than previous CRISPR.
97,http://www.thenorthlines.com/will-dismantle-terror-camps-inside-pok-if-pakistan-doesnt-mend-ways-jk-governor/,Northlines,http://www.thenorthlines.com/will-dismantle-terror-camps-inside-pok-if-pakistan-doesnt-mend-ways-jk-governor/,Will dismantle terror camps inside POK if Pakistan doesn't mend ways: JK Governor - Northlines,http://www.thenorthlines.com/wp-content/uploads/2019/10/GOVERNOR-21-2.jpg,"Pays rich tributes to martyrs NL Correspondent Srinagar, Oct 21 Jammu and Kashmir Governor Satya Pal Malik on Monday said India will dismantle terrorist infrastructures inside Pakistan Occupied Kashmir (POK) if the terrorism emanating from the neighbouring country’s soil is not dealt with. “We will dismantle terrorist camps and if they still don’t mend their …"
98,,,,,,
99,,,,How a team of caregivers tamed a mysterious disease,https://crosscut.com/sites/default/files/images/sponsored-content/bella-4.jpg,"With a care plan in place, a Seattle teen is finally able to fulfill her dreams."
100,https://www.news.com.au/world/asia/australian-man-killed-in-philippines-shooting-another-arrested/news-story/64b9d53f7f5d53ab2a76be795b13d21f,NewsComAu,https://www.news.com.au/world/asia/australian-man-killed-in-philippines-shooting-another-arrested/news-story/64b9d53f7f5d53ab2a76be795b13d21f,Aussie killed in Philippines shooting,https://cdn.newsapi.com.au/image/v1/c460a793d3182ad155059df63c396e19?width=650,An Australian man has been arrested in the Philippines following a shooting that left another Australian man and a Filipino woman dead.
101,,,,,,
102,,,,,,
103,https://www.irishtimes.com/business/construction/adamstown-developer-in-row-over-land-with-horse-breeder-1.4057984,The Irish Times,https://www.irishtimes.com/business/construction/adamstown-developer-in-row-over-land-with-horse-breeder-1.4057984,Adamstown developer in row over land with horse breeder,https://www.irishtimes.com/image-creator/?id=1.4057982&origw=1440,Adverse posession of Dodsboro property since 2004 claimed
104,https://www.hindustantimes.com/india-news/india-says-it-is-disappointed-as-pakistan-insists-on-service-fee-of-20-per-kartapur-pilgrim/story-gJt9XnK1xDqIozdOw7aPoI.html,Hindustan Times,https://www.hindustantimes.com/india-news/india-says-it-is-disappointed-as-pakistan-insists-on-service-fee-of-20-per-kartapur-pilgrim/story-gJt9XnK1xDqIozdOw7aPoI.html,‘Disappointed at $20 fee’: India to sign Kartarpur corridor pact on Wednesday,https://www.hindustantimes.com/rf/image_size_960x540/HT/p2/2019/10/21/Pictures/pakistan-kartarpur-construction-pakistan-saturday-pilgrims-kartarpur_3da4d436-f3ed-11e9-800c-f2f87dfa36aa.jpg,People familiar with developments described the service fee as the “only sticking point” in the launch of the corridor that will link Dera Baba Nanak in India’s Gurdaspur to Darbar Sahib gurdwara in Pakistan’s Kartarpur.
105,,,,,,
106,https://news.am/eng/news/540004.html,,https://news.am/eng/news/540004.html,Armenian Defense Minister leaves for China,https://news.am/img/news/54/00/04/default.jpg,
107,https://wtop.com/world/2019/10/turkey-warns-kurdish-forces-to-withdraw-ahead-of-deadline/,WTOP,https://wtop.com/world/2019/10/turkey-warns-kurdish-forces-to-withdraw-ahead-of-deadline/,‘America is running away’: Syrian withdrawal turns chaotic | WTOP,https://wtop.com/wp-content/uploads/2019/10/CORRECTION_Turkey_US_Syria_11403.jpg,"Angry over the U.S. withdrawal from Syria, residents of a Kurdish-dominated city pelted departing American military vehicles with potatoes Monday as they drove through."
108,https://www.pinknews.co.uk/2019/10/21/new-zealand-navy-makeup-gender-nail-varnish-gender-neutral-guidelines/,"PinkNews - Gay news, reviews and comment from the world's most read lesbian, gay, bisexual, and trans news service",https://www.pinknews.co.uk/2019/10/21/new-zealand-navy-makeup-gender-nail-varnish-gender-neutral-guidelines/,"All Navy personnel in New Zealand can now wear makeup, regardless of gender",https://s31242.pcdn.co/wp-content/uploads/2019/10/GettyImages-1154238900-1024x683.jpg,"The Royal New Zealand Navy has announced that its personnel will now be able to wear makeup and nail varnish, regardless of gender. "
109,https://www.bbc.com/news/uk-england-devon-50125313,BBC News,https://www.bbc.com/news/uk-england-devon-50125313,MP 'wants to talk' to graffiti attacker,https://ichef.bbci.co.uk/news/1024/branded_news/10B9F/production/_109311586_graffiti-21.10-800x0-c-default.jpg,"Labour's Luke Pollard says the best way to deal with hate and abuse ""is to build bridges not walls""."
110,https://www.forbes.com/sites/isabeltogoh/2019/10/21/jeffrey-epstein-had-13-different-contact-numbers-for-former-friend-prince-andrew/,Forbes,https://www.forbes.com/sites/isabeltogoh/2019/10/21/jeffrey-epstein-had-13-different-contact-numbers-for-former-friend-prince-andrew/,Jeffrey Epstein Had 13 Different Numbers For Former Friend Prince Andrew,https://thumbor.forbes.com/thumbor/600x315/https%3A%2F%2Fspecials-images.forbesimg.com%2Fimageserve%2F109823159%2F960x0.jpg,"A U.K. documentary detailing the 12-year friendship between the senior royal and the sex offender shows the extent of their encounters both in the U.S., the U.K. and on Epstein's private island."
111,,Malden Observer,,Sierra Club endorses Amanda Linehan,https://malden.wickedlocal.com/Global/images/head/nameplate/malden_logo.png,The Massachusetts Sierra Club recently announced its endorsement of Amanda Linehan for the Ward 3 seat on the Malden City Council. Amanda Linehan is a
112,https://etcanada.com/news/527348/prince-william-is-worried-about-prince-harry-after-his-and-meghan-markles-comments-about-negative-press-attention-in-documentary/,ET Canada,https://etcanada.com/news/527348/prince-william-is-worried-about-prince-harry-after-his-and-meghan-markles-comments-about-negative-press-attention-in-documentary/,Prince William Is ‘Worried’ About Prince Harry After His And Meghan Markle’s Comments About Negative Press Attention In Documentary,https://shawetcanada.files.wordpress.com/2019/10/gettyimages-1051839484.jpg?quality=80&strip=all&w=720&h=480&crop=1,"Prince William is reportedly ""worried"" about Prince Harry after his South Africa tour documentary aired in the UK on Sunday. The Kensington Palace source told the BBC William hoped Harry and Meghan ""are alright"" after both made comments about their mental health during the interview with ITV's Tom Bradby. RELATED: Prince Harry Won’t Deny Rumours…"
113,https://www.marketbeat.com/stocks/NYSE/USB/,,https://www.marketbeat.com/stocks/NYSE/USB/,"USB Stock Price, Forecast & News (U.S. Bancorp)",https://www.marketbeat.com/logos/USBankCorps_Logo.png,"Researching U.S. Bancorp (NYSE:USB) stock? View USB's stock price, price target, dividend, earnings, financials, forecast, insider trades, news, and SEC filings at MarketBeat."
114,,,,,,
115,https://www.winnipegfreepress.com/canada/mafia-link-suspected-after-man-gunned-down-in-montreal-parking-lot-563567402.html,,https://www.winnipegfreepress.com/canada/mafia-link-suspected-after-man-gunned-down-in-montreal-parking-lot-563567402.html,Mafia link suspected in Montreal killing,https://media.winnipegfreepress.com/images/RYR10225326.jpg,"MONTREAL - Police in Montreal say a man was gunned down Monday outside a business in the city's west end in a slaying that appears to be linked to organized crime.
Officials didn't immediately confirm the victim's identity, but several media reports citing police sources said it was Andrea ""Andrew"" Scoppa, an influential figure in the Montreal Mafia whose brother was killed earlier this year."
