,source_url,site_name,site_url,title,img_url,description
122,https://www.rantoulpress.com/news/deceased-woman-thought-to-have-had-midwest-origins/article_94867fdc-fb92-11e9-abd5-d7d0910aee35.html,Rantoul Press,https://www.rantoulpress.com/news/deceased-woman-thought-to-have-had-midwest-origins/article_94867fdc-fb92-11e9-abd5-d7d0910aee35.html,Deceased woman thought to have had Midwest origins,https://bloximages.newyork1.vip.townnews.com/rantoulpress.com/content/tncms/assets/v3/editorial/1/6f/16fb2dd0-fc17-11e9-ae04-5b236cd7b918/5dbb3a470d1b7.image.jpg?resize=472%2C630,"URBANA — It’s been 24 years since a man who was about to spray some weeds in a farm ditch southwest of Thomasboro found a human bone and clothing, which"
123,https://www.freepressjournal.in/india/kamlesh-tiwari-murder-case-one-more-suspect-arrested-for-helping-the-others-escape,Free Press Journal,https://www.freepressjournal.in/india/kamlesh-tiwari-murder-case-one-more-suspect-arrested-for-helping-the-others-escape,Kamlesh Tiwari murder case: One more suspect arrested for helping the others escape,https://gumlet.assettype.com/freepressjournal%2F2019-10%2F63a0fd4f-4628-4b70-93e8-e0689fec02f3%2FGujarat_ATS_arrests_both_accuses_of_the_murder_of_Hindu_Samaj_Party_leader_Kamlesh_Tiwari_on_the_bas.jpg?w=1200&auto=format%2Ccompress&ogImage=true,
124,https://en.tempo.co/read/1266611/luhut-asks-kpk-to-monitor-nickel-policies-downstream,Tempo,https://en.tempo.co/read/1266611/luhut-asks-kpk-to-monitor-nickel-policies-downstream,Luhut Asks KPK to Monitor Nickel Policies Downstream,https://statik.tempo.co/data/2019/10/23/id_882961/882961_720.jpg,The Corruption Eradication Commission (KPK) is reviewing nickel production policies in the downstream sector
125,,,,,,
126,,,,,,
127,,,,,,
128,,,,,,
129,https://www.marketbeat.com/stocks/NYSE/WMK/,,https://www.marketbeat.com/stocks/NYSE/WMK/,"WMK Stock Price, Forecast & News (Weis Markets)",https://www.marketbeat.com/logos/weis-markets-inc-logo.jpg,"Researching Weis Markets (NYSE:WMK) stock? View WMK's stock price, price target, dividend, earnings, financials, forecast, insider trades, news, and SEC filings at MarketBeat."
130,https://www.thedenverchannel.com/news/national/child-rapist-arrested-in-kentucky-after-mistaken-release-from-georgia-prison,KMGH,https://www.thedenverchannel.com/news/national/child-rapist-arrested-in-kentucky-after-mistaken-release-from-georgia-prison,Child rapist arrested in Kentucky after mistaken release,https://ewscripps.brightspotcdn.com/dims4/default/84af8dd/2147483647/strip/true/crop/1600x840+0+30/resize/1200x630!/quality/90/?url=https%3A%2F%2Fewscripps.brightspotcdn.com%2Fc1%2F6d%2F00d0421e4162bb5706c18a96a498%2Fs116310634.JPG,A man mistakenly released from a Georgia prison while serving three life sentences for sexual abuse of children was arrested Wednesday night in Fort Thomas.
131,https://ph.news.yahoo.com/cebu-city-police-chief-relieved-140021593.html,,https://ph.news.yahoo.com/cebu-city-police-chief-relieved-140021593.html,Cebu City police chief relieved from post amid probe on Clarin mayor slay,https://s.yimg.com/uu/api/res/1.2/57s3Xhko4VKlS4vqTSL9vg--~B/aD00Mjc7dz02NDA7c209MTthcHBpZD15dGFjaHlvbg--/https://media.zenfs.com/en-US/untv_news_969/5fb01c540769020fd38641ecc22f1f50,"MANILA, Philippines – Chief of Cebu City Police Col. Gemma Vinluan has been relieved from her post amid the probe on the murder of Clarin, Misamis Occidental Mayor David Navarro. In a statement Thursday, Central Visayas police director Brig. Gen. Valeriano de Leon said Vinluan was “administratively relieved"
132,,,,,,
133,,,,,,
134,https://www.ndtv.com/india-news/us-slams-china-over-dalai-lama-tibets-religious-freedom-praises-india-2125397,NDTV.com,https://www.ndtv.com/india-news/us-slams-china-over-dalai-lama-tibets-religious-freedom-praises-india-2125397,"US Slams China Over Dalai Lama, Tibet's Religious Freedom, Praises India",https://c.ndtvimg.com/2019-07/l6lir50g_dalai-lama-afp_625x300_02_July_19.jpg,"The US has appreciated India's ""extraordinary generosity"" for supporting the Tibetan people's religious freedom while rejecting as ""meritless"" China's claim that the Dalai Lama's succession must comply with Chinese laws and regulations."
135,http://www.kake.com/story/41252778/kansas-lawmakers-could-be-one-step-closer-to-legalizing-medical-marijuana,,http://www.kake.com/story/41252778/kansas-lawmakers-could-be-one-step-closer-to-legalizing-medical-marijuana,Kansas lawmakers could be one step closer to legalizing medical marijuana,https://KAKE.images.worldnow.com/images/18899769_G.jpg?lastEditedDate=20191030233336,"""They'll pass something this year. I'm almost 100% confident,"" says Mike Webb, part owner of a Haysville CBD store.   Webb says he's grateful the Kansas legislature will consider legalizing medical..."
136,https://www.brisbanetimes.com.au/national/queensland/leaked-queensland-health-email-reveals-order-to-halt-it-upgrades-during-parliament-20191031-p5367x.html,Brisbane Times,https://www.brisbanetimes.com.au/national/queensland/leaked-queensland-health-email-reveals-order-to-halt-it-upgrades-during-parliament-20191031-p5367x.html,Leaked Queensland Health email reveals order to halt IT upgrades during Parliament,https://static.ffx.io/images/$zoom_2.2558555555555557%2C$multiply_0.7554%2C$ratio_1.776846%2C$width_1059%2C$x_12%2C$y_1/t_crop_custom/q_86%2Cf_auto/f0a890aada99b66d76fb8ea87b697f3310b83bbc,"Health Minister Steven Miles has denied he had any knowledge of the order, which was issued through an internal government email."
137,https://www.dailymail.co.uk/news/article-7633829/Australian-student-jailed-member-Islamic-State-conviction-quashed.html,Mail Online,https://www.dailymail.co.uk/news/article-7633829/Australian-student-jailed-member-Islamic-State-conviction-quashed.html,Woman jailed for being Islamic State member has conviction quashed,https://i.dailymail.co.uk/1s/2019/10/31/06/20412736-0-image-a-2_1572504314472.jpg,An Australian student convicted of being a member of the Islamic State terror group has had her guilty verdict overturned on appeal.
138,https://www.foxnews.com/media/will-democrats-impeach-trump-impeachment,Fox News,https://www.foxnews.com/media/will-democrats-impeach-trump-impeachment,'Malpractice' to assume Democrats will vote to impeach Trump: Former top Hillary Clinton adviser,https://static.foxnews.com/foxnews.com/content/uploads/2018/10/Antjuan_Seawright-e1540563649390.jpg,"The average American Middle-Class voters does not care about impeaching President Donald Trump, according to the former top adviser to Hillary Clinton's presidential campaign in the key state of South Carolina."
139,https://www.woodwardnews.net/news/alva-teen-charged-with-first-degree-rape/article_394d6102-fbed-11e9-b15b-a7633511798c.html,Woodward News,https://www.woodwardnews.net/news/alva-teen-charged-with-first-degree-rape/article_394d6102-fbed-11e9-b15b-a7633511798c.html,Alva teen charged with first degree rape,https://bloximages.chicago2.vip.townnews.com/woodwardnews.net/content/tncms/custom/image/7d33d5b8-c398-11e5-a750-1b8c552cdc64.jpg,"A teen from Alva has been charged with first degree rape.Donald Brian Blalock, 16, of Alva, has been charged in case YO-2019-1 as a youthful offender. Oklahoma’s Youthful Offender Act"
140,,,,,,
141,http://www.tiogapublishing.com/potter_leader_enterprise/carl-e-hyde-to-be-honored-on-veterans-day/article_60d145a5-5eef-5a58-bf42-5d862ca6c5e4.html,TiogaPublishing.com,http://www.tiogapublishing.com/potter_leader_enterprise/carl-e-hyde-to-be-honored-on-veterans-day/article_60d145a5-5eef-5a58-bf42-5d862ca6c5e4.html,Carl E. Hyde to be honored on Veterans Day,https://bloximages.chicago2.vip.townnews.com/tiogapublishing.com/content/tncms/assets/v3/editorial/6/0d/60d145a5-5eef-5a58-bf42-5d862ca6c5e4/5dbaf85a11299.preview.jpg?crop=939%2C687%2C6%2C53&resize=861%2C630&order=crop%2Cresize,"ULYSSES — A ceremony to honor Pvt. Carl E. Hyde, of Ulysses, who has been missing in action since 1941 is planned for 1 p.m. on Monday, Nov. 11 —"
142,https://www.vanguardngr.com/2019/10/fight-against-internet-fraud-magu-says-mompha-lebanese-associates-arrests-landmark-achievement/,Vanguard News,https://www.vanguardngr.com/2019/10/fight-against-internet-fraud-magu-says-mompha-lebanese-associates-arrests-landmark-achievement/,"Fight against Internet Fraud: Magu  says, Mompha, Lebanese associate’s",https://i0.wp.com/www.vanguardngr.com/wp-content/uploads/2019/10/magu3.jpg?fit=600%2C380&ssl=1,"The Acting Chairman of the Economic and Financial Crimes Commission, EFCC, Ibrahim Magu, has described the recent arrest of an internet fraudster, Ismaila"
143,https://countercurrents.org/2019/10/how-the-u-s-regime-justifies-the-theft-of-syrias-oil,Countercurrents,https://countercurrents.org/2019/10/how-the-u-s-regime-justifies-the-theft-of-syrias-oil,How the U.S. Regime ‘Justifies’ the Theft of Syria’s Oil – Countercurrents,https://countercurrents.org/wp-content/uploads/2019/10/us-troops-1.jpg,"Only starting on 28 October 2019 — after seven years of the U.S. and its allies stealing Syria’s oil — did U.S. ‘news’-media start  to apply the word “theft” or “steal” (or any equivalent term) to what was happening to Syria’s oil; and, even then, the blame for stealing it was focused only against U.S. President Donald Trump, who was[Read More...]"
144,https://www.ndtv.com/world-news/in-mexico-el-chapos-sons-add-brash-new-chapter-to-crime-family-2125466,NDTV.com,https://www.ndtv.com/world-news/in-mexico-el-chapos-sons-add-brash-new-chapter-to-crime-family-2125466,"In Mexico, El Chapo's Sons Add Brash New Chapter To Crime Family",https://c.ndtvimg.com/2019-10/sa0j98c8_elchaposons650_625x300_31_October_19.jpg,"The mug shot-style photo of Ovidio Guzman that appeared as he was apprehended oozed defiance. Chin jutting out, eyes trained on the camera, the handsome youth bore a strong resemblance to his infamous father, jailed drug lord Joaquin ""El Chapo"" Guzman."
145,https://www.reuters.com/article/us-bausch-health-valeant-decision-idUSKBN1XA21Y,U.S.,https://www.reuters.com/article/us-bausch-health-valeant-decision-idUSKBN1XA21Y,"Convictions of ex-Valeant and Philidor executives are upheld, payouts reduced",https://s2.reutersmedia.net/resources/r/?m=02&d=20191031&t=2&i=1446963087&w=1200&r=LYNXMPEF9U1BB,A U.S. appeals court on Thursday upheld the convictions of two drug industry exe...
146,,,,WeWork's ex-CEO faces pregnancy discrimination complaint,,A former top aide to WeWork co-founder Adam Neumann is accusing him and other executives of discriminating against her for becoming pregnant.
147,,,,,,
148,http://www.koreatimes.co.kr/www/world/2020/01/684_277953.html,koreatimes,http://www.koreatimes.co.kr/www/world/2020/01/684_277953.html,"Colonel testifies he raised concerns about Ukraine, Trump ",https://ston.koreatimes.co.kr/web/IMAGE/upload/newsV2/images/201910/5f749d7a0d05460a8b6bf0961d1f9239.jpg,"Colonel testifies he raised concerns about Ukraine, Trump "
149,https://www.thestar.com.my/news/world/2019/10/31/rape-trial-woman-tells-jury-she-trusted-actor-gao-yunxiang-because-he-was-married,The Star Online,https://www.thestar.com.my/news/world/2019/10/31/rape-trial-woman-tells-jury-she-trusted-actor-gao-yunxiang-because-he-was-married,Rape trial: Woman tells jury she trusted actor Gao Yunxiang because he was married,https://apicms.thestar.com.my/uploads/images/2019/10/31/359218.jpg,SYDNEY (ANN): The woman said her fear of being alone in a hotel room with a man she did not know well was momentarily banished when another man - Chinese actor Gao Yunxiang - turned up.
150,https://www.news.com.au/world/australia-calls-out-china-for-its-horrifying-persecution-of-minorities-but-the-world-isnt-listening/news-story/b194d55edea1a863d57c5c08d17b5fbf,NewsComAu,https://www.news.com.au/world/australia-calls-out-china-for-its-horrifying-persecution-of-minorities-but-the-world-isnt-listening/news-story/b194d55edea1a863d57c5c08d17b5fbf,Australia joins 22 other nations to condemn China’s horrifying crimes,https://cdn.newsapi.com.au/image/v1/9cc10ab3fe3cdca5732da02a6a3a2eb7?width=650, WARNING: Disturbing content 
151,https://www.voanews.com/usa/impeachment-inquiry/house-speaker-expects-public-impeachment-hearings-november,Voice of America,https://www.voanews.com/usa/impeachment-inquiry/house-speaker-expects-public-impeachment-hearings-november,House Speaker Expects Public Impeachment Hearings in November,https://media.voltron.voanews.com/Drupal/01live-166/2019-10/RTS2TOJ6.jpg,U.S.
152,https://sputniknews.com/europe/201910311077185807-johnsons-brexit-deal-to-cost-every-uk-citizen-over-1400-annually---report/,,https://sputniknews.com/europe/201910311077185807-johnsons-brexit-deal-to-cost-every-uk-citizen-over-1400-annually---report/,"Johnson’s Brexit Deal to Cost Every UK Citizen Over $1,400 Annually - Report",https://cdn4.img.sputniknews.com/images/107808/26/1078082690.jpg,"MOSCOW (Sputnik) – The Brexit deal, negotiated by UK Prime Minister Boris Johnson, would cost the country 70 billion pounds (more than $90 billion) annually in comparison to continued EU membership, which is around 1,100 pounds of annual losses per person, the UK National Institute of Economic and Social Research (NIESR) said."
153,https://www.breitbart.com/crime/2019/10/30/florida-man-arrested-for-allegedly-spitting-on-maga-hat-wearing-trump-supporter/,Breitbart,https://www.breitbart.com/crime/2019/10/30/florida-man-arrested-for-allegedly-spitting-on-maga-hat-wearing-trump-supporter/,Florida Man Arrested for Allegedly Spitting on Trump Supporter,https://media.breitbart.com/media/2019/10/Matthias-Ajple-1-640x335.jpg,"A Florida man is accused of spitting on a man wearing a ""Make America Great Again"" (MAGA) hat in a Vero Beach restaurant on Friday evening."
154,http://www.uscannenbergmedia.com/2019/10/30/arizona-and-the-canyons-devotion-in-the-landscape/,Arc Publishing,http://www.uscannenbergmedia.com/2019/10/30/arizona-and-the-canyons-devotion-in-the-landscape/,The Devotion Diaries: Arizona and the canyons,http://www.uscannenbergmedia.com/resizer/NnJa1apMXeo1tCgyQhNPIW4jItk=/1200x0/filters:quality(100)/arc-anglerfish-arc2-prod-uscannenberg.s3.amazonaws.com/public/CAZKUKQ4N5DRXN5GOYYE6PE6HY.JPG,The Grand Canyon has provided a sacred space of worship and reflection for both Indigenous communities and tourists for centuries.
155,http://www.nigerianeye.com/2019/10/mompha-lebanese-associates-arrests-big.html,Nigerian News. Latest Nigeria News. Your online Nigerian Newspaper.,http://www.nigerianeye.com/2019/10/mompha-lebanese-associates-arrests-big.html,"Mompha, Lebanese associate’s arrests big achievement – EFCC Chairman, Magu",https://1.bp.blogspot.com/-EZ5FAyzAlb8/XbtFH5hX8yI/AAAAAAAAt8U/aMFXB1qvw0cbR6XNNKHgDVZvtd0gqEIPwCLcBGAsYHQ/w1200-h630-p-k-no-nu/mompha.PNG,"NigerianEye is a Nigerian Online NewsPaper and Breaking News Source.
NIGERIA NEWS ★ TOP NIGERIAN Newspapers ★ Top news headlines from Nigeria."
156,https://www.washingtoninstitute.org/policy-analysis/view/irans-nuclear-steps-and-the-new-iaea-chief,,https://www.washingtoninstitute.org/policy-analysis/view/irans-nuclear-steps-and-the-new-iaea-chief,Iran’s Nuclear Steps and the New IAEA Chief  ,http://www.washingtoninstitute.org/images/sized/uploads/Images/Feature/ReutersPerpetual/IAEAGenevaFlagRTS16PNY-400x400.jpg,The steady weakening by Tehran of its international nuclear commitments will be the most immediate challenge for the next head of the world’s nuclear watchdog.
157,http://www.dhakacourier.com.bd/news/Global/Nature-based-Solutions:-Our-potential-response-to-Climate-Change/1825,http://dhakacourier.com.bd/,http://www.dhakacourier.com.bd/news/Global/Nature-based-Solutions:-Our-potential-response-to-Climate-Change/1825, Nature-based Solutions: Our potential response to Climate Change ,/news/ckl6uMfs30qhcjjV5L8x0CLNh8PGZJdmui29Of56.jpeg,
158,https://www.smh.com.au/national/monaco-rich-listers-plead-guilty-to-bribery-corruption-after-media-exposure-20191031-p5362m.html,The Sydney Morning Herald,https://www.smh.com.au/national/monaco-rich-listers-plead-guilty-to-bribery-corruption-after-media-exposure-20191031-p5362m.html,"Monaco rich-listers plead guilty to bribery, corruption after media exposure",https://static.ffx.io/images/$zoom_1%2C$multiply_0.7554%2C$ratio_1.777778%2C$width_1059%2C$x_44%2C$y_0/t_crop_custom/q_86%2Cf_auto/8e48f72543e9ceb2df7be0206ef653d7ce55dc16,The Age and The Sydney Morning Herald faced down a legal and public relations campaign to reveal that dozens of blue-chip companies used Unaoil to corruptly win oil contracts.
159,https://www.cairnspost.com.au/body-of-missing-backpacker-amelia-bambridge-found-at-sea-police-say/news-story/a59153f4c6e64890a9f79d51de64ad44,,https://www.cairnspost.com.au/body-of-missing-backpacker-amelia-bambridge-found-at-sea-police-say/news-story/a59153f4c6e64890a9f79d51de64ad44,Brother’s heartbreak after body found,https://cdn.newsapi.com.au/image/v1/1ce9cc0932719534d518507842eb845f,"The body of a 21-year-old British backpacker has been found floating at sea more than a week after she went missing from a Cambodian island, police say. "
160,https://www.straitstimes.com/asia/east-asia/hong-kong-protesters-defy-face-mask-ban-in-halloween-march,The Straits Times,https://www.straitstimes.com/asia/east-asia/hong-kong-protesters-defy-face-mask-ban-in-halloween-march,Police fire tear gas as Hong Kong protesters defy face mask ban in Halloween march,https://www.straitstimes.com/sites/default/files/media-youtube/jWgykoEVQ-0.jpg,"Pro-democracy activists turned out for a Halloween-themed march, wearing face masks of political leaders in defiance of a ban on face masks in the city.. Read more at straitstimes.com."
161,https://infotel.ca/newsitem/as-afghanistan-cia-trained-force/cp613714777,,https://infotel.ca/newsitem/as-afghanistan-cia-trained-force/cp613714777,Report says CIA-trained Afghan forces behind war atrocities,,"ISLAMABAD - Heavily armed men burst into the home in the middle of night, hustling four brothers into separate rooms, their hands bound. Afghan special forc"
162,https://timesofindia.indiatimes.com/india/hp-cm-says-boundary-dispute-with-ladakh-would-be-resolved-soon/articleshow/71843371.cms,The Times of India,https://timesofindia.indiatimes.com/india/hp-cm-says-boundary-dispute-with-ladakh-would-be-resolved-soon/articleshow/71843371.cms, HP CM says boundary dispute with Ladakh would be resolved soon | India News - Times of India,"https://static.toiimg.com/thumb/msid-71843372,width-1070,height-580,imgsize-208347,resizemode-75,overlay-toi_sw,pt-32,y_pad-40/photo.jpg","India News: SHIMLA: With Ladakh becoming Union territory, Himachal Pradesh can now finally hope to resolve the boundary dispute at Sarchu and Shinkula Pass where ."
163,https://www.fairfieldcitizenonline.com/business/article/Purdue-Pharma-paid-9-million-to-CEO-before-14580113.php,Fairfield Citizen,https://www.fairfieldcitizenonline.com/business/article/Purdue-Pharma-paid-9-million-to-CEO-before-14580113.php,Purdue Pharma paid $9 million to CEO before bankruptcy,https://s.hdnux.com/photos/01/06/53/62/18529454/7/rawImage.jpg,Connecticut Attorney General condemns multimillion-dollar payouts to CEO and Purdue Pharma board members.
164,,,,,,
165,https://www.dailymail.co.uk/news/article-7636733/Sheriff-calls-Florida-mothers-domestic-violence-death-worst-hes-seen.html,Mail Online,https://www.dailymail.co.uk/news/article-7636733/Sheriff-calls-Florida-mothers-domestic-violence-death-worst-hes-seen.html,Sheriff calls woman's domestic violence death the worst he's ever seen,https://i.dailymail.co.uk/1s/2019/10/31/20/20446816-0-image-a-9_1572555012276.jpg,"Osceola County Sheriff Russ Gibson said Nicole Montalvo's remains were found 'disassembled' on her in-laws' property last week, and that the results of her autopsy are certain to horrify the public."
166,https://www.newhavenindependent.org/index.php/archives/entry/devin_eaton_protestesrs/,New Haven Independent,https://www.newhavenindependent.org/index.php/archives/entry/devin_eaton_protestesrs/,Protesters Stop Traffic To Send Cop-Misconduct Message  |  New Haven Independent,http://www.newhavenindependent.org/archives/upload/2019/10/Sam/Marching_on_Dixwell_arms_up.jpg,"Protesters rounded the bend into the Hamden Government Center Wednesday evening, raising their arms into the lightly drizzling air and facing a police car with its lights flashing. “Hands up!”..."
167,https://www.thestar.com/news/world/americas/2019/10/31/thousands-march-in-chile-protest-after-summit-cancellations.html,thestar.com,https://www.thestar.com/news/world/americas/2019/10/31/thousands-march-in-chile-protest-after-summit-cancellations.html,Thousands march in Chile protest after summit cancellations | The Star,https://images.thestar.com/qLfNXVSI7lzXYMZR1mx-oZLutkk=/1280x1024/smart/filters:cb(1572561896466)/https://www.thestar.com/content/dam/thestar/news/world/americas/2019/10/31/thousands-march-in-chile-protest-after-summit-cancellations/TSX211-1031_2019_221851.jpg,"SANTIAGO, Chile - Thousands of young Chileans marched Thursday to demand improved social services as government and opposition leaders debated the response to nearly two weeks of protests that have paralyzed much of the capital and forced the cancellation of two major international summits."
168,https://www.smh.com.au/national/monaco-rich-listers-plead-guilty-to-bribery-corruption-after-media-exposure-20191031-p5362m.html,The Sydney Morning Herald,https://www.smh.com.au/national/monaco-rich-listers-plead-guilty-to-bribery-corruption-after-media-exposure-20191031-p5362m.html,"Monaco rich-listers plead guilty to bribery, corruption after media exposure",https://static.ffx.io/images/$zoom_1%2C$multiply_0.7554%2C$ratio_1.777778%2C$width_1059%2C$x_44%2C$y_0/t_crop_custom/q_86%2Cf_auto/8e48f72543e9ceb2df7be0206ef653d7ce55dc16,The Age and The Sydney Morning Herald faced down a legal and public relations campaign to reveal that dozens of blue-chip companies used Unaoil to corruptly win oil contracts.
169,https://www.today.ng/news/nigeria/pcn-14-3-people-ages-15-64-abuse-drugs-nigeria-260728,TODAY,https://www.today.ng/news/nigeria/pcn-14-3-people-ages-15-64-abuse-drugs-nigeria-260728,PCN: 14.3 million people between ages 15 and 64 abuse drugs in Nigeria - TODAY,https://www.today.ng/wp-content/uploads/2018/02/Pharmacists-Council-of-Nigeria.jpg,The Pharmarcists Council of Nigeria (PCN) on Thursday gathered critical stakeholders in Kaduna to brainstorm on the way out of the alarming prevalence of drug abuse in Nigeria.
170,https://www.daytondailynews.com/news/crime--law/indictments-prompt-city-dayton-strengthen-anti-fraud-efforts/6ZX01kowmys1S4G00KebuJ/,daytondailynews,https://www.daytondailynews.com/news/crime--law/indictments-prompt-city-dayton-strengthen-anti-fraud-efforts/6ZX01kowmys1S4G00KebuJ/,Indictments prompt city of Dayton to strengthen anti-fraud efforts ,https://www.daytondailynews.com/rf/image_large/Pub/p10/WHIO/2019/10/31/Videos/4779735.vpx,Corruption indictments prompt city of Dayton to increase efforts to fight fraud
171,https://www.today.com/style/olivia-newton-john-s-iconic-grease-costume-auction-great-cause-t166173,TODAY.com,https://www.today.com/style/olivia-newton-john-s-iconic-grease-costume-auction-great-cause-t166173,Olivia Newton-John's iconic 'Grease' costume is sold — to Spanx founder Sara Blakely!,https://media3.s-nbcnews.com/j/newscms/2019_45/1503511/olivia_newton-john-sara-blakely-today-main-191105_b20f84d3b9969473cc353482d8553347.social_share_1200x630_center.jpg,"The billionaire shelled out more than $160,000 for the skintight, satin trousers."
172,https://americanfreepress.net/ron-paul-campaign-suggests-military-tired-of-endless-wars/,American Free Press,https://americanfreepress.net/ron-paul-campaign-suggests-military-tired-of-endless-wars/,Military Supports Ron Paul Campaign,/wp-content/uploads/2011/10/us-military-loves-ron-paul.jpg,"By Mark Anderson While the corporate media keep throwing two gubernatorial bookends—Rick Perry of Texas and Mitt Romney of Massachusetts—in our collective face, as if they are the only Republican p…"
173,https://www.marketbeat.com/stocks/TSE/FTS/,,https://www.marketbeat.com/stocks/TSE/FTS/,"FTS Stock Price, Forecast & News (Fortis)",https://www.marketbeat.com/logos/fortis-incorporated-logo.jpg,"Analyzing Fortis (TSE:FTS) stock? View FTS's stock price, price target, dividend, earnings, forecast, insider trades, and news at MarketBeat."
174,https://www.smh.com.au/national/monaco-rich-listers-plead-guilty-to-bribery-corruption-after-media-exposure-20191031-p5362m.html,The Sydney Morning Herald,https://www.smh.com.au/national/monaco-rich-listers-plead-guilty-to-bribery-corruption-after-media-exposure-20191031-p5362m.html,"Monaco rich-listers plead guilty to bribery, corruption after media exposure",https://static.ffx.io/images/$zoom_1%2C$multiply_0.7554%2C$ratio_1.777778%2C$width_1059%2C$x_44%2C$y_0/t_crop_custom/q_86%2Cf_auto/8e48f72543e9ceb2df7be0206ef653d7ce55dc16,The Age and The Sydney Morning Herald faced down a legal and public relations campaign to reveal that dozens of blue-chip companies used Unaoil to corruptly win oil contracts.
175,https://www.onenewspage.com/n/Front+Page/1zkk83ouwi/Swedish-police-alarmed-by-the-rise-of-Nigerian.htm,One News Page,https://www.onenewspage.com/n/Front+Page/1zkk83ouwi/Swedish-police-alarmed-by-the-rise-of-Nigerian.htm,Swedish police alarmed by the rise of Nigerian ‘death cult’ gang kidnapping victims with help of VOODOO MAGIC,https://cdn.newsserve.net/700/i/20191031/3565-Swedish-police-alarmed-by-the-rise-of-Nigerian.jpg,"A criminal gang notorious for its brutality is gaining a foothold in major Swedish cities, police have warned. The drug-traffickers and people-smugglers from"
