,source_url,site_name,site_url,title,img_url,description
115,https://www.eurekalert.org/pub_releases/2019-10/tcd-ccs101419.php,EurekAlert!,https://www.eurekalert.org/pub_releases/2019-10/tcd-ccs101419.php,Chemists create self-assembling material with suite of new properties,https://www.eurekalert.org/images/EurekAlert_StackedLogo_RGB.jpg,Chemists from Trinity College Dublin have created a new material that self-assembles into 2D networks in a predictable and reproducible manner. They have successfully synthesised a complex material by design -- paving the way for its suite of new properties to be applied in many fields.
116,https://www.hawaiinewsnow.com/2019/10/15/wind-turbine-protesters-stake-out-overnight-prepared-block-any-equipment/,https://www.hawaiinewsnow.com,https://www.hawaiinewsnow.com/2019/10/15/wind-turbine-protesters-stake-out-overnight-prepared-block-any-equipment/,Wind farm protesters turn out for second night in attempt to block construction,https://www.hawaiinewsnow.com/resizer/uJEIWYMinQ7CMB_M8BhuzpuZCFc=/1200x0/arc-anglerfish-arc2-prod-raycom.s3.amazonaws.com/public/5DGJSEJMPVCYLK66QBGUVWIQJI.JPG,The company behind the project hoped to begin moving wind turbine parts Sunday night.
117,,,,,,
118,,KVIA,,Page not found - KVIA,https://s3.us-east-1.wasabisys.com/kvia.com/2019/10/kvia-header.png,
119,https://www.straitstimes.com/asia/se-asia/indonesia-tightens-security-ahead-of-president-joko-widodos-swearing-in-for-second-term,The Straits Times,https://www.straitstimes.com/asia/se-asia/indonesia-tightens-security-ahead-of-president-joko-widodos-swearing-in-for-second-term,Indonesia tightens security ahead of President Joko Widodo's swearing-in for second term,https://www.straitstimes.com/sites/default/files/styles/x_large/public/articles/2019/10/15/ak_jkd_1510.jpg?itok=yPVtcjDL,"JAKARTA - Indonesia is beefing up security ahead of President Joko Widodo's swearing-in for his second and final term on Oct 20, after a series of protests and violent attacks in the capital and some other parts of the country over the past few weeks.. Read more at straitstimes.com."
120,https://allafrica.com/stories/201910150090.html,allAfrica.com,https://allafrica.com/stories/201910150090.html,"Namibia: It's Time for Brain Gain, Says Geingob",https://cdn07.allafrica.com/static/images/structure/aa-logo-rgba-no-text-128x128.png,"President Hage Geingob has appealed to African immigrants living in the diaspora to help provide the much-needed human, social and financial capital to their countries of origin in order to address the skills needed for development."
121,,,,,,
122,https://www.newson6.com/story/41180233/city-of-mannfords-website-hacked,,https://www.newson6.com/story/41180233/city-of-mannfords-website-hacked,City of Mannford's Website Hacked,https://KOTV.images.worldnow.com/images/18304146_G.jpg?lastEditedDate=1555104796000,The mayor of Mannford say the city's website was hacked. Mayor Tyler Buttram says Mannford is one of several cities hosted by 
123,https://www.theepochtimes.com/turkey-pushes-offensive-in-syria-despite-sanctions-and-calls-to-stop_3117271.html,www.theepochtimes.com,https://www.theepochtimes.com/turkey-pushes-offensive-in-syria-despite-sanctions-and-calls-to-stop_3117271.html,"Turkey Pushes Offensive in Syria, Despite Sanctions and Calls to Stop",https://img.theepochtimes.com/assets/uploads/2019/10/15/A-vehicle-is-seen-in-the-Syrian-town-1200x792.jpg,"Turkey pressed ahead with its offensive in northern Syria on Tuesday, Oct. 15, despite U.S. sanctions and growing calls for it to stop, while Syria's Russia-backed army moved on the key city of Manbij that U.S. forces have withdrawn from."
124,,,,,/wp-content/themes/vip/newscorpau-nca/assets/dist/img/common/favicon/favicon-1024x1024.png,
125,https://www.bighospitality.co.uk/Article/2019/10/15/Indian-restaurant-group-Copper-Chimney-opens-first-UK-site-in-Westfield-London,bighospitality.co.uk,https://www.bighospitality.co.uk/Article/2019/10/15/Indian-restaurant-group-Copper-Chimney-opens-first-UK-site-in-Westfield-London,India's Copper Chimney opens first UK site ,https://cdn-b.william-reed.com/var/wrbm_gb_hospitality/storage/images/publications/hospitality/bighospitality.co.uk/article/2019/10/15/indian-restaurant-group-copper-chimney-opens-first-uk-site-in-westfield-london/3188257-1-eng-GB/Indian-restaurant-group-Copper-Chimney-opens-first-UK-site-in-Westfield-London.jpg,Indian restaurant group Copper Chimney has opened its first UK outpost at Westfield London.
126,https://kvoa.com/news/digging-deeper/2019/10/14/digging-deeper-retired-judge-weighs-in-on-prop-123-controversy/,KVOA,https://kvoa.com/news/digging-deeper/2019/10/14/digging-deeper-retired-judge-weighs-in-on-prop-123-controversy/,DIGGING DEEPER: Retired judge weighs in on Prop 123 controversy - KVOA,https://s3-ca-central-1.amazonaws.com/quincy-network/wp-content/uploads/sites/7/2018/11/20074444/14382962437_5f50faa22e_b-e1542725254303.jpg,"Earlier this month, Federal District Judge Neil Wake ruled against Gov. Doug Ducey on Proposition 123 - a measure that allowed the state to tap into a land trust for education funding."
127,,,,,,
128,,,,,,
129,https://www.radioiowa.com/2019/10/15/iowa-doctor-pays-1-million-settlement-over-medicaid-billing-dispute/,Radio Iowa,https://www.radioiowa.com/2019/10/15/iowa-doctor-pays-1-million-settlement-over-medicaid-billing-dispute/,Iowa doctor pays $1 million settlement over Medicaid billing dispute - Radio Iowa,https://cdn.radioiowa.com/wp-content/uploads/2017/05/gavel-on-table.jpg,"Federal officials today announced an ear, nose and throat doctor in Carroll with clinics in eight other Iowa cities has agreed to pay $1 million to resolve allegations of Medicaid billing fraud. The doctor said the settlement is not an admission of wrong doing. According to a news release from the U.S. Attorney’s Office in …"
130,http://www.kfm.co.ug/news/uganda-mp-appointed-to-ipu.html,93.3 KFM,http://www.kfm.co.ug/news/uganda-mp-appointed-to-ipu.html,Uganda MP appointed to IPU,http://www.kfm.co.ug/wp-content/uploads/2019/10/Roland-Kaginda-addressing-the-media.jpg,By Ben Jumbe Rukungiri Municipality Member of Parliament Ronald Mugume has been  appointed on the inter-parliamentary union (IPU) committee of
131,https://www.pulse.com.gh/news/world/brazil-probes-whether-ghost-ship-carrying-venezuelan-oil-involved-in-spill/khdtvd3,,https://www.pulse.com.gh/news/world/brazil-probes-whether-ghost-ship-carrying-venezuelan-oil-involved-in-spill/khdtvd3,Brazil probes whether 'ghost ship' carrying Venezuelan oil involved in spill,https://ocdn.eu/pulscms-transforms/1/zbSktkuTURBXy9mNjJlNjcxNC05MTFkLTQ5NjMtOTEyYi1kZjBkNWM4Mzk3YzguanBlZ5GTBc0EsM0Cdg,"A huge oil spill off Brazil's northeastern coast may have involved a ""ghost ship"" carrying Venezuelan oil in breach of US sanctions, an expert close to the probe into the disaster said Tuesday."
132,https://www.thenational.ae/arts-culture/film/capernaum-gave-her-worldwide-recognition-so-what-s-next-for-nadine-labaki-1.924142,The National,https://www.thenational.ae/arts-culture/film/capernaum-gave-her-worldwide-recognition-so-what-s-next-for-nadine-labaki-1.924142,"‘Capernaum’ gave her worldwide recognition, so what's next for Nadine Labaki?",https://www.thenational.ae/image/policy:1.924137:1571151407/image.jpg?f=16x9&q=0.6&w=1200&$p$f$q$w=70c86c9,"We sit down with the Oscar-nominated Lebanese director to talk the legacy of ‘Capernaum’, the power of art and potentially working with Oprah"
133,https://fox61.com/2019/10/14/new-haven-drag-racing-arrests-come-with-warning/,FOX 61,https://fox61.com/2019/10/14/new-haven-drag-racing-arrests-come-with-warning/,New Haven drag racing arrests come with warning,https://tribwtic.files.wordpress.com/2019/10/promo395353282.jpg?quality=85&strip=all&w=1200,"NEW HAVEN -- The brakes were slammed on potentially dangerous drag race before it could even get going in New Haven late Saturday night as police made dozens of arrests.

New Haven Police said they made nearly 50 arrests in the parking lot of the McDonald’s, at 225 Foxon Blvd. late Saturday night. Some of the folks arrested were simply there to watch the race."
134,https://www.dailytrust.com.ng/group-supports-nercs-move-to-sanction-8-discos.html,Daily Trust,https://www.dailytrust.com.ng/group-supports-nercs-move-to-sanction-8-discos.html,Group supports NERC’s move to sanction 8 DisCos – Daily Trust,,"A Lagos-based consumer group, Energy Consumer Rights and Responsibilities Initiative, on Monday, said it is in support of a move by the Nigerian Electricity Regulatory Commission (NERC) to cancel the licences of eight electricity Distribution Companies (DisCos) for alleged breach of rules. The group also called on NERC to urgently look into activities of Meter …"
135,https://www.haaretz.com/middle-east-news/syria/.premium-syria-trump-turkey-kurds-isis-1.7974450,haaretz.com,https://www.haaretz.com/middle-east-news/syria/.premium-syria-trump-turkey-kurds-isis-1.7974450,How Bashar Assad won in Syria,https://www.haaretz.com/polopoly_fs/1.7979368.1571136953!/image/2604726389.jpg_gen/derivatives/headline_1200x630/2604726389.jpg,***
136,https://www.japantimes.co.jp/article-expired/,The Japan Times,https://www.japantimes.co.jp/article-expired/,Article expired | The Japan Times,https://cdn.japantimes.2xx.jp/wp-content/uploads/2017/04/jt-sns.png,"News on Japan, Business News, Opinion, Sports, Entertainment and More"
137,,,,,,
138,https://www.kait8.com/2019/10/15/russia-moves-fill-void-left-by-us-northern-syria/,https://www.kait8.com,https://www.kait8.com/2019/10/15/russia-moves-fill-void-left-by-us-northern-syria/,"Fearing US abandonment, Kurds kept back channels wide open",https://www.kait8.com/resizer/KgFZDiIJo7hvjzN_dfOvkh1WuQY=/1200x0/arc-anglerfish-arc2-prod-raycom.s3.amazonaws.com/public/FYHRSACZTJBERHBXPNRWZSITEY.jpg,"Now in its seventh day, Turkey's offensive against Kurdish fighters has caused tens of thousands to flee their homes, has upended alliances and is re-drawing the map of northern Syria for yet another time in the 8-year-old war."
139,https://www.nature.com/articles/d41586-019-03121-2,,https://www.nature.com/articles/d41586-019-03121-2,Ecuador’s research dream crushed by politics,,Discover the world’s best science and medicine  | Nature.com
140,https://tass.com/politics/1083275,TASS,https://tass.com/politics/1083275,Russian national detained in Minsk provided with necessary support — Foreign Ministry,https://tass.com/img/blocks/common/tass_logo_share_ru.png,"In February 2018, US officials pressed charges against 13 Russian citizens, including Anna Bogacheva, accusing them of attempting to interfere in the US political process"
141,,,,,,
142,https://www.lse.co.uk/rns/62AO/og-member-indosat-ooredoo-signs-agreement-udpygb8d41g94d1.html,,https://www.lse.co.uk/rns/62AO/og-member-indosat-ooredoo-signs-agreement-udpygb8d41g94d1.html,Ooredoo International Finance Limited Regulatory News. Live 62AO RNS. Regulatory News Articles for 62ao.l,,Ooredoo International Finance Limited Regulatory News. Live 62AO RNS. Regulatory News Articles for 62ao.l
143,https://www.heraldmailmedia.com/news/tri_state/west_virginia/w-va-attorney-general-urges-public-to-report-suspected-medicaid/article_6d2a3e52-843a-552e-8870-ed1088ab902a.html,Herald-Mail Media,https://www.heraldmailmedia.com/news/tri_state/west_virginia/w-va-attorney-general-urges-public-to-report-suspected-medicaid/article_6d2a3e52-843a-552e-8870-ed1088ab902a.html,W.Va. attorney general urges public to report suspected Medicaid fraud,https://bloximages.newyork1.vip.townnews.com/heraldmailmedia.com/content/tncms/assets/v3/editorial/9/29/929a2b28-e1e3-5447-922d-dbfdf0d3184e/5da51347afbb9.preview.jpg?resize=1120%2C630,"MARTINSBURG, W.Va. — West Virginia Attorney General Patrick Morrisey on Monday urged residents to report suspected Medicaid fraud in whatever form it might surface."
144,https://thenews-chronicle.com/nigerian-student-shot-dead-in-u-s/,The News Chronicle,https://thenews-chronicle.com/nigerian-student-shot-dead-in-u-s/,Nigerian student shot dead over loud music in the U.S - The News Chronicle,https://thenews-chronicle.com/wp-content/uploads/2019/10/79b514ce-6135-4d78-9bec-c75908c32856_1140x641.jpg,"The family of an 18-year-old Nigerian student of the Kennesaw State University, who was shot dead on Sunday, believe i was because of an argument on Friday night, over loud music. Oluwafemi Oyerinde and two other people were shot at Stadium Village Apartments on Sunday morning. The two others survived. They were on their way …"
145,https://www.tcpalm.com/story/opinion/columnists/laurence-reisman/2019/10/15/trial-premeditated-murder-sebastian-nurse-real-life-vero-beach-whodunit-michael-jones-diana-duve/3978123002/,TCPalm,https://www.tcpalm.com/story/opinion/columnists/laurence-reisman/2019/10/15/trial-premeditated-murder-sebastian-nurse-real-life-vero-beach-whodunit-michael-jones-diana-duve/3978123002/,"This isn't TV: Trial of Michael Jones puts real-life Vero Beach crime story front, center","https://www.gannett-cdn.com/presto/2019/10/01/PTCN/1acae3cc-11d9-48b5-9a68-f45117ce024e-1001MichaelJones05.JPG?crop=4639,2610,x0,y235&width=3200&height=1680&fit=bounds","Former PNC investment adviser Michael Jones is on trial, charged with first-degree murder in death of Sebastian River Medical Center nurse Diana Duve."
146,https://nypost.com/2019/10/15/turkeys-invasion-of-syria-is-causing-a-refugee-crisis/,New York Post,https://nypost.com/2019/10/15/turkeys-invasion-of-syria-is-causing-a-refugee-crisis/,Turkey’s invasion of Syria is causing a refugee crisis,https://thenypost.files.wordpress.com/2019/10/turkey-syria-bombs-explosions.jpg?quality=90&strip=all&w=1200,"Turkey’s invasion of northern Syria created a humanitarian crisis that by Tuesday had displaced up to hundreds of thousands of civilians, according to Kurdish authorities and several humanitarian g…"
147,http://www.theguardian.com/world/2019/oct/15/new-catalan-vote-on-independence-is-inevitable-says-jailed-leader,the Guardian,http://www.theguardian.com/world/2019/oct/15/new-catalan-vote-on-independence-is-inevitable-says-jailed-leader,Catalan independence leaders accused of 'totalitarian attitude',https://i.guim.co.uk/img/media/1b6de2fe404d13e71c0c2dc12e1e2ba39c634072/0_117_6240_3744/master/6240.jpg?width=1200&height=630&quality=85&auto=format&fit=crop&overlay-align=bottom%2Cleft&overlay-width=100p&overlay-base64=L2ltZy9zdGF0aWMvb3ZlcmxheXMvdGctZGVmYXVsdC5wbmc&enable=upscale&s=aaeb943da6e377fd16ed1480eaf92d0c,Spain’s foreign minister says regional government excludes views of people who do not back independence
148,https://www.hawaiinewsnow.com/2019/10/15/wind-turbine-protesters-stake-out-overnight-prepared-block-any-equipment/,https://www.hawaiinewsnow.com,https://www.hawaiinewsnow.com/2019/10/15/wind-turbine-protesters-stake-out-overnight-prepared-block-any-equipment/,Wind farm protesters turn out for second night in attempt to block construction,https://www.hawaiinewsnow.com/resizer/uJEIWYMinQ7CMB_M8BhuzpuZCFc=/1200x0/arc-anglerfish-arc2-prod-raycom.s3.amazonaws.com/public/5DGJSEJMPVCYLK66QBGUVWIQJI.JPG,The company behind the project hoped to begin moving wind turbine parts Sunday night.
149,https://www.indiatoday.in/india/story/kerala-serial-murders-police-conduct-second-round-of-evidence-collection-complainant-to-give-statement-1609445-2019-10-15,India Today,https://www.indiatoday.in/india/story/kerala-serial-murders-police-conduct-second-round-of-evidence-collection-complainant-to-give-statement-1609445-2019-10-15,"Kerala serial murders: Police conduct second round of evidence collection, complainant to give statement",https://akm-img-a-in.tosshub.com/indiatoday/images/story/201910/jolly-647x363.jpeg?D_TAf4opMzpJkxnXNO2uYv1amwX58HZy,"In another round of evidence gathering, Kerala Police brought prime accused in Kozhikode serial killings Jolly Joseph to the Ponnamttam house where three deaths had taken place."
150,https://www.pressofatlanticcity.com/opinion/letters/voice-of-the-people-oct/article_7d0029a1-990b-5c25-ad48-89ba842a3407.html,Press of Atlantic City,https://www.pressofatlanticcity.com/opinion/letters/voice-of-the-people-oct/article_7d0029a1-990b-5c25-ad48-89ba842a3407.html,"Voice of the People, Oct. 15, 2019",https://bloximages.chicago2.vip.townnews.com/pressofatlanticcity.com/content/tncms/custom/image/bae1e730-3e34-11e6-9bc5-8f83ee7a0e54.jpg,Offshore wind project threatens N.J. fishing
151,https://www.reuters.com/article/us-syria-security-turkey-russia-idUSKBN1WU1JN,U.S.,https://www.reuters.com/article/us-syria-security-turkey-russia-idUSKBN1WU1JN,Russia says 'unacceptable' Turkish incursion into Syria must be temporary,https://s4.reutersmedia.net/resources/r/?m=02&d=20191015&t=2&i=1441222884&w=1200&r=LYNXMPEF9E0XX,"Russia called Turkey's military incursion into northeast Syria ""unacce..."
152,https://www.kmov.com/news/bar-donates-the-patrons-stapled-to-the-walls-to-hurricane/article_2b3eae0b-1202-59d5-933b-c156c4b65740.html,KMOV.com,https://www.kmov.com/news/bar-donates-the-patrons-stapled-to-the-walls-to-hurricane/article_2b3eae0b-1202-59d5-933b-c156c4b65740.html,"Bar donates the $13,961 patrons stapled to the walls to Hurricane Dorian relief in the Bahamas",https://bloximages.newyork1.vip.townnews.com/kmov.com/content/tncms/assets/v3/editorial/5/a6/5a630207-35a9-5b33-a93b-2d114158cc32/5d97b36fef688.image.jpg?resize=1120%2C630,"It's a long-held tradition for patrons to staple money to anything they can at Siesta Key Oyster Bar: walls, ceilings and awnings. Now it'll go to a good cause."
153,,,,,,
154,https://www.news5cleveland.com/news/local-news/oh-lorain/fire-destroys-5-garage-units-at-timberlake-townhomes-in-avon-causing-nearly-200-000-in-damage,WEWS,https://www.news5cleveland.com/news/local-news/oh-lorain/fire-destroys-5-garage-units-at-timberlake-townhomes-in-avon-causing-nearly-200-000-in-damage,$200K in damage after fire destroys garages in Avon,https://ewscripps.brightspotcdn.com/dims4/default/a3a6866/2147483647/strip/true/crop/1532x804+0+30/resize/1200x630!/quality/90/?url=https%3A%2F%2Fx-default-stgec.uplynk.com%2Fausw%2Fslices%2F9c5%2Fb2c1c5c2af374f52af57ddcae54c6663%2F9c512a5c397d4c5c990ae0c9f0c64980%2Fposter_41e8be19d7a444d28b123a9ebb5c6d8d..jpeg,"Five garage units and two parked vehicles were destroyed on Monday night after a massive fire broke out at the Timberlake Townhomes on Chester Road in Avon, according to a release from the Avon Fire Department."
155,https://www.vanguardngr.com/2019/10/ex-students-of-ui-international-schl-donate-n16m-building-to-alma-mater/,Vanguard News,https://www.vanguardngr.com/2019/10/ex-students-of-ui-international-schl-donate-n16m-building-to-alma-mater/,EX-students of UI International Schl donate N16m building to alma mater,https://i0.wp.com/www.vanguardngr.com/wp-content/uploads/2019/10/UI.png?fit=661%2C479&ssl=1,Nigeria News - Vice Chancellor of UI Prof Abel Idowu Olayinka has called on the management of the 56 year-old school not to allow any distraction
156,https://www.indystar.com/story/entertainment/dining/restaurants/2019/10/15/indianapolis-mexican-restaurant-acapulco-joes-closes-new-owner-renovates-space/3983359002/,Indianapolis Star,https://www.indystar.com/story/entertainment/dining/restaurants/2019/10/15/indianapolis-mexican-restaurant-acapulco-joes-closes-new-owner-renovates-space/3983359002/,Acapulco Joe's closes as new owner renovates the downtown Mexican restaurant,https://www.gannett-cdn.com/-mm-/2589d3933496aafcedb74ece13eed6f153f8162b/c=0-176-1600-1075/local/-/media/Indianapolis/Indianapolis/2014/01/17//1389972548004-acapulco.jpg?width=1600&height=800&fit=crop,"Acapulco Joe's new owner, Ezequiel Fuentes, shuttered the 365 N. Illinois St., Indianapolis, restaurant Oct. 14 to upgrade the site."
157,https://asia.nikkei.com/Business/Media-Entertainment/Shadowy-operators-power-Duterte-s-offshore-gaming-boom,Nikkei Asian Review,https://asia.nikkei.com/Business/Media-Entertainment/Shadowy-operators-power-Duterte-s-offshore-gaming-boom,Shadowy operators power Duterte's offshore gaming boom,https://www.ft.com/__origami/service/image/v2/images/raw/https%3A%2F%2Fs3-ap-northeast-1.amazonaws.com%2Fpsh-ex-ftnikkei-3937bb4%2Fimages%2F9%2F0%2F0%2F0%2F22730009-1-eng-GB%2F%E5%90%8D%E7%A7%B0%E6%9C%AA%E8%A8%AD%E5%AE%9A%202%20%E3%81%AE%E3%82%B3%E3%83%94%E3%83%BC_3.jpg?source=nar-cms&width=1024&height=512&fit=cover&gravity=faces,Lawmakers question value of online casino industry registered in tax havens
158,,,,,,
159,https://ottawasun.com/opinion/columnists/marin-trudeau-should-look-in-mirror-instead-of-fixating-on-doug-ford/wcm/8f3df6c6-5d26-48c7-afca-4bde45762370,Ottawa Sun,https://ottawasun.com/opinion/columnists/marin-trudeau-should-look-in-mirror-instead-of-fixating-on-doug-ford/wcm/8f3df6c6-5d26-48c7-afca-4bde45762370,MARIN: Trudeau should stop fixating on Doug Ford and look in mirror,https://postmediaottawasun.files.wordpress.com/2019/10/afp_1l79g3_74479762.jpg,Liberal Leader Justin Trudeau is fixating on Ontario Premier Doug Ford.The media have even taken the habit of tweeting the number of times Trudeau utters Ford’s name during a speech. Dependin…
160,https://www.azcentral.com/story/news/politics/2019/10/15/john-bolton-decried-ukraine-drug-deal/3983310002/,azcentral,https://www.azcentral.com/story/news/politics/2019/10/15/john-bolton-decried-ukraine-drug-deal/3983310002/,"John Bolton decried Giuliani effort to pressure Ukraine as 'drug deal,' ex-aide Fiona Hill testifies, reports say","https://www.gannett-cdn.com/presto/2019/10/15/USAT/ee436d82-684a-4978-a8cf-cc4ec321fcb9-AFP_AFP_1KV55B.JPG?crop=2049,1152,x110,y371&width=1600&height=800&fit=bounds","Fiona Hill, an ex-White House adviser on Russia, reportedly testified that Bolton called Giuliani ""a hand grenade who’s going to blow everybody up."""
161,,,,,,
162,https://foxtrotalpha.jalopnik.com/americas-betrayal-of-the-kurds-explained-1838913824,Foxtrot Alpha,https://foxtrotalpha.jalopnik.com/americas-betrayal-of-the-kurds-explained-1838913824,"America's Betrayal Of The Kurds, Explained","https://i.kinja-img.com/gawker-media/image/upload/c_fill,f_auto,fl_progressive,g_center,h_675,pg_1,q_80,w_1200/orn0mqeu4ms1idazbn78.jpg","Over the past two weeks America’s power, prestige, and moral authority abroad have taken a body blow: President Donald Trump abruptly decided to withdraw U.S. forces from key a region in Syria. The decision to withdraw resulted in America’s Kurdish allies, one of Washington’s most loyal allies in the region, exposed to a military offensive by another one of America’s allies, Turkey. Here’s what’s going on. 
"
163,,,,,,
164,https://gulfnews.com/world/asia/india/india-eight-killed-after-bus-falls-into-gorge-in-andhra-1.1571138929026,,https://gulfnews.com/world/asia/india/india-eight-killed-after-bus-falls-into-gorge-in-andhra-1.1571138929026,India: Eight killed after bus falls into gorge in Andhra ,https://imagevars.gulfnews.com/2019/10/15/India--Eight-killed-after-bus-falls-into-gorge-in-Andhra-_16dcf2d5f09_medium.jpg,The cause of the incident is yet to be ascertained
165,https://victorygirlsblog.com/tuesdays-dem-debate-questions-the-cnn-mods-should-raise/,Victory Girls Blog,https://victorygirlsblog.com/tuesdays-dem-debate-questions-the-cnn-mods-should-raise/,Tuesday's Dem Debate: Questions the CNN Mods Should Raise - Victory Girls Blog,https://victorygirlsblog.com/wp-content/uploads/2019/10/CNN.jpg,"Tuesday's Dem debate will air on CNN. Yes, the CNN that Project Veritas just exposed for intentionally pushing the impeachment narrative."
166,,,,,,
167,https://www.gwinnettdailypost.com/local/boc-appoints-member-to-ethics-panel-for-d-a-king/article_14ecc0b6-eef3-11e9-a75a-3fd552957f17.html,Gwinnett Daily Post,https://www.gwinnettdailypost.com/local/boc-appoints-member-to-ethics-panel-for-d-a-king/article_14ecc0b6-eef3-11e9-a75a-3fd552957f17.html,BOC appoints member to ethics panel for D.A. King's complaint against Gwinnett Commissioner Marlene Fosque,https://bloximages.newyork1.vip.townnews.com/gwinnettdailypost.com/content/tncms/assets/v3/editorial/7/eb/7eb30588-c530-11e9-b8e8-93a76f78532c/5d5f1e509a845.image.png?resize=949%2C630,"For the second time in less than three years, an ethics panel is being convened to hear a complaint filed against a Gwinnett County commissioner because of comments they have"
168,,,,,,
169,https://www.ghanaweb.com/GhanaHomePage/NewsArchive/Police-warn-troublemakers-ahead-of-Tuesday-demo-by-aggrieved-GCFM-customers-789118,,https://www.ghanaweb.com/GhanaHomePage/NewsArchive/Police-warn-troublemakers-ahead-of-Tuesday-demo-by-aggrieved-GCFM-customers-789118,Police warn troublemakers ahead of Tuesday demo by aggrieved GCFM customers,,The Accra Regional Police Command of the Ghana Police Service has issued a...
170,https://merryjane.com/news/california-just-passed-a-slew-of-groundbreaking-weed-reform-laws,MERRY JANE,https://merryjane.com/news/california-just-passed-a-slew-of-groundbreaking-weed-reform-laws,California Just Passed a Slew of Groundbreaking Weed Reform Laws,https://files.merryjane.com/uploads/generic/1571167668540_a1weedwide.jpg,"The world’s largest cannabis market will let medical marijuana patients receive free cannabis, permit cannabis businesses to make deductions on their state taxes, and more. 
"
171,https://www.marines.mil/News/News-Display/Article/1988745/camp-foster-hosts-2019-comic-con-okinawa,United States Marine Corps Flagship,https://www.marines.mil/News/News-Display/Article/1988745/camp-foster-hosts-2019-comic-con-okinawa,Camp Foster hosts 2019 Comic Con Okinawa,https://media.defense.gov/2019/Oct/15/2002194688/1140/641/0/191013-M-DG059-0005.JPG,"Marine Corps Community Services, Okinawa, Japan, hosted its ninth annual Comic Con, Oct. 13 at Camp Foster.The event started in 2011 and caters to comic book fans, movie fans, artists and video"
172,,,,,,
