,source_url,site_name,site_url,title,img_url,description
176,https://www.uspresidentialelectionnews.com/2019/10/tulsi-gabbard-tops-kamala-harris-in-new-democratic-primary-poll/,Election Central,https://www.uspresidentialelectionnews.com/2019/10/tulsi-gabbard-tops-kamala-harris-in-new-democratic-primary-poll/,Tulsi Gabbard Tops Kamala Harris In New Democratic Primary Poll - Election Central,https://www.uspresidentialelectionnews.com/wp-content/uploads/2019/10/Gabbard-Harris-Poll.jpg,Hawaii Rep. Tulsi Gabbard beat Sen. Kamala Harris in the latest USA TODAY/Suffolk University poll of national Democratic primary voters
177,https://bulawayo24.com/index-id-news-sc-national-byo-173694.html,Bulawayo24 News,https://bulawayo24.com/index-id-news-sc-national-byo-173694.html,PHOTO: Chamisa meets the Indian Ambassador ,https://img.bulawayo24.com/articles/CHAMISA_INDIA.PNG,MDC leader Nelson CChamisa on Thursday met with the Indian Ambassador to Zimbabwe Mr Rungsung Masakui in Harare to discuss a number of issues affecting the coun...
178,https://www.thenational.scot/news/18004264.johnson-snp-forfeit-devolved-nhs-rights/,The National,https://www.thenational.scot/news/18004264.johnson-snp-forfeit-devolved-nhs-rights/,Boris Johnson makes threat over SNP's control of Scottish NHS,https://www.thenational.scot/resources/images/10610766/,BORIS Johnson has been accused of having his “greedy eyes” on Scotland’s NHS after he appeared to threaten the Scottish Government’s powers… 
179,https://www.independent.ie/irish-news/crime/gardai-seize-32m-of-cannabis-found-in-vegetable-truck-38647817.html,Independent.ie,https://www.independent.ie/irish-news/crime/gardai-seize-32m-of-cannabis-found-in-vegetable-truck-38647817.html,Gardaí seize €3.2m of cannabis found in vegetable truck - Independent.ie,https://www.independent.ie/incoming/article38647392.ece/ALTERNATES/h342/HN-Hash-haul.jpg,A conglomerate of north Dublin organised crime gangs are millions of euro out of pocket after a Garda bust which was part of an international surveillance operation.
180,https://www.abc.net.au/news/2019-10-31/man-sexually-assaulted-while-jogging-in-adelaide/11660264,ABC News,https://www.abc.net.au/news/2019-10-31/man-sexually-assaulted-while-jogging-in-adelaide/11660264,"Male jogger sexually assaulted after being forced into back seat of another man's car, police say",https://www.abc.net.au/news/image/11660432-16x9-700x394.jpg,SA Police is investigating the sexual assault of a jogger who was forced into the back seat of another man's car south-west of Adelaide last night.
181,https://www.bizpacreview.com/2019/10/31/pompeo-doubles-down-no-quid-pro-quo-on-trump-ukraine-call-846464,BizPac Review,https://www.bizpacreview.com/2019/10/31/pompeo-doubles-down-no-quid-pro-quo-on-trump-ukraine-call-846464,Mike Pompeo doubles down: No quid pro quo on Trump-Ukraine call,https://www.bizpacreview.com/wp-content/uploads/2019/10/SG-Mike-Pompeo-Trump-did-nothing-wrong-Ukraine-call.jpg,"Secretary of State Mike Pompeo, a Harvard-educated attorney, said Trump did nothing wrong on his July 2019 phone call with Ukraine's president."
182,https://www.dailytrust.com.ng/suspected-fraudster-mompha-has-laundered-about-n14bn-magu.html,Daily Trust,https://www.dailytrust.com.ng/suspected-fraudster-mompha-has-laundered-about-n14bn-magu.html,"Suspected fraudster, Mompha has laundered about N14bn – Magu – Daily Trust",https://cdn.dailytrust.com.ng/wp-content/uploads/2019/10/EFCC-Magu-in-Lagos-Oct-31-2019.jpg,"The Acting Chairman of the Economic and Financial Crimes Commission, (EFCC), Ibrahim Magu, on Thursday, said investigation conducted following the arrest of the alleged internet fraudster, Ismaila Mustapha, popularly called Mompha, has shown that the suspect has laundered about N14billion through a firm known as Ismalob Global Investments Limited."
183,https://www.usatoday.com/story/news/politics/2019/10/31/trump-impeachment-inquiry-house-vote-rules-public-hearings/2453705001/,USA TODAY,https://www.usatoday.com/story/news/politics/2019/10/31/trump-impeachment-inquiry-house-vote-rules-public-hearings/2453705001/,"House to make first vote of formal Trump impeachment inquiry, resolution sets rules for public hearings","https://www.gannett-cdn.com/presto/2019/10/02/USAT/4ce1541f-7893-4e4c-9767-9f7b8c6ae8e6-Pelosi_schiff.JPG?crop=3999,2250,x0,y85&width=3200&height=1801&format=pjpg&auto=webp",The House is set to vote on rules for public hearings in the impeachment investigation of President Donald Trump.
184,,,,,,
185,https://www.reuters.com/article/us-bolivia-protests-idUSKBN1XA1ZY,U.S.,https://www.reuters.com/article/us-bolivia-protests-idUSKBN1XA1ZY,Bolivia election audit ready to start after street clashes turn deadly,https://s3.reutersmedia.net/resources/r/?m=02&d=20191101&t=2&i=1447153471&w=1200&r=LYNXMPEFA0227,Bolivia was set to start a politically charged review of its recent presidential...
186,https://ottawacitizen.com/news/local-news/hate-crime-investigator-probing-sexist-slur-on-mckennas-campaign-office,Ottawa Citizen,https://ottawacitizen.com/news/local-news/hate-crime-investigator-probing-sexist-slur-on-mckennas-campaign-office,Hate crime investigator probing sexist slur on Catherine McKenna's campaign office,https://postmediaottawacitizen2.files.wordpress.com/2019/10/ottmckennaoct25-2.jpg,"A hate crime investigator is now looking into the sexist slur spray-painted across the face of a Catherine McKenna campaign office window last week, Ottawa police confirmed on Thursday. It’s …"
187,https://www.wdtv.com/content/news/2-Cabell-County-Sheriffs-deputies-shot-suspect-killed-564154251.html ,,https://www.wdtv.com/content/news/2-Cabell-County-Sheriffs-deputies-shot-suspect-killed-564154251.html ,UPDATE | Father of suspect charged after shooting of two Cabell County deputies,https://media.graytvinc.com/images/michael+pinkerman+fullscreen.jpg,Two Cabell County Sheriffs deputies were taken to the hospital Wednesday night after being shot while executing a search warrant in an incident that left the suspect dead.
188,https://www.lawfareblog.com/arctic-provisions-2020-ndaa,Lawfare,https://www.lawfareblog.com/arctic-provisions-2020-ndaa,Arctic Provisions in the 2020 NDAA,https://lawfare.s3-us-west-2.amazonaws.com/staging/s3fs-public/180313-F-YK359-1161.jpg,"The draft National Defense Authorization Act (NDAA) for fiscal year 2020, currently in conference, includes three Arctic-specific provisions that show a continuing increase in congressional attention to the Arctic over the past five years."
189,http://www.koreaherald.com/view.php?ud=20191031000208,,http://www.koreaherald.com/view.php?ud=20191031000208,New S. Korean ambassador expects US-NK talks to resume this year,http://res.heraldm.com/content/image/2019/10/31/20191031000176_0.jpg,"South Korea's top envoy to the United States said Wednesday that he expects the US and North Korea to resume denuclearization negotiations before the end of the year.Ambassador Lee Soo-hyuck made the remark to reporters in his first briefing since taking office last week, noting that his prediction is based only on the South Korean government's assessment of the last round of negotiations that took place in Sweden ea..."
190,,Yeni Şafak,,Israel rounds up 7 Palestinians in West Bank raids,https://img.piri.net/mnresize/600/-/resim/imagecrop/2019/10/31/12/29/resized_dc9f5-7ac9f345palestarrest.jpg,"Roughly 5,700 Palestinians are currently languishing in Israeli detention facilities"
191,https://www.politico.com/news/2019/10/31/google-political-ads-063429,POLITICO,https://www.politico.com/news/2019/10/31/google-political-ads-063429,Eyes turn to Google as political ads divide Silicon Valley,https://static.politico.com/9f/23/53737b9a47b9943d6a097decdb6c/190611-google-gty-773.jpg,Pressure is building for Google to pick a side between the positions staked out by Facebook and Twitter's chief executives.
192,,,,,,
193,,,,,,
194,http://www.pina.com.fj/index.php?p=pacnews&m=read&o=4566703335dba0a756fc1008ae5421,,http://www.pina.com.fj/index.php?p=pacnews&m=read&o=4566703335dba0a756fc1008ae5421,60 Minutes reporter Liam Bartlett and TV crew detained in Kiribati to return back today ,http://www.pina.com.fj/x-2/picture/news/thumb301019fc100860S.jpg,"
	A Channel Nine reporter and a crew from 60 Minutes have been detained in a hotel on the Pacific island archipelago of Kiribati after they arrived in the country without appropriate media"
195,https://www.jpost.com/Middle-East/With-help-and-love-Volunteers-who-went-to-Syria-to-aid-those-fleeing-war-606462, The Jerusalem Post | JPost.com ,https://www.jpost.com/Middle-East/With-help-and-love-Volunteers-who-went-to-Syria-to-aid-those-fleeing-war-606462,With help and love: Volunteers who went to Syria to aid those fleeing war,"https://images.jpost.com/image/upload/f_auto,fl_lossy/t_JD_ArticleMainImageFaceDetect/448415","While many other western NGOs and journalists left after October 13, fearing the Syrian regime might take over some area the US was leaving, FBR was going forward."
196,,,,VVIPs among poachers in Peninsular forests: IGP | Daily Express Online - Sabah's Leading News Portal,http://www.dailyexpress.com.my/uploads/news2/2019/10/Hamid-Bador-(keep-in-vip).jpg,Police on Wednesday disclosed that VVIPs (Very Very Important Persons) have been identified among those allegedly involved in illegal hunting in the forests in Peninsular Malaysia
197,https://english.vov.vn/content/MjQ5MjQy.vov,VOV - VOV Online Newspaper,https://english.vov.vn/content/MjQ5MjQy.vov,Seminar discusses ways to combat sugar smuggling,https://image-english.vov.vn/w400/Uploaded/TmT2B47lHgLy8UZVeuKg/2019_10_31/48062_hg103034_OBEI.jpg,"Reducing smuggling of sugar into Vietnam requires strengthening of preventive measures and co-ordination among relevant agencies, further lowering of sugar production costs and requiring sugar to have clear origin details among other things, a seminar heard in HCM City on October 29."
198,https://www.unionleader.com/news/politics/granite_status/granite-status-buttigieg-files-for-new-hampshire-primary/article_a80c358c-7879-5d2b-aaa6-5f1dc96a184b.html,UnionLeader.com,https://www.unionleader.com/news/politics/granite_status/granite-status-buttigieg-files-for-new-hampshire-primary/article_a80c358c-7879-5d2b-aaa6-5f1dc96a184b.html,Granite Status: Buttigieg files for New Hampshire primary,https://bloximages.newyork1.vip.townnews.com/unionleader.com/content/tncms/assets/v3/editorial/5/ea/5eadcaed-844b-574b-b0b0-61abaef9183c/5dba368997fdb.image.jpg?resize=1045%2C630,By Josie Albertson-Grove
199,https://www.premiumtimesng.com/news/top-news/360448-malabu-jonathans-bodyguards-identity-generates-confusion-in-italian-court.html,Premium Times Nigeria,https://www.premiumtimesng.com/news/top-news/360448-malabu-jonathans-bodyguards-identity-generates-confusion-in-italian-court.html,MALABU: Jonathan’s bodyguard’s identity generates confusion in Italian,https://i0.wp.com/media.premiumtimesng.com/wp-content/files/2017/12/Shell-and-Eni.jpg?fit=800%2C450&ssl=1,The Malabu scandal involved the transfer of about $1.1 billion by Shell and ENI through the Nigerian government to accounts controlled by a former Nigerian
200,https://www.ajc.com/news/state--regional-govt--politics/kemp-unveils-proposals-overhaul-georgia-individual-health-plans/goksGHgRkJzvYBXQGIE8sJ/,ajc,https://www.ajc.com/news/state--regional-govt--politics/kemp-unveils-proposals-overhaul-georgia-individual-health-plans/goksGHgRkJzvYBXQGIE8sJ/,Kemp unveils proposals to overhaul Georgia individual health plans ,https://www.ajc.com/rf/image_large/Pub/p10/AJC/2019/10/31/Images/Kemp%20health.jpg,Georgia Gov. Brian Kemp's plan would invest in reinsurance with a goal of lowering premiums. Web brokers would also become part of the process.
201,,,,,,
202,http://www.slguardian.org/search/label/S.V.Kirubaharan,Sri Lanka Guardian,http://www.slguardian.org/search/label/S.V.Kirubaharan,Sri Lanka Guardian,,Dare When Other’s Don’t
203,,Star Tribune,,The latest from the StarTribune,http://assets.startribune.com/static/img/branding/logos/strib-social-card.png?d=1579800756,"Follow the StarTribune for the news, photos and videos from the Twin Cities and beyond."
204,,,,,,
205,,Punch Newspapers,,"UPDATED: How Mompha, Lebanese friend, laundered N33bn - Magu",https://cdn.punchng.com/wp-content/uploads/2019/10/22170313/Mompha4.png,
206,https://www.boston.com/news/crime/2019/10/31/foxborough-police-warn-residents-of-fraud-scam-believed-to-be-linked-to-mailbox-fishing,Boston.com,https://www.boston.com/news/crime/2019/10/31/foxborough-police-warn-residents-of-fraud-scam-believed-to-be-linked-to-mailbox-fishing,Foxborough police warn residents of fraud scam believed to be linked to ‘mailbox fishing’,https://www.boston.com/wp-content/uploads/2019/10/76184067_2702885683095637_2068549450543923200_n-850x478.jpg,"A USPS spokesperson said blue mail collection boxes around the Greater Boston area are being replaced with newer, more secure ones."
207,,,,,,
208,https://www.telegraph.co.uk/news/2019/10/31/australian-government-proposes-facial-recognition-system-verify/,The Telegraph,https://www.telegraph.co.uk/news/2019/10/31/australian-government-proposes-facial-recognition-system-verify/,Australian government proposes facial recognition system to verify age for internet pornography,https://www.telegraph.co.uk/content/dam/news/2019/10/31/TELEMMGLPICT000137981947-xlarge_trans_NvBQzQNjv4Bqo6V3cvctqdfs7HwV5UCM9-F9Jwt3igdaYAdw0hU_F8Q.jpeg?imwidth=1200,The Australian government has proposed using facial recognition scans to verify the age of internet users seeking to access pornography.
209,,,,,,
210,https://www.fox5atlanta.com/news/the-backstory-of-the-viral-california-wildfire-wedding-photo,FOX 5 Atlanta,https://www.fox5atlanta.com/news/the-backstory-of-the-viral-california-wildfire-wedding-photo,The backstory of the viral California wildfire wedding photo,https://images.foxtv.com/static.fox5atlanta.com/www.fox5atlanta.com/content/uploads/2019/10/724/407/855e84b9-KMRphotography-Kincade-Fire.jpg?ve=1&tl=1,A Castro Valley photographer shot a wedding photo of a couple wearing air filtration masks and standing in a vineyard not far from the Kincade Fire. The image has gone viral on the internet.
211,https://www.australasianlawyer.com.au/news/pexa-introduces-generous-parentalsupport-policies-267801.aspx,Australasian Lawyer,https://www.australasianlawyer.com.au/news/pexa-introduces-generous-parentalsupport-policies-267801.aspx,PEXA introduces generous parental-support policies,https://cdn-res.keymedia.com/cms/images/au/121/0353_637081472466793408.jpg,"Policies support millennials, the “best educated, most social connected and dedicated participants in the workforce,” says CEO"
212,https://vietnamnet.vn/en/society/labor-exports-hard-earned-money-and-desolated-villages-583518.html,VietNamNet,https://vietnamnet.vn/en/society/labor-exports-hard-earned-money-and-desolated-villages-583518.html,Labor exports: Hard-earned money and desolated villages - VietNamNet,https://vnn-imgs-f.vgcloud.vn/2019/10/30/16/5.jpg,"Labor export has been a common practice for poverty-stricken provinces of Vietnam for many years, both via legal and irregular gateways. "
213,https://www.bangkokpost.com/thailand/general/1783484/local-poll-preparations-well-in-hand-govt-says,https://www.bangkokpost.com,https://www.bangkokpost.com/thailand/general/1783484/local-poll-preparations-well-in-hand-govt-says,"Local poll preparations well in hand, govt says",https://static.bangkokpost.com/media/content/20191031/c1_1783484_191031072223_700.jpg,"Preparations for the staging of local elections expected next year are well in hand, the Interior Ministry's Department of Local Administration says."
214,https://www.forbes.com/sites/kenrapoza/2019/10/31/pompeo-chinas-government-is-the-problem/,Forbes,https://www.forbes.com/sites/kenrapoza/2019/10/31/pompeo-chinas-government-is-the-problem/,Pompeo: China’s Government Is The Problem,https://thumbor.forbes.com/thumbor/600x315/https%3A%2F%2Fspecials-images.forbesimg.com%2Fimageserve%2F74ae56495b684134bc3dffe5e7a6ee91%2F960x0.jpg%3FcropX1%3D0%26cropX2%3D2232%26cropY1%3D113%26cropY2%3D1369,Secretary of State Mike Pompeo says the U.S. has no qualms with the Chinese people. Washington's fight is with the Communist Party.
215,,,,,,
216,,,,,,
217,,,,,,
218,https://en.globes.co.il/en/article-record-subsidies-for-public-transport-fail-to-relieve-traffic-jams-1001305545,,https://en.globes.co.il/en/article-record-subsidies-for-public-transport-fail-to-relieve-traffic-jams-1001305545,Record public transport subsidies fail to relieve traffic jams,https://images.globes.co.il/images/NewGlobes/big_image_800/2017/Picture3800.jpg,&nbsp;
219,,,,,,
220,https://ottawacitizen.com/news/local-news/hate-crime-investigator-probing-sexist-slur-on-mckennas-campaign-office,Ottawa Citizen,https://ottawacitizen.com/news/local-news/hate-crime-investigator-probing-sexist-slur-on-mckennas-campaign-office,Hate crime investigator probing sexist slur on Catherine McKenna's campaign office,https://postmediaottawacitizen2.files.wordpress.com/2019/10/ottmckennaoct25-2.jpg,"A hate crime investigator is now looking into the sexist slur spray-painted across the face of a Catherine McKenna campaign office window last week, Ottawa police confirmed on Thursday. It’s …"
221,https://www.businessghana.com/,BusinessGhana,https://www.businessghana.com/,Farmers in Central Tongu benefit from Government's Flagship programmes,http://www.businessghana.com/site/img/logo.png,"A total of 14,215 farmers in the Central Tongu Municipality has been registered and given farm inputs under the planting for food and job (PFJ)..."
222,,,,,,
223,https://abc7.com/5661174/,ABC7 Los Angeles,https://abc7.com/5661174/,"Jurupa Valley brush fire erupts after police chase ends in fiery crash, spreads to 360 acres; 2 arrested",https://cdn.abcotvs.com/dip/images/5662347_46-fire-split.jpg?w=1600,Several structures were destroyed by a brush fire that was sparked by a crash at the end of a police chase and went on to blacken at least 360 acres in Jurupa Valley.
224,,,,,,
225,https://www.ibtimes.sg/72-killed-train-pakistan-catches-fire-second-incident-since-july-same-town-33771,"International Business Times, Singapore Edition",https://www.ibtimes.sg/72-killed-train-pakistan-catches-fire-second-incident-since-july-same-town-33771,"72 killed as train in Pakistan catches fire, second incident since July in same town",https://data.ibtimes.sg/en/full/9493/angry-south-african-commuters-torch-trains-riot-cape-town-railway-station.jpg,"A fire that broke out in a train in Pakistan, plying between Karachi and Rawalpindi, left more than 70 dead and about 40 injured."
226,https://www.theday.com/article/20191031/OP01/191039870,The Day,https://www.theday.com/article/20191031/OP01/191039870,Time is right for Sabilia to lead Waterford,https://www.theday.com/Assets/images/facebook/TheDay_Facebook_OG-360px.png,"In Waterford, voters will have the choice for first selectman among two candidates well qualified for the job. Each has experience in local"
227,,,,,,
228,,Sri Lanka News - Newsfirst,,Professor Ananda Samarasekara ordered to be arrested - Sri Lanka Latest News,https://cdn.newsfirst.lk/english-uploads/2019/10/a9c81a5a-1866eb9b-dr-ananda-samarasekara-2379a92a_850x460_acf_cropped.jpg,"COLOMBO(News 1st) - Colombo Additional Magistrate Shalani Perera issued a warrant today (October 31) for the arrest of Professor Ananda Samarasekara, the - Get the latest breaking news and top stories from Sri Lanka, the latest political news, sports news, weather updates, exam results, business news, entertainment news, world news and much more from News 1st, Sri Lanka's leading news network."
229,https://uk.news.yahoo.com/hulk-hogan-survives-frightening-plane-223519476.html,,https://uk.news.yahoo.com/hulk-hogan-survives-frightening-plane-223519476.html,Hulk Hogan Survives Frightening Plane Landing in Iceland: 'Blew Out the Tires & Brakes Have Melted',https://s.yimg.com/uu/api/res/1.2/GBi4ioTdBU5pI_mj2qdoOA--~B/aD0xODAwO3c9MjcwMDtzbT0xO2FwcGlkPXl0YWNoeW9u/https://media.zenfs.com/en/people_218/f4ad8855ecce83db4bad5aab2cc047e8,Hulk Hogan Survives Scary Plane Landing in Iceland
230,https://www.irishtimes.com/business/manufacturing/bombardier-workers-breathe-sigh-of-relief-as-sale-of-northern-plant-agreed-1.4067977,The Irish Times,https://www.irishtimes.com/business/manufacturing/bombardier-workers-breathe-sigh-of-relief-as-sale-of-northern-plant-agreed-1.4067977,Bombardier workers breathe sigh of relief as sale of Northern plant agreed,https://www.irishtimes.com/image-creator/?id=1.4067975&origw=1440,"$1.1bn deal secures future of Belfast, Moroccan and Dallas plants"
231,https://www.cpr.org/2019/10/31/colorado-driven-core-act-passes-us-house-but-faces-dim-senate-prospects/,Colorado Public Radio,https://www.cpr.org/2019/10/31/colorado-driven-core-act-passes-us-house-but-faces-dim-senate-prospects/,Colorado-Driven CORE Act Passes US House But Faces Dim Senate Prospects,"https://i0.wp.com/wp-cpr.s3.amazonaws.com/uploads/2019/10/AP_19253824842816.jpg?resize=1200,600","The measure would protect 400,000 acres of public lands, including 73,000 acres of new wilderness areas."
232,,,,,,
233,,,,,,
234,https://www.gov.uk/government/speeches/burundi-continues-to-constitute-a-threat-to-international-peace-and-security,GOV.UK,https://www.gov.uk/government/speeches/burundi-continues-to-constitute-a-threat-to-international-peace-and-security,Burundi continues to constitute a threat to international peace and security,https://assets.publishing.service.gov.uk/government/uploads/system/uploads/feature/image/74035/WhatsApp_Image_2019-10-31_at_12.34.31.jpeg,"Statement by David Clay, UK Political Coordinator at the UN, at the Security Council briefing on the situation in Burundi"
235,https://www.postregister.com/news/education/idaho-falls-high-school-s-science-classes-could-see-full/article_b7c29926-b934-5980-aecc-55d8ad31bbab.html,Post Register,https://www.postregister.com/news/education/idaho-falls-high-school-s-science-classes-could-see-full/article_b7c29926-b934-5980-aecc-55d8ad31bbab.html,Idaho Falls High School's science classes could see full rebuild in 10-year plan,https://bloximages.chicago2.vip.townnews.com/postregister.com/content/tncms/assets/v3/editorial/a/b3/ab322b6e-f4d8-5c73-8046-22eb9f1cc709/5dba1f914fd59.image.jpg?resize=1119%2C630,"One stretch of hallway floor in Idaho Falls High School has been marked with a series of lines. They’re tick marks, evenly spaced along the floor."
236,https://www.weny.com/story/41252811/cayuga-medical-hosts-ladies-night-out,,https://www.weny.com/story/41252811/cayuga-medical-hosts-ladies-night-out,Cayuga medical hosts ,https://WENY.images.worldnow.com/images/18899804_G.jpg?lastEditedDate=1572480044000,"Ithaca, NY (WENY) -- Cayuga medical center hosted a live seminar for women. Ladies Night Out brought over a dozen care practitioners and medical professions to speaking on a number of topics. Pink ..."
237,https://www.morningbrew.com/the-turnout/stories/2019/10/30/elizabeth-warren-announces-labor-reform-plan,,https://www.morningbrew.com/the-turnout/stories/2019/10/30/elizabeth-warren-announces-labor-reform-plan,Elizabeth Warren Announces Labor Reform Plan,https://morningbrew-oslo.s3.us-west-2.amazonaws.com/1570565136.jpg,This could be a game-changer
238,https://www.firstpost.com/world/pentagon-releases-first-images-of-raid-on-is-leader-abu-bakr-al-baghdadi-warns-militant-group-may-attempt-to-stage-retribution-attack-7577161.html,Firstpost,https://www.firstpost.com/world/pentagon-releases-first-images-of-raid-on-is-leader-abu-bakr-al-baghdadi-warns-militant-group-may-attempt-to-stage-retribution-attack-7577161.html,"Pentagon releases first images of raid on IS leader Abu Bakr al-Baghdadi, warns militant group may attempt to stage 'retribution attack' - Firstpost",https://images.firstpost.com/wp-content/uploads/2019/04/Abu-Bakr-al-Baghdadi_1280.jpg,The Pentagon on Wednesday released its first images from last weekend’s commando raid in Syria that led to the death of Islamic State leader Abu Bakr al-Baghdadi and warned the militant group may attempt to stage a retribution attack
239,https://www.foxnews.com/world/russia-ukraine-nato-putin-zelensky-stoltenberg,Fox News,https://www.foxnews.com/world/russia-ukraine-nato-putin-zelensky-stoltenberg,"Russia must withdraw troops from Ukraine, NATO chief says",https://static.foxnews.com/foxnews.com/content/uploads/2019/01/ContentBroker_contentid-5d7a7b9ec6ed4df592192ee8f19e7c7a.png,"Jens Stoltenberg, secretary general of the North Atlantic Treaty Organization (NATO), said this week that Russia should withdraw all troops from war-torn Eastern Ukraine, where armed conflict between Moscow-backed separatists and Ukrainians has been ongoing for more than five years."
240,https://www.tribuneindia.com/news/archive/“impracticable-and-unreasonable-indeed”-854342,Tribuneindia News Service,https://www.tribuneindia.com/news/archive/“impracticable-and-unreasonable-indeed”-854342,“Impracticable and Unreasonable indeed”!,https://www.tribuneindia.com/images/Logo_eng.png,
241,,,,,,
242,,,,,,
243,https://www.smh.com.au/national/monaco-rich-listers-plead-guilty-to-bribery-corruption-after-media-exposure-20191031-p5362m.html,The Sydney Morning Herald,https://www.smh.com.au/national/monaco-rich-listers-plead-guilty-to-bribery-corruption-after-media-exposure-20191031-p5362m.html,"Monaco rich-listers plead guilty to bribery, corruption after media exposure",https://static.ffx.io/images/$zoom_1%2C$multiply_0.7554%2C$ratio_1.777778%2C$width_1059%2C$x_44%2C$y_0/t_crop_custom/q_86%2Cf_auto/8e48f72543e9ceb2df7be0206ef653d7ce55dc16,The Age and The Sydney Morning Herald faced down a legal and public relations campaign to reveal that dozens of blue-chip companies used Unaoil to corruptly win oil contracts.
