,source_url,site_name,site_url,title,img_url,description
225,https://abcnews.go.com/International/wireStory/militants-kill-truck-driver-indian-controlled-kashmir-66278732,ABC News,https://abcnews.go.com/International/wireStory/militants-kill-truck-driver-indian-controlled-kashmir-66278732,"Police arrest Kashmir protesters, rebels kill truck driver",https://s.abcnews.com/images/International/WireAP_57020c869b3b42dd980b79a87e46b80d_16x9_992.jpg,Police in Indian-controlled Kashmir have arrested 13 women for holding an anti-India protest and two suspected militants shot and killed a truck driver near an apple orchard where he had picked up fruit boxes
226,https://www.dhakatribune.com/world/south-asia/2019/10/15/rajapakse-vows-to-scrap-sri-lanka-war-crimes-probe-if-elected,Dhaka Tribune,https://www.dhakatribune.com/world/south-asia/2019/10/15/rajapakse-vows-to-scrap-sri-lanka-war-crimes-probe-if-elected,Rajapakse vows to scrap Sri Lanka war crimes probe if elected,https://eng-media.dhakatribune.com/?width=476&height=249&cropratio=16:9&quality=100&image=/uploads/2019/10/untitled-1-1570690106137.jpg,"Gotabhaya was defence secretary during his brother&#39;s rule, when troops were accused of killing up to 40,000 Tamil civilians while crushing the Tamil Tigers"
227,https://elclasificado.com/losangeles/career-colleges?exp=true,El Clasificado,https://elclasificado.com/losangeles/career-colleges?exp=true,Career Colleges en Los Angeles,,"Career Colleges en Los Angeles. Escuelas Tecnicas, Trade Schools, servicios de Career Colleges."
228,https://www.novinite.com/articles/200949/Heavy+Traffic+at+Kapitan+Andreevo+and+Lesovo+Border+Checkpoints,,https://www.novinite.com/articles/200949/Heavy+Traffic+at+Kapitan+Andreevo+and+Lesovo+Border+Checkpoints,Heavy Traffic at Kapitan Andreevo and Lesovo Border Checkpoints - Novinite.com - Sofia News Agency,https://www.novinite.com/media/images/2019-10/photo_verybig_200949.jpg,"At the Turkish border at Kapitan Andreevo and Lesovo checkpoints, there is heavy traffic of trucks exiting the country, the press office of the Border Police said at 01:00 pm.  At the border with the Republic of Northern Macedonia at Zlatarevo checkpoint, traffic is tied up due to repair and construction works."
229,https://www.nzherald.co.nz/rotorua-daily-post/news/news/article.cfm?c_id=1503437&objectid=12274830,NZ Herald,https://www.nzherald.co.nz/rotorua-daily-post/news/news/article.cfm?c_id=1503437&objectid=12274830,Clive Fugill master carver says design award the 'crowning glory' of his career,https://www.nzherald.co.nz/resizer/XCNTvMiH5I3r9wX2l62ZIKfpqsM=/1200x0/smart/filters:quality(70)/arc-anglerfish-syd-prod-nzme.s3.amazonaws.com/public/AOPXGMRI6FHFREHX6HXURSEQRE.jpg,The master carver has spent almost 53 years at Te Puia.
230,,,,,,
231,,,,,,
232,https://kdhnews.com/news/region/academy-teacher-investigation-not-criminal-in-nature-superintendent-says/article_16ea0bd9-7f68-5c1b-9728-b3ca0f7d79f1.html,The Killeen Daily Herald,https://kdhnews.com/news/region/academy-teacher-investigation-not-criminal-in-nature-superintendent-says/article_16ea0bd9-7f68-5c1b-9728-b3ca0f7d79f1.html,"Academy teacher investigation not criminal in nature, superintendent says",https://bloximages.newyork1.vip.townnews.com/kdhnews.com/content/tncms/assets/v3/editorial/f/41/f4126bab-75d7-5be6-9d94-d2b51a611481/5d289f0159226.image.jpg?resize=760%2C570,LITTLE RIVER-ACADEMY — Academy Independent School District Superintendent Billy Harlan said Tuesday the investigation into a teacher wasn’t criminal in nature.
233,https://www.tribuneindia.com/news/archive/tackling-terror-with-smart-seamless-grid-847286,Tribuneindia News Service,https://www.tribuneindia.com/news/archive/tackling-terror-with-smart-seamless-grid-847286,"Tackling terror with smart, seamless grid",https://images.tribuneindia.com/cms/gall_content/2019/10/2019_10$largeimg15_Tuesday_2019_063828614.jpg,National Security Adviser Ajit Doval&rsquo;s statement that Pakistan is under immense pressure from the Financial Action Task Force (FATF) to rein in terror groups operating from its soil comes weeks after Home Minister Amit Shah announced the resurrection of the National Intelligence Grid (NATGRID).
234,https://www.columbian.com/news/2019/oct/15/fort-worth-officer-released-on-bond-after-murder-charge/,The Columbian,https://www.columbian.com/news/2019/oct/15/fort-worth-officer-released-on-bond-after-murder-charge/,Fort Worth officer released on bond after murder charge,https://pcdn.columbian.com/wp-content/uploads/2019/10/Police_Shooting_in_Home_Texas_49184-1.jpg-9eada-1.jpg,"FORT WORTH, Texas (AP) — The furor Tuesday over the killing of a black woman by a white Fort Worth officer became increasingly about a gun pointed at a bedroom window. But the police chief and activis"
235,,,,,,
236,https://www.business-standard.com/article/news-ani/china-urges-turkey-to-stop-military-action-in-syria-119101501002_1.html,,https://www.business-standard.com/article/news-ani/china-urges-turkey-to-stop-military-action-in-syria-119101501002_1.html,China urges Turkey to stop 'military action' in Syria,https://bsmedia.business-standard.com/_media/bs/img/article/default/1191015/full-119101501002.jpg,"China on Tuesday called on Turkey to stop its ""military action"" in northern Syria and ""return to the correct way of political resolution"".""The sovereignty, independence, unification, and territorial integrity of Syria should be respected and"
237,https://www.bbc.com/news/science-environment-50036823,BBC News,https://www.bbc.com/news/science-environment-50036823,Yikes! Fox and rodent battle is top wildlife photo,https://ichef.bbci.co.uk/news/1024/branded_news/11A0A/production/_109220227_body_yongqing-bao.jpg,A shot of a predator-prey confrontation wins the 2019 Wildlife Photographer of the Year competition.
238,https://uk.reuters.com/article/uk-global-crude-shipping-idUKKBN1WU2ZC,U.K.,https://uk.reuters.com/article/uk-global-crude-shipping-idUKKBN1WU2ZC,U.S.-Asia oil shipping rates slip from record highs as tanker fears ease,https://s4.reutersmedia.net/resources/r/?m=02&d=20191015&t=2&i=1441264518&w=1200&r=LYNXMPEF9E20U,Freight rates to ship U.S. crude to Asia eased on Tuesday from record levels as ...
239,https://www.floridatoday.com/story/opinion/2019/10/15/letters-and-feedback-oct-16-2019/3967308002/,Florida Today,https://www.floridatoday.com/story/opinion/2019/10/15/letters-and-feedback-oct-16-2019/3967308002/,"Letters and feedback: Oct. 16, 2019","https://www.gannett-cdn.com/presto/2019/10/15/PBRE/d1c25e12-aabe-4d47-b500-cfe9e57e181d-Civility_Brevard_at_Ossorio_6.jpg?crop=4856,2732,x0,y152&width=3200&height=1680&fit=bounds",Readers share views in Letters to the Editor
240,http://www.theguardian.pe.ca/news/world/south-korea-unveils-fighter-jet-mock-up-amid-program-challenges-363818/,,http://www.theguardian.pe.ca/news/world/south-korea-unveils-fighter-jet-mock-up-amid-program-challenges-363818/,South Korea unveils fighter jet mock-up amid program challenges | The Guardian,https://www.theguardian.pe.ca/media/photologue/photos/cache/south-korea-unveils-fighter-jet-mock-up-amid-program-challenges_medium,"By Josh Smith and Ju-min Park SEONGNAM, South Korea (Reuters) - South Korea has displayed the first full-size mock-up of the KF-X fighter jet it is developing with Indonesia, after officials said the program passed key design reviews in September.   "
241,https://www.express.co.uk/news/politics/1190862/brexit-news-Antti-Rinne-boris-johnson-brexit-deal-eu-summit,Express.co.uk,https://www.express.co.uk/news/politics/1190862/brexit-news-Antti-Rinne-boris-johnson-brexit-deal-eu-summit,It’s all over! Johnson warned UK out of time to strike Brexit deal before summit,https://cdn.images.express.co.uk/img/dynamic/139/750x445/1190862.jpg,FINLAND’S Prime Minister Antti Rinne has warned Boris Johnson there is no time to strike a Brexit deal before the EU summit later this week.
242,/news/crime-and-courts/4612821-Pastor-accused-of-swindling-70000-from-Prinsburg-couple,West Central Tribune,/news/crime-and-courts/4612821-Pastor-accused-of-swindling-70000-from-Prinsburg-couple,"Pastor accused of swindling $70,000 from Prinsburg couple | West Central Tribune",https://www.wctrib.com/incoming/4718058-jzvr0i-ortenblad.erick.WEB.png/alternates/BASE_LANDSCAPE/ortenblad.erick.WEB.png,"A New London man is charged with swindling a Kandiyohi County couple of $70,000. He allegedly gained their trust by visiting them and praying over them, then asked for a loan to purchase property for his new church. Instead, he’s accused of using the money to repay a debt and never bought the property.
"
243,https://www.sfgate.com/news/bayarea/article/Police-Seeking-Suspect-Who-Stole-Salvador-Dali-14536747.php,SFGate,https://www.sfgate.com/news/bayarea/article/Police-Seeking-Suspect-Who-Stole-Salvador-Dali-14536747.php,Police Seeking Suspect Who Stole Salvador Dali Artwork From Gallery,https://www.sfgate.com/img/pages/article/opengraph_default.png,"SAN FRANCISCO (BCN)   Police are looking for the suspect who walked into an art gallery  near San Francisco's Union Square on Sunday and stole a piece of art by the  famed Spanish artist Salvador Dali.   According to police, the suspect entered the gallery, located in  the 300 block of Geary Street, sometime between 4:40 and 5:45 p.m.   The suspect then took the artwork, described by police as an  etching, before taking off.   The Police Department's burglary detail is working to find the  suspect and retrieve the valuable etching.   Police are asking anyone with information about the theft to  contact the San Francisco police 24-hour tip line at (415) 575-4444 or to  text-a-tip to TIP411 with the words ""SFPD"" at the beginning of the message.  Tipsters can remain anonymous.    
  Copyright © 2019 by Bay City News, Inc. Republication, Rebroadcast or any other Reuse without the express written consent of Bay City News, Inc. is prohibited."
244,http://news.trust.org/item/20191014223412-b9zc5/,news.trust.org,http://news.trust.org/item/20191014223412-b9zc5/,"No choice but to invest in oil, Shell CEO says","https://d2sh4fq2xsdeg9.cloudfront.net/contentAsset/image/2926c531-6073-48df-b7ff-efecdad6e6bb/image/byInode/1/filter/Resize,Jpeg/jpeg_q/70/resize_w/1100",Shell and other big energy firms have long insisted that switching away from oil and gas to cleaner sources of energy will take decades as demand for transport and plastics continues to grow
245,https://www.premiumtimesng.com/news/top-news/357811-some-ngos-working-with-boko-haram-nigerian-senator.html,Premium Times Nigeria,https://www.premiumtimesng.com/news/top-news/357811-some-ngos-working-with-boko-haram-nigerian-senator.html,Some NGOs working with Boko Haram - Nigerian Senator,https://i1.wp.com/media.premiumtimesng.com/wp-content/files/2017/03/Ali-Ndumee.jpg?fit=640%2C480&ssl=1,"Borno South senator, Ali Ndume, on Tuesday said some non-governmental organisations (NGO) are aiding the operations of Boko Haram insurgents in Borno State."
246,https://montrealgazette.com/news/world/russia-backed-syrian-army-sweeps-in-after-u-s-announces-abrupt-exit/wcm/68b19d0a-c1ee-4989-a1c8-fb11ccf7894d,Montreal Gazette,https://montrealgazette.com/news/world/russia-backed-syrian-army-sweeps-in-after-u-s-announces-abrupt-exit/wcm/68b19d0a-c1ee-4989-a1c8-fb11ccf7894d,"U.S. fully withdraws from Syria, leaving Assad and Russia's forces to fill vacuum",https://postmediamontrealgazette2.files.wordpress.com/2019/10/afp_1le91s-e1571071623360.jpg,"Within 24 hours of the American evacuation, the Kurds called upon Assad and his allies to push back against Turkey’s invasion"
247,https://ghananewsagency.org/economics/ideg-educates-citizens-on-mmdas-budgeting-and-action-planning-processes-157944,,https://ghananewsagency.org/economics/ideg-educates-citizens-on-mmdas-budgeting-and-action-planning-processes-157944,IDEG educates citizens on MMDAs budgeting and action planning processes,https://ghananewsagency.org/assets/images/institute-for-democratic-governance-(ideg).png,
248,https://windsorstar.com/news/local-news/toronto-area-men-face-weapons-drug-charges-after-opp-stops-vehicle-near-chatham/wcm/828f1c5f-6e8b-4762-8e2f-b1125b58fb0a,Windsor Star,https://windsorstar.com/news/local-news/toronto-area-men-face-weapons-drug-charges-after-opp-stops-vehicle-near-chatham/wcm/828f1c5f-6e8b-4762-8e2f-b1125b58fb0a,"Toronto-area men face weapons, drug charges after OPP stops vehicle near Chatham",https://postmediawindsorstar2.files.wordpress.com/2019/10/opp-shoulder-1.jpg,Three Toronto-area men are facing firearms and drug charges after a vehicle was pulled over by an officer with the Chatham-Kent detachment of the Ontario Provincial Police.
249,https://www.clevelandjewishnews.com/jns/netanyahu-to-request-official-pardon-for-na-ama-issachar/article_f15f9b4d-52d4-5f32-a3e7-9175f11dd0fc.html,Cleveland Jewish News,https://www.clevelandjewishnews.com/jns/netanyahu-to-request-official-pardon-for-na-ama-issachar/article_f15f9b4d-52d4-5f32-a3e7-9175f11dd0fc.html,Netanyahu to request official pardon for Na’ama Issachar,https://bloximages.chicago2.vip.townnews.com/clevelandjewishnews.com/content/tncms/custom/image/7278b38c-b303-11e5-a1a2-a31281943715.jpg,"Prime Minister’s Office confirms Israeli premier will formally ask Russian President Vladimir Putin to pardon Israeli-American Na’ama Issachar, who was sentenced on Friday to 7.5 years in prison for drug"
250,https://politi.co/2MF4lqK,POLITICO,https://politi.co/2MF4lqK,The health angles to watch in tonight's debate ,https://static.politico.com/da/f5/44342c424c68b675719324b1106b/politico.jpg,California caps some dialysis rates — CBO gives partial score on House Democrats' drug-price bill
251,,,,,,
252,https://www.wionews.com/world/donald-trumps-lawyer-giuliani-was-paid-500000-to-work-for-company-run-by-arrested-ukrainian-american-businessman-256142,WION,https://www.wionews.com/world/donald-trumps-lawyer-giuliani-was-paid-500000-to-work-for-company-run-by-arrested-ukrainian-american-businessman-256142,"Donald Trump's lawyer Giuliani was paid $500,000 to work for company run by arrested Ukrainian-American businessman",https://cdn.wionews.com/sites/default/files/styles/story_page/public/2018/09/11/13573-2016-11-15t024535z_1_lynxmpecae03j_rtroptp_3_usa-trump-20161115024957.JPG,"President Donald Trump's personal attorney, Rudy Giuliani, was paid $500,000 for work he did for a company co-founded by the Ukrainian-American businessman arrested last week on campaign finance charges, Giuliani told Reuters on Monday."
253,https://www.fox35orlando.com/news/toll-road-task-forces-moving-forward,FOX 35 Orlando,https://www.fox35orlando.com/news/toll-road-task-forces-moving-forward,Toll road task forces moving forward,https://images.foxtv.com/static.fox35orlando.com/www.fox35orlando.com/content/uploads/2019/09/724/407/Florida20toll20road20extensions-plan_1555028720852.jpg_7097622_ver1.0_640_360.jpg?ve=1&tl=1,
254,https://www.leoaffairs.com/,LeoAffairs,https://www.leoaffairs.com/,News,,
255,,,,,,
256,,,,,,
257,https://www.vanguardngr.com/2019/10/ex-students-of-ui-international-schl-donate-n16m-building-to-alma-mater/,Vanguard News,https://www.vanguardngr.com/2019/10/ex-students-of-ui-international-schl-donate-n16m-building-to-alma-mater/,EX-students of UI International Schl donate N16m building to alma mater,https://i0.wp.com/www.vanguardngr.com/wp-content/uploads/2019/10/UI.png?fit=661%2C479&ssl=1,Nigeria News - Vice Chancellor of UI Prof Abel Idowu Olayinka has called on the management of the 56 year-old school not to allow any distraction
258,https://www.kusi.com/white-fort-worth-officer-resigns-after-killing-black-woman/,McKinnon Broadcasting,https://www.kusi.com/white-fort-worth-officer-resigns-after-killing-black-woman/,White Fort Worth officer resigns after killing black woman -,https://images.kusi.com/wp-content/uploads/2019/10/AP_19287577681401-1024x683.jpg,"FORT WORTH, Texas (AP) — A white Fort Worth police officer who shot and killed a black woman in her home while responding to a call about an open front door acted inappropriately and resigned before he could be fired, the police chief said Monday. Atatiana Jefferson, 28, was killed in front her of 8-year-old nephew, cut down by a..."
259,,,,,,
260,https://prospect.org/api/content/e8d9ac10-ef69-11e9-b223-12f1225286c6/,The American Prospect,https://prospect.org/api/content/e8d9ac10-ef69-11e9-b223-12f1225286c6/,The 2020 Foreign-Policy Primary,https://prospect.org/downloads/12879/download/Guyer-FP%20primary%20101519.jpg?cb=b01cb27562bfcab19bc4f7f13ebab4d7&w=1200,"Bernie Sanders, Elizabeth Warren, and Joe Biden are staking out different territory."
261,https://www.theadvocate.com/baton_rouge/opinion/dan_fagan/article_197c7df8-ef55-11e9-9318-4bef99f1dbc7.html,The Advocate,https://www.theadvocate.com/baton_rouge/opinion/dan_fagan/article_197c7df8-ef55-11e9-9318-4bef99f1dbc7.html,"Dan Fagan: Forget the polls, John Bel Edwards an underdog in Louisiana governor's race",https://bloximages.newyork1.vip.townnews.com/theadvocate.com/content/tncms/assets/v3/editorial/1/29/12904913-f94b-5284-851f-db3ce7f0e45a/5da2a15a84edd.image.jpg?resize=999%2C630,"All the pollsters had Gov. John Bel Edwards outpolling his two opponents, U.S. Rep. Ralph Abraham and businessman Eddie Rispone, even when adding together the Republicans' totals. They were wrong,"
262,,,,,,
263,,,,,,
264,http://www.koreatimes.co.kr/www/opinion/2020/01/197_277148.html,koreatimes,http://www.koreatimes.co.kr/www/opinion/2020/01/197_277148.html,Syria - wheels within wheels ,https://ston.koreatimes.co.kr/web/IMAGE/upload/newsV2/images/Gwynne_Dyer_w200_307d8912c4ac6.jpg,Syria - wheels within wheels 
265,https://www.aljazeera.com/indepth/opinion/leaves-haiti-victims-wait-justice-191015090326315.html,,https://www.aljazeera.com/indepth/opinion/leaves-haiti-victims-wait-justice-191015090326315.html,"As the UN leaves Haiti, its victims still wait for justice",https://www.aljazeera.com/mritems/Images/2019/10/15/45d6964703b54e37b9d4cc797ad896ed_18.jpg,It is high time for the UN to take responsibility for the crimes its peacekeeping forces committed in Haiti.
266,,,,,,
267,,United Nations UN Audiovisual Library,,10th Plenary Meeting of General Assembly: 45th Session - Part 1,http://brightcove01.brightcove.com/35/1362235914001/201910/1722/1362235914001_6095095278001_6095093046001-vs.jpg?pubId=1362235914001&videoId=6095093046001,"The General Assembly is addressed by heads of state of Maldives, Nicaragua, and Bangladesh at the 10th plenary meeting of the 45th session."
268,https://www.cio.com/nz/,CIO,https://www.cio.com/nz/,"CIO.com - Tech News, Analysis, Blogs, Video",https://idge.staticworld.net/cio/CIO_logo_300x300.png,"CIO.com delivers the latest tech news, analysis, how-to, blogs, and video for IT professionals. Covers apps, careers, cloud computing, data center, mobile, outsourcing, security, social media, hardware and software."
269,https://www.ajc.com/blog/politics/hunter-biden-interview-and-the-ghost-billy-carter/5FIjlqRv3zvBuycJtcIfpN/,ajc,https://www.ajc.com/blog/politics/hunter-biden-interview-and-the-ghost-billy-carter/5FIjlqRv3zvBuycJtcIfpN/,Hunter Biden's interview and the ghost of Billy Carter ,https://www.ajc.com/rf/image_large/Pub/p10/AJC/2019/10/15/Images/hunterbiden2_20191015174924.PNG,"We often forget that politicians, just like you and me, are subject to the immutable bylaws that gov..."
270,,,,,,
271,https://www.nvdaily.com/nvdaily/federal-court-unseals-eda-documents/article_b451f415-9272-58f6-8caf-8d344c7c383c.html,The Northern Virginia Daily,https://www.nvdaily.com/nvdaily/federal-court-unseals-eda-documents/article_b451f415-9272-58f6-8caf-8d344c7c383c.html,Federal court unseals EDA documents,https://bloximages.newyork1.vip.townnews.com/nvdaily.com/content/tncms/custom/image/f49c34a0-9ca4-11e8-8115-4714fd783b28.png,FRONT ROYAL – Court documents in the U.S. Western District Court of Virginia were unsealed Tuesday and detailed evidence removed from the Front Royal-Warren County Economic Development Authority’s office during
272,https://nypost.com/2019/10/14/the-right-way-to-handle-homeless-mental-illness/,New York Post,https://nypost.com/2019/10/14/the-right-way-to-handle-homeless-mental-illness/,The right way to handle homeless mental illness,https://thenypost.files.wordpress.com/2019/10/skid-row-mental.jpg?quality=90&strip=all&w=1200,"Until February, for 22 years, I managed a business improvement district around the Hollywood Walk of Fame — a top destination for global tourists that bears witness to our country’s abandonment of …"
273,,Burlington County Times,,Man who called in Burlington Township school bomb threat faces numerous weapons charges,https://www.burlingtoncountytimes.com/storyimage/PA/20191015/NEWS/191019288/AR/0/AR-191019288.jpg,"Sharif A. Brooks, 28, of Burlington, allegedly was trying to distract Burlington Township Police from a drug investigation in which he was a suspect. He"
274,,,,,,
275,https://tass.com/world/1083199,TASS,https://tass.com/world/1083199,Seoul seeks Moscow’s support in North Korea denuclearization issue,https://tass.com/img/blocks/common/tass_logo_share_ru.png,"On October 5, the United States and North Korea held negotiations on the denuclearization of the Korean Peninsula. However, the meeting yielded no results"
276,https://www.thebeaverton.com/2019/10/750000-people-trapped-living-in-winnipeg/,The Beaverton,https://www.thebeaverton.com/2019/10/750000-people-trapped-living-in-winnipeg/,"750,000 people trapped living in Winnipeg",https://www.thebeaverton.com/wp-content/uploads/2019/10/Winnipeg-Storm.jpg,"WINNIPEG - The Red Cross is reporting at least 750,000 people are still trapped living in Winnipeg carrying on with their day-to-day lives."
277,https://www.hulldailymail.co.uk/news/hull-east-yorkshire-news/man-dead-east-hull-home-3429049,hulldailymail,https://www.hulldailymail.co.uk/news/hull-east-yorkshire-news/man-dead-east-hull-home-3429049,Man suddenly found dead in east Hull home,https://i2-prod.hulldailymail.co.uk/news/hull-east-yorkshire-news/article3429072.ece/ALTERNATES/s1200/1_Tragically-Kevin-Bean-passed-away-at-just-60-years-old-on-Friday-20-September-in-his-Victor-Street-home-in-Hull.jpg,Police now want to find the family of Kevin Bean
278,https://ghananewsagency.org/education/university-of-ghana-to-have-2-5-megawatt-solar-farm-157988,,https://ghananewsagency.org/education/university-of-ghana-to-have-2-5-megawatt-solar-farm-157988,University of Ghana to have 2.5-megawatt solar farm,https://ghananewsagency.org/assets/images/education-ug-solar.jpg,
279,http://www.kake.com/story/41183298/migration-of-butterflies-dragonflies-shows-up-on-weather-radar,,http://www.kake.com/story/41183298/migration-of-butterflies-dragonflies-shows-up-on-weather-radar,"Migration of butterflies, dragonflies shows up on weather radar",https://KAKE.images.worldnow.com/images/18854486_G.jpg?lastEditedDate=20191015095030,A huge flight of insects was enough to show up on meteorologists' radar in Oklahoma.   
280,https://www.thebatavian.com/tags/suny-brockport,The Batavian,https://www.thebatavian.com/tags/suny-brockport,SUNY Brockport,https://www.thebatavian.com/sites/all/modules/features/site_batavian/batavian.png,
281,https://www.nytimes.com/2019/10/15/us/politics/native-americans-health-care.html,,https://www.nytimes.com/2019/10/15/us/politics/native-americans-health-care.html,"Fed Up With Deaths, Native Americans Want to Run Their Own Health Care",https://static01.nyt.com/images/2019/10/11/us/politics/11dc-indianhealth1-promo2/11dc-indianhealth1-promo-facebookJumbo-v2.jpg,"After decades of enduring poor care from the government-run Indian Health Service, tribal groups are taking over management of hospitals."
282,https://fremonttribune.com/news/local/college-to-offer-medication-aide-class/article_065d2863-ae54-590d-9fc4-3b33c7e2339d.html,Fremont Tribune,https://fremonttribune.com/news/local/college-to-offer-medication-aide-class/article_065d2863-ae54-590d-9fc4-3b33c7e2339d.html,College to offer medication aide class,https://bloximages.chicago2.vip.townnews.com/fremonttribune.com/content/tncms/assets/v3/editorial/3/1b/31b6da11-b9b8-51ca-af86-e66e05e47200/585d6766f3aba.image.jpg?crop=494%2C278%2C125%2C0&resize=494%2C278&order=crop%2Cresize,Northeast Community College in West Point will offer a three-credit medication aide class beginning this month.
283,https://www.rgj.com/story/news/2019/10/15/reno-celebrates-first-indigenous-peoples-day/3982542002/,Reno Gazette Journal,https://www.rgj.com/story/news/2019/10/15/reno-celebrates-first-indigenous-peoples-day/3982542002/,"'It’s a beautiful day to be Indian, indigenous': Reno celebrates first Indigenous People's Day","https://www.gannett-cdn.com/presto/2019/10/15/PREN/b81adf4c-fc87-4b8f-b627-8930880b5a36-Indigenous_Peoples_Day_7.JPG?crop=1999,1125,x0,y0&width=1600&height=800&fit=bounds","For the first time in the Biggest Little City, the second Monday in October was not known as Columbus Day — but as Indigenous People’s Day."
284,https://politi.co/31hqLUi,POLITICO Magazine,https://politi.co/31hqLUi,Beto O’Rourke’s Campaign Found New Meaning in the Gun Debate. But Is He Hurting the Cause?,https://static.politico.com/0f/ff/5486f04c4dcf9c4a33f693562e40/gettyimages-1178738704-1.jpg,The candidate’s proposal for a mandatory buyback has put him at the center of the gun control debate. It’s also alienated fellow Democrats.
285,https://www.sunjournal.com/2019/10/14/new-ice-office-in-downtown-portland-draws-protests/,Lewiston Sun Journal,https://www.sunjournal.com/2019/10/14/new-ice-office-in-downtown-portland-draws-protests/,New ICE office in downtown Portland draws protests,https://multifiles.pressherald.com/uploads/sites/10/2019/10/10888059_20191014_ICE-protest_1-1024x683.jpg,"A spokesperson says the the Homeland Security Investigations office will specialize in transnational criminal probes, not deportations."
286,,,,,,
